"ROSEN, TRUSTED AND LEADING INVESTOR COUNSEL, Reminds Royal Caribbean Cruises Ltd. Investors of Important December 7 Deadline in Securities Class Action; Encourages Investors with Losses in Excess of $100K to Contact Firm - RCL",12/01/2020
"ROSEN, GLOBAL INVESTOR COUNSEL, Reminds JPMorgan Chase & Co. Investors of Important December 23 Deadline in First Filed Securities Class Action Commenced by the Firm; Encourages Investors with Losses in Excess of $100K to Contact the Firm - JPM",12/01/2020
"ROSEN, GLOBAL INVESTOR COUNSEL, Reminds Evolus, Inc. Investors of Important December 15 Deadline in Securities Class Action; Encourages Investors with Losses in Excess of $100K to Contact the Firm - EOLS",12/01/2020
Hewlett Packard Enterprise Company's (HPE) CEO Antonio Neri on Q4 2020 Results - Earnings Call Transcript,12/01/2020
"BlackBerry to Host Investor Fireside Chat to Discuss New Intelligent Vehicle Data Platform, BlackBerry IVY",12/01/2020
Alibaba Nears Deal To Sell Entire Stake In Online Grocer BigBasket To Tata: Report,12/01/2020
Hyundai Motor to launch dedicated EV platform in major push into electric cars,12/01/2020
Loral-Telesat Merger Creates Attractive Call Option On LEO Economics,12/01/2020
"Sally Beauty Holdings, Inc. Announces Participation at the Morgan Stanley Virtual Global Consumer and Retail Conference",12/01/2020
SoftBank winding down options trading after investor backlash: Bloomberg News,12/01/2020
Buy Netgear After Stock's Brief Downtrend Ends,12/01/2020
Meten EdtechX announces management investment in its Likeshuo online business and expansion of option pool,12/01/2020
Fashion retailer Tailored Brands emerges from bankruptcy protection,12/01/2020
"salesforce.com, inc. (CRM) CEO Marc Benioff on Q3 2021 Results - Earnings Call Transcript",12/01/2020
Altimmune: A COVID-19 Winner After All,12/01/2020
Apple Sued For $200M In EU Over Allegations It Deliberately Slowed Down iPhones To Mask Battery Issues,12/01/2020
"Box, Inc. (BOX) CEO Aaron Levie on Q3 2021 Results - Earnings Call Transcript",12/01/2020
"NetApp, Inc. (NTAP) CEO George Kurian on Q2 2021 Results - Earnings Call Transcript",12/01/2020
Cogent Biosciences Announces Pricing of Upsized Public Offering of Shares of Common Stock,12/01/2020
BeiGene Announces Pricing of Public Offering by Selling Shareholders,12/01/2020
Owl Rock Capital Corporation Prices Public Offering of $1.0 Billion 3.400% Notes Due 2026,12/01/2020
Basic-Fit: A Risky Bet On An Unexpected Beneficiary From COVID-19,12/01/2020
"Disney Highlights Original Content Push For Disney+, Hulu As It Consolidates TV Studios",12/01/2020
Li Auto Inc. November 2020 Delivery Update,12/01/2020
"GoPro, Inc. (GPRO) Management Presents at Wells Fargo 2020 Virtual TMT Summit Conference (Transcript)",12/01/2020
"Dropbox, Inc (DBX) Management Presents at NASDAQ 43rd Virtual Investor Conference (Transcript)",12/01/2020
Smith & Wesson: Winning During Pandemic And After Spinoff,12/01/2020
"Palo Alto Networks, Inc. (PANW) CEO Nikesh Arora Presents at Wells Fargo Technology, Media, & Telecommunications Summit 2020 Conference (Transcript)",12/01/2020
ReneSola Ltd (SOL) CEO Yumin Liu on Q3 2020 Results - Earnings Call Transcript,12/01/2020
Tailored Brands Successfully Completes Financial Restructuring,12/01/2020
U.S. oil producer ConocoPhillips to shed up to 500 workers,12/01/2020
CORRECTION – Zoom Reports Results for Third Quarter Fiscal Year 2021,12/01/2020
Why Boeing Shares Gained Altitude in November,12/01/2020
"ROSEN, TRUSTED INVESTOR COUNSEL, Announces Filing of Securities Class Action Lawsuit Against Pinterest, Inc.; Encourages Investors with Losses in Excess of $100K to Contact the Firm - PINS",12/01/2020
"ROSEN, TRUSTED INVESTOR COUNSEL, Reminds K12 Inc. Investors of Important Deadline in Securities Class Action; Encourages Investors with Losses in Excess of $100K to Contact Firm - LRN",12/01/2020
Why Shares of Palantir Technologies Soared Higher in November,12/01/2020
"ROSEN, A TRUSTED LAW FIRM, Reminds JOYY Inc. Investors of Important Deadline in Securities Class Action First Filed by the Firm; Encourages Investors with Losses in Excess of $100K to Contact the Firm - YY",12/01/2020
"ROSEN, TRUSTED INVESTOR COUNSEL, Reminds First American Financial Corp. Investors of Important Deadline in Securities Class Action First Filed by the Firm - FAF",12/01/2020
Salesforce CEO: Buying Slack Is 'Marriage Made in Heaven',12/01/2020
Why Appian Stock Soared in November,12/01/2020
JetBlue Announces Pricing of Common Stock Offering,12/01/2020
"SHAREHOLDER ACTION ALERT: The Schall Law Firm Announces it is Investigating Claims Against Tactile Systems Technology, Inc. and Encourages Investors with Losses to Contact the Firm",12/01/2020
"Reata Pharmaceuticals, Inc. Announces Pricing of Class A Common Stock Offering",12/01/2020
Allena Pharmaceuticals Increases Previously Announced Bought Deal to $13.0 Million,12/01/2020
"Arena Pharmaceuticals, Inc. (ARNA) CEO Amit Munshi Presents at 3rd Annual Evercore ISI HealthCONx Conference (Transcript)",12/01/2020
International Business Machines Corporation (IBM) Management Presents at Credit Suisse 24th Annual Technology Virtual Conference (Transcript),12/01/2020
Rexford Industrial Announces Pricing of Common Stock Offering,12/01/2020
"Fastly, Inc. (FSLY) Presents at 2020 Wells Fargo TMT Summit Conference (Transcript)",12/01/2020
Netflix Plans to Double Spending on Original Content in Asia,12/01/2020
JD Health IPO Raises $3.5 Billion in Hong Kong,12/01/2020
Royal Bank of Canada (RY) CEO Dave McKay on Q4 2020 Results - Earnings Call Transcript,12/02/2020
Starbucks To Provide Free Coffee To COVID-19 First Responders This Holiday Season,12/02/2020
"Progenity, Inc. Prices $75.0 Million Convertible Senior Notes Offering",12/02/2020
Progenity Announces Pricing of Public Offering of Common Stock,12/02/2020
"U.S. Labor Board accuses Google of spying on employees, discouraging worker organization, and retaliation",12/02/2020
"SC Lowy CEO on China Evergrande, Bid for Dewan Housing",12/02/2020
Stitch Fix: Back To Normal,12/02/2020
JPMorgan Chase To Buy Boston FinTech 55ip,12/02/2020
Aptus Defined Risk ETF - Not Your Run-Of-The-Mill Bond ETF Offering,12/02/2020
Vontier Corporation: 12% FCF Yielder With Multiple Expansion Upside,12/02/2020
Snowflake Inc. (SNOW) CEO Frank Slootman on Q3 2021 Results - Earnings Call Transcript,12/02/2020
Semtech Corporation (SMTC) CEO Mohan Maheswaran on Q3 2021 Results - Earnings Call Transcript,12/02/2020
Codexis Announces Pricing of Public Offering of Common Stock,12/02/2020
Corporate Office Properties: Safe 4.2% Yield From Government-Related Tenants,12/02/2020
"Google Violated US Labor Laws By Spying On Workers, Regulator Alleges",12/02/2020
"Five Below, Inc. (FIVE) CEO Joel Anderson on Q3 2020 Results - Earnings Call Transcript",12/02/2020
K92 Mining to Receive the Prestigious Thayer Lindsley Award for Best Global Discovery,12/02/2020
"Kayne Anderson NextGen Energy & Infrastructure Provides Unaudited Balance Sheet Information and Announces its Net Asset Value and Asset Coverage Ratios at November 30, 2020",12/02/2020
"Kayne Anderson Energy Infrastructure Fund Provides Unaudited Balance Sheet Information and Announces its Net Asset Value and Asset Coverage Ratios at November 30, 2020",12/02/2020
Oil Stocks: Buy for 2021?,12/02/2020
"CrowdStrike Holdings, Inc. (CRWD) CEO George Kurtz on Q3 2021 Results - Earnings Call Transcript",12/02/2020
Splunk Inc. (SPLK) CEO Douglas Merritt on Q3 2021 Results - Earnings Call Transcript,12/02/2020
Big 5 Sporting Goods Corp.: Record Margins Support Earnings Momentum,12/02/2020
"CORRECTING and REPLACING GRAPHIC Gaining Momentum: Annual U.S. Home Prices Appreciated 7.3% in October, CoreLogic Reports",12/02/2020
"Synopsys, Inc. (SNPS) Q4 2020 Results - Earnings Call Transcript",12/02/2020
Elastic N.V. (ESTC) CEO Shay Banon on Q2 2021 Results - Earnings Call Transcript,12/02/2020
"Okta, Inc. (OKTA) CEO Todd McKinnon on Q3 2021 Results - Earnings Call Transcript",12/02/2020
dynaCERT Inc. to Webcast Live at VirtualInvestorConferences.com December 3rd 2020,12/02/2020
Kinnate Biopharma Announces Pricing of Initial Public Offering,12/02/2020
"Guess?, Inc. (GES) CEO Carlos Alberini on Q3 2021 Results - Earnings Call Transcript",12/02/2020
"US Congress Clears Bill That Threatens To Delist Chinese Titans Like Alibaba, Pinduoduo, Nio Over Audit Compliance",12/02/2020
XP Inc. Announces Pricing of Public Follow-On Offering,12/02/2020
"SHAREHOLDER ALERT: WeissLaw LLP Investigates Slack Technologies, Inc.",12/02/2020
AerCap: Potential Capital Structure Arbitrage Opportunity,12/02/2020
Sportsman's Warehouse Holdings' (SPWH) CEO Jon Barker on Q3 2020 Results - Earnings Call Transcript,12/02/2020
Oil drops as OPEC+ resume talks on output cut extension after impasse,12/02/2020
Costco logs more than $42B in quarterly sales,12/02/2020
"The TJX Companies, Inc. Announces Early Tender Results and Upsize of Its Cash Tender Offers for Certain Debt Securities",12/02/2020
Avid Bioservices' (CDMO) CEO Nick Green on Q2 2021 Results - Earnings Call Transcript,12/02/2020
"Flowers Foods Issues Voluntary Recall Of Two Canyon Bakehouse Products Distributed In Arkansas, Colorado, Kansas, Louisiana, Mississippi, Missouri, Montana, Nebraska, New Mexico, Oklahoma, South Dakota, Texas, Utah, And Wyoming Due To Possible Presence Of Gluten",12/02/2020
Automatic Data Processing: Increased Dividend Income For 46 Years,12/02/2020
Glass Lewis Recommends Ziopharm Shareholders Vote on the WHITE Consent Card for All of WaterMill's Director Candidates and Proposals,12/02/2020
Arco Platform Limited Closes the Acquisition of Escola da Inteligência,12/02/2020
Outset Medical Announces Pricing of Secondary Public Offering,12/02/2020
Open Text: Still Attractive,12/02/2020
Twist Bioscience Announces Pricing of a $300 Million Upsized Public Offering of Common Stock,12/02/2020
FFO Growth Machines: Tech REITs,12/02/2020
"Workday, Inc. (WDAY) Management Presents at Wells Fargo TMT Conference (Transcript)",12/02/2020
"Google broke labor law by retaliating against workers, federal agency alleges",12/02/2020
A Primer On Texas Roadhouse: A Worthy Buy With 33% Upside,12/02/2020
"The Cooper Companies, Inc. (COO) CEO Al White on Q4 2020 Results - Earnings Call Transcript",12/03/2020
Enbridge: Still Only Priced For Zero Dividend Growth,12/03/2020
Seer Announces Pricing of Initial Public Offering,12/03/2020
Dada Now Partners with Cake Chain Brands across China to Enhance Delivery Process,12/03/2020
"Zuora, Inc. (ZUO) CEO Tien Tzuo on Q3 2021 Results - Earnings Call Transcript",12/03/2020
"Silverback Therapeutics prices IPO at $21/share, will raise $241M in 4th Wash. state IPO of 2020",12/03/2020
Science Applications International Corp (SAIC) CEO Nazzic Keene on Q3 2021 Results - Earnings Call Transcript,12/03/2020
"Smith & Wesson Brands, Inc. (SWBI) CEO Mark Smith on Q2 2021 Results - Earnings Call Transcript",12/03/2020
Skillz: Larger Opportunity Than I Thought,12/03/2020
General Mills: Stable Performer,12/03/2020
"Tesla Remains Only Automaker To Grow In Germany Through November, With 37% Rise In Registrations",12/03/2020
Safety Insurance Group: A Tried And True Income Stock,12/03/2020
Exxon's Moves To Focus On Core Businesses Make It A Holiday Gift For Your Portfolio,12/03/2020
"Ollie's Bargain Outlet Holdings, Inc. (OLLI) CEO John Swygert on Q3 2020 Results - Earnings Call Transcript",12/03/2020
"Ulta Beauty, Inc.'s (ULTA) CEO Mary Dillon on Q3 2020 Results - Earnings Call Transcript",12/03/2020
Silverback Therapeutics Announces Pricing of Initial Public Offering,12/03/2020
Moderna Says It Will Ship 100M-125M COVID-19 Vaccine Doses Worldwide In Q1,12/03/2020
LiqTech International Inc.: Pounding The Table As O&G Takes Shape Plus Black Carbon And NOx Opportunities Are Ahead Of Plan,12/03/2020
"SHAREHOLDER ALERT: WeissLaw LLP Investigates Waddell & Reed Financial, Inc.",12/03/2020
Capital One Replaces Its CFO,12/03/2020
Why Farfetch Stock Jumped 94% Last Month,12/03/2020
"LAZR Stock Price Increases 27.67% In Debut, Makes 25-Year-Old Austin Russell Youngest Billionaire",12/03/2020
Marvell Technology Group Ltd. (MRVL) CEO Matt Murphy on Q3 2021 Results - Earnings Call Transcript,12/03/2020
"Altigen Communications, Inc. (ATGN) CEO Jerry Fleming on Q4 2020 Results - Earnings Call Transcript",12/03/2020
Don't Be Fooled Into Selling the Big Winners of 2021,12/03/2020
Seagate Announces Pricing of $1 Billion of Senior Unsecured Notes,12/03/2020
Why Nano-X Imaging Jumped 122% in November,12/03/2020
Smith & Wesson Brands Crushes Q2 Estimates; New Dividend Declared,12/03/2020
Movies theaters suffer devastating blow as Warner Bros announces streaming plans with HBOMax,12/03/2020
"Mondelez International, Inc. (MDLZ) CEO Dirk Van de Put Presents at Morgan Stanley Virtual Global Consumer & Retail Conference (Transcript)",12/03/2020
"AMC Networks Aligns Cable Network WE TV With Streaming Service UMC, Ups Brett Dismuke To GM Of Both",12/03/2020
"Yext, Inc. (YEXT) CEO Howard Lerman on Q3 2021 Results - Earnings Call Transcript",12/03/2020
"Amazon.com Poised to Fly 25% Higher, Says Analyst",12/03/2020
Pfizer Cuts 2020 Vaccine Rollout Target,12/03/2020
RM LAW Announces Class Action Lawsuit Against JOYY Inc.,12/03/2020
RyanAir to order 75 737Max planes from Boeing,12/03/2020
dynaCERT Announces Voting Results of Annual Meeting,12/03/2020
iQIYI Scores Big Wins at 2020 Golden Rooster Awards,12/03/2020
Verizon Declares Fresh Dividend; Yield Is 4.1%,12/03/2020
"BioCryst Announces FDA Approval of ORLADEYO™ (berotralstat), First Oral, Once-daily Therapy to Prevent Attacks in Hereditary Angioedema Patients",12/03/2020
Juniper Networks Announces Pricing of Senior Notes Offering,12/03/2020
Reliq Health Technologies Inc. Closes Oversubscribed Private Placement,12/03/2020
Oil prices rise as producers agree on supply compromise,12/03/2020
"Rosen, A Global and Leading Law Firm, Reminds Zosano Pharma Corporation Investors of Important Deadline in Securities Class Action; Encourages Investors with Losses in Excess of $100K to Contact Firm - ZSAN",12/03/2020
Find Your Next 10X Winner in the Burgeoning Shroom Boom,12/03/2020
Relevium Issues Corporate Update on MCTO and Operations,12/03/2020
"Tilly's, Inc. (TLYS) CEO Ed Thomas on Q3 2020 Results - Earnings Call Transcript",12/03/2020
Investor Alert: Kaplan Fox Investigates Potential Securities Fraud At Splunk Inc.,12/03/2020
Uber asks U.S. CDC to consider ride-hail drivers essential for COVID-19 vaccine distribution,12/03/2020
WarnerMedia's One-Year Plan Is to Release All 2021 Films on the HBO Max Streaming Service,12/03/2020
Jeff Bezos is pressed by hundreds of politicians around the world to pay more taxes and raise wages,12/04/2020
Bahrain joins U.K. in authorizing emergency use of Pfizer–BioNTech vaccine,12/04/2020
Walgreens Follows Amazon And Walmart Into The Retailer-As-Ad-Agency Trend,12/04/2020
Emerald Bioscience Creates Unique Path to Prevent Blindness Using Patented Synthetic Cannabinoids,12/04/2020
GreenPower Announces Grant of Stock Options,12/04/2020
"ROSEN, A TOP RANKED LAW FIRM, Announces Filing of Securities Class Action Lawsuit Against Splunk Inc.; Encourages Investors with Losses in Excess of $100K to Contact Firm – SPLK",12/04/2020
SHAREHOLDER ALERT: Monteverde & Associates PC Announces an Investigation of Northern Genesis Acquisition Corp. - NGA,12/04/2020
SHAREHOLDER ALERT: Monteverde & Associates PC Announces an Investigation of IHS Markit Ltd. - INFO,12/04/2020
"SHAREHOLDER ALERT: Monteverde & Associates PC Announces an Investigation of Sunesis Pharmaceuticals, Inc. - SNSS",12/04/2020
"SHAREHOLDER ALERT: Monteverde & Associates PC Announces an Investigation of Slack Technologies, Inc. - WORK",12/04/2020
"DEADLINE ALERT: Bragar Eagel & Squire, P.C. Reminds Investors That a Class Action Lawsuit Has Been Filed Against Mesoblast Limited and Encourages Investors to Contact the Firm",12/04/2020
"DEADLINE ALERT: Bragar Eagel & Squire, P.C. Reminds Investors That a Class Action Lawsuit Has Been Filed Against Royal Caribbean Group and Encourages Investors to Contact the Firm",12/04/2020
Movie theaters continue to fight for survival as Warner Bros. announces streaming deal with HBO Max,12/04/2020
SHAREHOLDER ALERT: WeissLaw LLP Investigates Star Peak Energy Transition Corp.,12/04/2020
Interactive Brokers Acquiring Retail Brokerage From Goldman Sachs,12/04/2020
"CooTek to Announce Third Quarter 2020 Unaudited Financial Results on December 15, 2020",12/04/2020
Grupo Aeroportuario del Pacifico Reports Passenger Traffic Decrease of 34.4% for the Month of November,12/04/2020
"Glancy Prongay & Murray LLP, a Leading Securities Fraud Law Firm, Announces the Filing of a Securities Class Action on Behalf of Splunk Inc. (SPLK) Investors",12/04/2020
"Activision's ""Call of Duty"" Franchise Breaks the $3 Billion Barrier in 12 Months",12/04/2020
"Zscaler CEO on Operation Warp Speed, fighting vaccine IP cyberthreats",12/04/2020
"SHAREHOLDER ACTION ALERT: The Schall Law Firm Announces the Filing of a Class Action Lawsuit Against Northern Dynasty Minerals Ltd. and Encourages Investors with Losses in Excess of $500,000 to Contact the Firm",12/04/2020
"Forget Bonds: Try P&G, And Sell Calls",12/04/2020
"Lowe's Stock Could Blast 40% Higher, According to Analyst",12/04/2020
"Azek CEO discusses earnings, plus repair and remodel momentum amid the coronavirus pandemic",12/04/2020
Crowdstrike CEO talks fighting cyberthreats on coronavirus vaccine operations,12/04/2020
Cerus Corporation Announces Presentation of Study Results with INTERCEPT-treated COVID-19 Convalescent Plasma at the American Society of Hematology Annual Meeting,12/04/2020
"Penumbra, Inc. to Participate in CEO Discussion with Bank of America",12/04/2020
"Okta stock up 100% year to date, CEO discusses earning beat on top and bottom lines",12/04/2020
"Logitech Sees Strong Year During Pandemic, Says CEO",12/04/2020
"Disney Cruise Line Drops Anchor, Cancels Departures Through The End Of February",12/04/2020
These Stocks Hold the Key to the Market's Returns in 2021,12/04/2020
"Covid 'Turbocharged' DocuSign Demand That Won't Let Up, Says CEO",12/04/2020
"Kessler Topaz Meltzer & Check, LLP Reminds Raytheon Technologies Corporation f/k/a Raytheon Company Investors of Important Deadline in Securities Fraud Class Action Lawsuit",12/04/2020
Improving Margins Set Stage For Earnings Growth At Albertsons,12/04/2020
Warner Bros. Movies to Hit Theaters and HBO Max at Same Time,12/04/2020
The Wall Street Journal: Netflix sued by Activision Blizzard for allegedly poaching its former CFO,12/04/2020
Why HEXO Dived on Friday While Other Marijuana Stocks Soared,12/04/2020
Next big money opportunity emerging?,12/04/2020
Activision sues Netflix over poaching of former finance chief,12/04/2020
Digital Turbine: Sandwiched Between The 5G Revolution And Mobile Commerce,12/04/2020
DCF: An Attractively Valued High-Yield Target Term Fund With 7.1% Yield And -6.7% Discount,12/04/2020
"RCL ALERT: The Klein Law Firm Announces a Lead Plaintiff Deadline of December 7, 2020 in the Class Action Filed on Behalf of Royal Caribbean Cruises Ltd. Limited Shareholders",12/04/2020
Phoenix Tree: Unlikely To Rise From The Ashes,12/04/2020
Why Snowflake Stock Soared to a New All-Time High Today,12/04/2020
Why Sutro Biopharma Blasted 33% Higher on Friday,12/04/2020
"Final Trades: TUR, EWZ, GM & TSE",12/04/2020
"Freddie Mac Prices $380 Million Multifamily K-Deal, K-L06",12/04/2020
Diversified Royalty Corp. Announces December 2020 Cash Dividend,12/04/2020
Anheuser-Busch's Return To Growth Is Not Yet Priced In,12/04/2020
Vaccine distribution is a real challenge: American Airlines CEO,12/04/2020
"NIO Delivered 5,291 Vehicles In November 2020, Up 109.3% YoY",12/05/2020
Harley Davidson hopes to capture the eBicycle market with its first line of electric bikes,12/05/2020
Here's Why Investors Should Ignore Short-Term Price Swings and Buy DocuSign,12/05/2020
This Stock Could Be One of the Biggest Winners in a Post-Pandemic World,12/05/2020
SHAREHOLDER ALERT: Pomerantz Law Firm Reminds Shareholders with Losses on their Investment in Mesoblast Limited of Class Action Law Suit and Upcoming Deadline - MESO,12/05/2020
"Lufthansa will have shed 29,000 staff by year end: Bild am Sonntag",12/05/2020
"GlycoMimetics' Uproleselan in Combination With Venetoclax/HMA Shown to Break Chemoresistance, Reduce Tumor Burden and Increase Survival in AML Model",12/05/2020
Cellectis Reports Preliminary Results from its Phase 1 BALLI-01 Study of UCART22 in R/R Adult B-ALL at American Society of Hematology (ASH) Annual Meeting,12/05/2020
Regeneron's BCMAxCD3 Bispecific Antibody (REGN5458) Shows Deep and Durable Responses in Patients with Heavily-pretreated Multiple Myeloma in Phase 1,12/05/2020
"ROSEN, TOP RANKED GLOBAL INVESTOR COUNSEL, Reminds K12 Inc. Investors of Important Deadline in Securities Class Action; Encourages Investors with Losses in Excess of $100K to Contact Firm – LRN",12/05/2020
Industrial Real Estate Roundup: Investors capitalize on COVID effects,12/05/2020
"Have $1,000? Here Are 3 Top Healthcare Stocks to Buy in December",12/05/2020
MGM Resorts Taps Into Pennsylvania Gambling With an Online Casino Launch,12/05/2020
"Rosen, Trusted National Trial Counsel, Reminds Celsion Corporation Investors of Important Deadline in Securities Class Action; Encourages Investors with Losses in Excess of $100K to Contact the Firm - CLSN",12/05/2020
Why Zoom Stock Is Down,12/05/2020
3 Hot Stocks to Buy in December,12/05/2020
Autolus Therapeutics presents compelling AUTO1 data from ALLCAR Phase 1 study in Adult Acute Lymphoblastic Leukemia (ALL) during the 62nd ASH Annual Meeting,12/05/2020
ImmunoGen Presents Updated Findings from Phase 1/2 Study of IMGN632 in Blastic Plasmacytoid Dendritic Cell Neoplasm at ASH Annual Meeting,12/05/2020
Long-Term Data for bluebird bio's betibeglogene autotemcel (beti-cel) Gene Therapy Show Patients Across Ages and β-thalassemia Genotypes Achieve Transfusion Independence and Remain Free from Transfusions Up to Six Years Presented at 62nd ASH Meeting,12/05/2020
"Legend Biotech Announces Phase 1b/2 Study Data of Cilta-cel, an Investigational BCMA CAR-T, Showing Early, Deep, and Durable Responses in Heavily Pretreated Patients with Multiple Myeloma",12/05/2020
Amgen To Present First Clinical Data For BCMA-Targeted Half-Life Extended BiTE® Therapy AMG 701 At ASH 2020,12/05/2020
"Kia recalls 295,000 U.S. vehicles for fire risks",12/05/2020
"ROSEN, TRUSTED INVESTOR COUNSEL, Reminds Intercept Pharmaceuticals, Inc. Investors of Important Deadline in Securities Class Action; Encourages Investors with Losses in Excess of $100K to Contact the Firm – ICPT",12/05/2020
"MicroStrategy Buys $50 Million Worth Of Bitcoin, Topping Up Holdings To $766M",12/05/2020
Why Shares in Freeport-McMoRan Soared 35% in November,12/05/2020
Elliott Management Makes New $890M Push To Buy McDonald's Supplier Aryzta: Bloomberg,12/05/2020
Invesco Preferred Portfolio ETF: Safety Dance,12/05/2020
Fabrinet: Upward Progression Continues,12/05/2020
PD Stock Price: $45 Target By JPMorgan,12/05/2020
Docusign CEO discusses earnings beat and the coronavirus pandemic driving more digital signatures,12/05/2020
DocuSign Results Dispel Fears Around Billings,12/05/2020
Tesla boasts a ‘majority minority' workforce but leadership is predominantly white and male,12/05/2020
Poseida Therapeutics Provides Update on Phase 1 Trial of P-BCMA-101 at the 2020 American Society of Hematology Annual Meeting,12/05/2020
"ROSEN, A TOP RANKED LAW FIRM, Reminds Bayerische Motoren Werke AG Investors of Important Deadline in Securities Class Action First Filed by the Firm – BMWYY, BAMXF",12/05/2020
"Notable Insider Buys of the Past Week: Foot Locker, Icahn Enterprises, Kraft Heinz And More",12/05/2020
IGM Biosciences Presents First Clinical Data from IGM-2323 in Non-Hodgkin's Lymphoma at 2020 ASH Annual Meeting,12/05/2020
Cadillac Loses 150 Dealers After GM Asks Them To Upgrade Stores For Electric Vehicles,12/05/2020
Why Shares in AerCap Surged 48% in November,12/05/2020
Rogers Communications: Resilient To The Pandemic But Wait For A Correction,12/05/2020
GeneTx and Ultragenyx Announce Presentation of Phase 1/2 Data on Investigational GTX-102 in Patients with Angelman Syndrome,12/05/2020
DoorDash Boosts Expected Valuation Range Ahead of IPO,12/05/2020
"Tesla's racially diverse workforce is led mostly by white men, internal report shows",12/05/2020
Elon Musk reveals Tesla's plan to be at the forefront of a self-driving car revolution – and why he wants to be buried on Mars (TSLA),12/05/2020
Roche announces new data reinforcing the long-term benefit of Venclexta/Venclyxto-based combination for people with relapsed or refractory chronic lymphocytic leukaemia,12/05/2020
AbbVie Presents Extended Follow-Up Data for Fixed Duration Treatment VENCLEXTA®/VENCLYXTO® (venetoclax) in Chronic Lymphocytic Leukemia (CLL),12/05/2020
Genentech Announces New Data Reinforcing the Long-Term Benefit of Venclexta-Based Combination for People With Relapsed or Refractory Chronic Lymphocytic Leukemia,12/05/2020
Canada Goose Regaining Momentum,12/05/2020
Syros Presents New Data From Phase 2 Clinical Trial of SY-1425 and Announces Plans to Initiate Registration-Enabling Trial in MDS and Randomized Phase 2 Trial in AML,12/05/2020
"Syros Acquires Clinical-Stage Drug Candidate for Acute Promyelocytic Leukemia, Expanding Its Pipeline of Targeted Therapies for Hematologic Malignancies",12/05/2020
"Bristol Myers Squibb and bluebird bio Present Data Highlighting Anti-BCMA CAR T Cell Therapy, Ide-cel, in Relapsed and Refractory Multiple Myeloma at ASH 2020",12/05/2020
Citigroup Chief: CBDCs Are 'Inevitable' In The Future Of Currency,12/06/2020
Exxon Mobil Doubles Down On The Dividend,12/06/2020
China hands out $3 million of digital yuan as JD.com becomes first online platform to accept it,12/06/2020
