"INVESTOR NOTICE: ROSEN, NATIONAL TRIAL COUNSEL, Encourages iRhythm Technologies, Inc. Investors to Secure Counsel Before Important Deadline - IRTC",03/01/2021
"Tortoise Provides Unaudited Balance Sheet Information and Asset Coverage Ratio Updates as of February 28, 2021 for TYG, NTG, TTP, NDP, TPZ and TEAF",03/01/2021
3D Systems (DDD) Q4 Earnings and Revenues Miss Estimates,03/01/2021
DMG Announces Cdn$70 Million Private Placement Offering with U.S. Institutional Investors,03/02/2021
Thunderbird Entertainment Announces Changes to Board of Directors,03/02/2021
Alcoa Corporation (AA) CEO Roy Harvey on BMO 30th Global Metals & Mining Virtual Conference (Transcript),03/02/2021
Stryker Corp (SYK) Presents at Cowen Healthcare Broker Conference Call - (Transcript),03/02/2021
"Palo Alto Networks, Inc. (PANW) Presents at Morgan Stanley Technology, Media and Telecom Broker Conference Call - (Transcript)",03/02/2021
"Seagate Technology PLC (STX) Presents at Morgan Stanley Technology, Media and Telecom Broker Conference Call - (Transcript)",03/02/2021
"Elanco Animal Health, Inc. (ELAN) Presents at Cowen Healthcare Broker Conference Call - (Transcript)",03/02/2021
Taylor Wimpey PLC (TWODF) CEO Peter Redfern on Q4 2020 Results - Earnings Call Transcript,03/02/2021
fuboTV's (FUBO) CEO David Gandler on Q4 2020 Results - Earnings Call Transcript,03/02/2021
DRIV: The Electric Vehicle Bubble Is Bursting,03/02/2021
Veeva Systems Inc. (VEEV) CEO Peter Gassner on Q4 2021 Results - Earnings Call Transcript,03/02/2021
"Beyond Meat, Inc. Prices Upsized $1 Billion Convertible Senior Notes Offering",03/02/2021
"KemPharm Announces FDA Approval of AZSTARYS™ (serdexmethylphenidate and dexmethylphenidate capsules, for oral use, CII), A New Once-Daily Treatment for ADHD",03/02/2021
Quanterix Corporation (QTRX) CEO Kevin Hrusovsky on Q4 2020 Results - Earnings Call Transcript,03/02/2021
Lindt & Spruengli (LDSVF) CEO Dieter Weisskopf on Full Year 2020 Results - Earnings Call Transcript,03/02/2021
Hewlett Packard Enterprise Company (HPE) CEO Antonio Neri on Q1 2021 Results - Earnings Call Transcript,03/02/2021
Goldman Plans to Add About 100 Staff in Singapore,03/02/2021
Mitsubishi Electric 1st Among Japanese Firms and 3rd Globally in International Patent Applications Filed in 2020,03/02/2021
Ascendant Digital Acquisition Corp. (ACNDU) on Beacon Street and Ascendant Digital Acquisition Corp. Conference Call (Transcript),03/02/2021
"Shareholder Alert: Ademi LLP Investigates whether Shareholders will receive a Fair Price in Communications Systems, Inc.'s transaction with Pineapple Energy",03/02/2021
"Maravai LifeSciences Holdings, Inc. (MRVI) CEO Carl Hull on Q4 2020 Results - Earnings Call Transcript",03/02/2021
"Urban Outfitters, Inc. (URBN) CEO Richard Hayne on Q4 2021 Results - Earnings Call Transcript",03/02/2021
MercadoLibre Earnings Show Power Of ‘Digital Front Door' For Developing Regions,03/02/2021
SouthGobi Announces Profit Warning,03/02/2021
L.B. Foster Co (FSTR) CEO Robert Bauer on Q4 2020 Results - Earnings Call Transcript,03/02/2021
Why some Chinese are buying local electric car brands like Nio — instead of Tesla,03/02/2021
Box's (BOX) CEO Aaron Levie on Q4 2021 Results - Earnings Call Transcript,03/02/2021
"The Coretec Group, Inc. Announces $6.0 Million Private Placement Offering",03/02/2021
Algernon Pharmaceuticals Announces Private Placement,03/02/2021
Cable One Announces Pricing of Upsized Private Offering of Convertible Senior Notes,03/02/2021
"Illumina, Inc. (ILMN) CEO Francis deSouza Presents at Cowen 41st Annual Health Care Conference (Transcript)",03/02/2021
Sea Ltd (SE) CEO Forrest Li on Q4 2020 Results - Earnings Call Transcript,03/02/2021
NightFood Holding's (NGTF) CEO Sean Folkson Hosts Investor Conference Call (Transcript),03/02/2021
Rio Tinto's chairman to step down in latest shakeup following Indigenous cave destruction,03/02/2021
PayPal To Buy Cryptocurrency Custodian Curv: Report,03/02/2021
Heska Announces Pricing of Upsized Public Offering of Common Stock,03/02/2021
Aequus Announces Notice of Warrant Acceleration,03/02/2021
TransMedics Group's (TMDX) CEO Waleed Hassanein on Q4 2020 Results - Earnings Call Transcript,03/02/2021
"HAGENS BERMAN, NATIONAL TRIAL ATTORNEYS, Encourages Athenex (ATNX) Investors with Losses to Contact Its Attorneys, ATNX Reports FDA Complete Response Letter",03/02/2021
Cardlytics Announces Pricing of Public Offering of Common Stock,03/02/2021
ioneer in a trading halt ahead of capital raising announcement,03/02/2021
"Cummins, Inc. (CMI) Presents at 13th Annual Evercore ISI Industrial Conference - Transcript",03/02/2021
"Vectrus, Inc. (VEC) CEO Charles Prow on Q4 2020 Results - Earnings Call Transcript",03/02/2021
"VMware, Inc. (VMW) Presents at Morgan Stanley 2021 Technology, Media and Telecom Virtual Conference (Transcript)",03/02/2021
American Tower Corporation (REIT) (AMT) Presents at Raymond James 42nd Annual Institutional Investors Conference (Transcript),03/02/2021
"Netflix, Inc. (NFLX) Presents at Morgan Stanley Technology, Media & Telecom - Conference Call Transcript",03/02/2021
"NV5 Global, Inc. (NVEE) CEO Dickerson Wright on Q4 2020 Results - Earnings Call Transcript",03/02/2021
"Cathie Wood's Ark Invest Buys over 250,000 Shares of Zoom Video",03/02/2021
Johnson & Johnson (JNJ) Presents at Raymond James 42nd Annual Institutional Investors Conference Call Transcript,03/02/2021
"REGI CLASS ACTION NOTICE: Glancy Prongay & Murray LLP Files Securities Fraud Lawsuit Against Renewable Energy Group, Inc.",03/02/2021
Element Fleet Management Corp (ELEEF) CEO Jay Forbes on Q4 2020 Results - Earnings Call Transcript,03/03/2021
Snowflake Inc.'s (SNOW) CEO Frank Slootman on Q4 2021 Results - Earnings Call Transcript,03/03/2021
"Uniti Group, Inc. (UNIT) Presents at Raymond James Institutional Investors Broker Conference Call - (Transcript)",03/03/2021
Elixinol Global in trading halt with potential transaction news pending,03/03/2021
The Descartes Systems Group Inc (DSGX) CEO Ed Ryan on Q4 2021 Results - Earnings Call Transcript,03/03/2021
Splunk Inc. (SPLK) CEO Douglas Merritt on Q4 2021 Results - Earnings Call Transcript,03/03/2021
"Amazon opening cashierless Fresh grocery in London, its first physical retail store outside U.S.",03/03/2021
"Shareholder Alert: Ademi LLP Investigates whether Severn Bancorp, Inc. has obtained a Fair Price in its transaction with Shore Bancshares",03/03/2021
TriplePoint Venture Growth's (TPVG) CEO Jim Labe Q4 2020 Results - Earnings Call Transcript,03/03/2021
Apollo Global Closes Acquisition Deal With Crafts Chain Michaels,03/03/2021
"Fortnite Row Aftermath: Arizona House Passes Bill That Will Require Apple, Google To Let App Developers Chose Outside Payments Systems",03/03/2021
"Okta, Inc. (OKTA) CEO Todd McKinnon on Q4 2021 Results - Earnings Call Transcript",03/03/2021
Ampio Pharmaceuticals' (AMPE) CEO Mike Macaluso on Q4 2020 Results - Earnings Call Transcript,03/03/2021
Peugeot's (PEUGF) Management on Q4 2020 Results - Earnings Call Transcript,03/03/2021
SailPoint Expands With New Office in Japan,03/03/2021
"Cohu Announces Pricing of Upsized Public Offering of 4,950,000 Shares of Common Stock",03/03/2021
Australian treasurer says talks with Facebook on new media law were ‘protracted and difficult',03/03/2021
Points International Ltd. (PCOM) CEO Rob MacLean on Q4 2020 Results - Earnings Call Transcript,03/03/2021
"SHAREHOLDER ALERT: CLAIMSFILER REMINDS APA, EH, FUBO, MPLN INVESTORS of Lead Plaintiff Deadline in Class Action Lawsuits",03/03/2021
"SHAREHOLDER ALERT: CLAIMSFILER REMINDS CLOV, EBIX INVESTORS of Lead Plaintiff Deadline in Class Action Lawsuits",03/03/2021
"Comcast Corporation (CMCSA) CEO Brian Roberts Presents at Morgan Stanley 2021 Technology, Media & Telecom Conference (Transcript)",03/03/2021
"American Eagle Outfitters, Inc. (AEO) CEO Jay Schottenstein on Q4 2020 Results - Earnings Call Transcript",03/03/2021
PCN: Another Strong Performer With A Persistent Premium,03/03/2021
Marvell Technology Group Ltd. (MRVL) CEO Matt Murphy on Q4 2020 Results - Earnings Call Transcript,03/03/2021
"OTRK CLASS ACTION NOTICE: Glancy Prongay & Murray LLP Files Securities Fraud Lawsuit Against Ontrak, Inc.",03/03/2021
"Conformis, Inc. (CFMS) CEO Mark Augusti on Q4 2020 Results - Earnings Call Transcript",03/03/2021
Arbor Realty Has Outstanding Finish To 2020,03/03/2021
This Gaming Growth Stock Is Down Over 30% From Record Highs: Buy or Sell?,03/03/2021
Why Globalstar Stock Spiked 9% In After-Hours Today,03/03/2021
Vroom's (VRM) CEO Paul Hennessy on Q4 2020 Results - Earnings Call Transcript,03/03/2021
"BREAKING NEWS: ROSEN, GLOBAL INVESTOR COUNSEL, Encourages Tyson Foods, Inc. Investors to Secure Counsel Before Important Deadline - TSN",03/03/2021
"GTT FINAL DEADLINE: ROSEN, RESPECTED INVESTOR COUNSEL, Encourages GTT Communications, Inc. Investors With Large Losses to Secure Counsel Before Important March 15 Deadline - GTT",03/03/2021
"ROSEN, A LEADING NATIONAL FIRM, Encourages fuboTV Inc. Investors with Losses in Excess of $100K to Secure Counsel Before Important Deadline - FUBO",03/03/2021
Cathie Wood's ARK Invest Buys Over 2.6 Million Palantir Shares,03/03/2021
INVESTOR ALERT: Law Offices of Howard G. Smith Announces Investigation of XL Fleet Corp. (XL) on Behalf of Investors,03/03/2021
Barstool's Portnoy backs new BUZZ ETF,03/03/2021
Vroom: Consumer Demand For Used Cars Eclipses Pre-COVID Levels,03/03/2021
iCAD to Participate in the Cowen 41st Annual Health Care Conference,03/03/2021
U.S. judge rejects SEC bid to expand Rio Tinto fraud lawsuit on Mozambique coal business,03/03/2021
"Dynex Capital, Inc. Announces Pricing of Public Offering of Common Stock",03/03/2021
"DISH, DraftKings Partner On DVR Fantasy Sports Integration",03/03/2021
"Oil prices firm on prospect of OPEC+ maintaining supply cuts, drop in U.S. inventories",03/03/2021
"ATHENEX ALERT: Bragar Eagel & Squire, P.C. Announces That a Class Action Lawsuit Has Been Filed Against Athenex, Inc. and Encourages Investors to Contact the Firm",03/03/2021
"RENEWABLE ENERGY GROUP ALERT: Bragar Eagel & Squire, P.C. Announces That a Class Action Lawsuit Has Been Filed Against Renewable Energy Group, Inc. and Encourages Investors to Contact the Firm",03/03/2021
"ONTRAK ALERT: Bragar Eagel & Squire, P.C. Is Investigating Ontrak, Inc. on Behalf of Ontrak Stockholders and Encourages Investors to Contact the Firm",03/03/2021
"RENEWABLE ENERGY SHAREHOLDER ALERT by Former Louisiana Attorney General: Kahn Swick & Foti, LLC Reminds Investors with Losses in Excess of $100,000 of Lead Plaintiff Deadline in Class Action Lawsuit Against Renewable Energy Group, Inc. - REGI",03/03/2021
"Rimini Street, Inc. (RMNI) CEO Seth Ravin on Q4 2020 Results - Earnings Call Transcript",03/03/2021
"Hudson Technologies, Inc.'s (HDSN) CEO Brian Coleman on Q4 2020 Results - Earnings Call Transcript",03/03/2021
Rapid Nutrition Expands Global Online Distribution with New Amazon Store,03/03/2021
Google will stop selling ads based on web browsing history,03/03/2021
"Identiv, Inc. (INVE) CEO Steven Humphreys on Q4 2020 Results - Earnings Call Transcript",03/04/2021
Pomerantz Law Firm Announces the Filing of a Class Action against Range Resources Corporation and Certain Officers - RRC,03/04/2021
"The Cooper Companies, Inc. (COO) CEO Albert White on Q1 2021 Results - Earnings Call Transcript",03/04/2021
Slack higher after-hours following earnings beat,03/04/2021
Amgen Inc. (AMGN) Management Presents at Cowen 41st Annual Healthcare Conference (Transcript),03/04/2021
"Anika Therapeutics, Inc. (ANIK) CEO Cheryl Blanchard on Q4 2020 Results - Earnings Call Transcript",03/04/2021
1-800-Flowers Looks Fresh And Ready For Picking,03/04/2021
"Medallia, Inc. (MDLA) CEO Leslie Stretch on Q4 2021 Results - Earnings Call Transcript",03/04/2021
Qumu Corporation (QUMU) CEO T.J. Kennedy on Q4 2020 Results - Earnings Call Transcript,03/04/2021
"Certara, Inc. (CERT) CEO William Feehery on Q4 2020 Results - Earnings Call Transcript",03/04/2021
Ameresco Announces Pricing of Public Offering of Class A Common Stock,03/04/2021
"Costco lower after-hours despite posting revenue beat, online sales surge",03/04/2021
"Smith & Wesson Brands, Inc. (SWBI) CEO Mark Smith on Q3 2021 Results - Earnings Call Transcript",03/04/2021
IDT Corp (IDT) CEO Samuel Jonas on Q2 2021 Results - Earnings Call Transcript,03/04/2021
Dada Group Joined Shanghai's New Year Shopping Season Campaign and Announced Livestreaming Partnership with Unilever,03/04/2021
"Chuy's Holdings, Inc. (CHUY) CEO Steve Hislop on Q4 2020 Results - Earnings Call Transcript",03/04/2021
"Clearpoint Neuro, Inc. (CLPT) CEO Joseph Burnett on Q4 2020 Results - Earnings Call Transcript",03/04/2021
"RENEWABLE ENERGY INVESTORS: ALERT BY FORMER LOUISIANA ATTORNEY GENERAL: Kahn Swick & Foti, LLC Reminds Investors with Losses in Excess of $100,000 of Lead Plaintiff Deadline in Class Action Lawsuit Against Renewable Energy Group, Inc. - REGI",03/04/2021
Broadcom Inc. (AVGO) CEO Hock Tan on Q1 2021 Results - Earnings Call Transcript,03/04/2021
Costco Wholesale's (COST) Management on Q2 2021 Results - Earnings Call Transcript,03/04/2021
"Stellus Capital Investment Corporation Reports Results for its Fourth Fiscal Quarter and Year Ended December 31, 2020",03/04/2021
"Cathie Wood's ARK Invest Buys Over 450,000 Shares of Zillow",03/04/2021
Great Ajax Corp. (AJX) CEO Lawrence Mendelsohn on Q4 2020 Results - Earnings Call Transcript,03/04/2021
AECOM: Investor Day Highlights The Medium-Term Bull Case,03/04/2021
Gap's (GPS) CEO Sonia Syngal on Q4 2020 Results - Earnings Call Transcript,03/04/2021
"Monteverde & Associates PC Files Class Action Lawsuit On Behalf Of Shareholders Of Xilinx, Inc. In The Northern District Of California",03/04/2021
Cathie Wood's ARK Invest Buys and Sells 3/4,03/04/2021
Turtle Beach Corporation (HEAR) CEO Juergen Stark on Q4 2020 Results - Earnings Call Transcript,03/04/2021
WTI Stock Price Increased 10.82%: Why It Happened,03/04/2021
Fiesta Restaurant's (FRGI) CEO Rich Stockinger on Q4 2020 Results - Earnings Call Transcript,03/04/2021
"Soliton, Inc. (SOLY) CEO Brad Hauser on Q4 2020 Results - Earnings Call Transcript",03/04/2021
"INmune Bio, Inc. (INMB) CEO RJ Tesi on Q4 2020 Results - Earnings Call Transcript",03/04/2021
"Evofem Biosciences, Inc. (EVFM) CEO Saundra Pelletier on Q4 2020 Results - Earnings Call Transcript",03/04/2021
DermTech's (DMTK) CEO John Dobak on Q4 2020 Results - Earnings Call Transcript,03/04/2021
ioneer over the moon with strong response to upsized A$80 million placement,03/04/2021
DURECT Corporation (DRRX) CEO Jim Brown on Q4 2020 Results - Earnings Call Transcript,03/04/2021
Martinrea International Inc. (MRETF) CEO Pat D'Eramo on Q4 2020 Results - Earnings Call Transcript,03/04/2021
"Synthetic Biologics, Inc's (SYN) CEO Steve Shallcross on Q4 2020 Results - Earnings Call Transcript",03/04/2021
"Kadmon Holdings, Inc. (KDMN) Reports Q4 Loss, Tops Revenue Estimates",03/04/2021
Granite Point Mortgage Trust (GPMT) Surpasses Q4 Earnings and Revenue Estimates,03/04/2021
Jamf Holding Corp.'s (JAMF) CEO Dean Hager on Q4 2020 Results - Earnings Call Transcript,03/04/2021
Toshiba sees Mizuho join BlackRock in building 5% stake,03/04/2021
"Veritone, Inc. (VERI) CEO Chad Steelberg on Q4 2020 Results - Earnings Call Transcript",03/04/2021
BURL Stock Price Increased 11.19%: Why It Happened,03/04/2021
How Square's Purchase of Jay Z's Tidal Could Popularize Blockchain,03/04/2021
"IRTC EQUITY ALERT: Kessler Topaz Meltzer & Check, LLP Announces that a Securities Fraud Class Action Lawsuit was filed on Behalf of Investors of iRhythm Technologies, Inc.",03/04/2021
"PlayAGS, Inc. (AGS) CEO David Lopez on Q4 2020 Results - Earnings Call Transcript",03/04/2021
Western Australia upgrades Crown Resorts inquiry to Royal Commission,03/04/2021
Deutsche Lufthansa AG (DLAKF) CEO Carsten Spohr on Q4 2020 Results - Earnings Call Transcript,03/04/2021
Wrap Technologies' (WRAP) CEO Tom Smith on Q4 2020 Results - Earnings Call Transcript,03/04/2021
"SHAREHOLDER ALERT: Monteverde & Associates PC Announces an Investigation of ProSight Global, Inc. - PROS",03/05/2021
Pomerantz Law Firm Announces the Filing of a Class Action against Apache Corporation and Certain Officers - APA,03/05/2021
"SHAREHOLDER ALERT BY FORMER LOUISIANA ATTORNEY GENERAL: KSF REMINDS CLOV, IRTC, PEN INVESTORS of Lead Plaintiff Deadline in Class Action Lawsuits",03/05/2021
"SHAREHOLDER ALERT BY FORMER LOUISIANA ATTORNEY GENERAL: KSF REMINDS REGI, VLDR INVESTORS of Lead Plaintiff Deadline in Class Action Lawsuits",03/05/2021
"SHAREHOLDER ALERT: Monteverde & Associates PC Announces an Investigation of The Michaels Companies, Inc. - MIK",03/05/2021
Hu Products Conducts Nationwide Voluntary Recall of Single Lot of 4 oz. Chocolate Covered Hunks - Sour Goldenberries Product Due to Undeclared Almonds,03/05/2021
Revenue Report: XTRA's T17 ASICs Are Mining In A Canadian Hosting,03/05/2021
"SHAREHOLDER ALERT: Monteverde & Associates PC Announces an Investigation of Monaker Group, Inc. - MKGI",03/05/2021
Xiaomi's Strategic Investment into AMTD Capital under AMTD International (HKIB),03/05/2021
"VLDR Class Action Alert: Kessler Topaz Meltzer & Check, LLP Announces A Securities Fraud Class Action Filed Against Velodyne Lidar, Inc.",03/05/2021
CLPS' (CLPS) CEO Raymond Lin on Q1 2021 Results - Earnings Call Transcript,03/05/2021
Will the internet win? Dave Portnoy puts his weight behind Buzz ETF,03/05/2021
"SHAREHOLDER ALERT: Monteverde & Associates PC Announces an Investigation of Five Prime Therapeutics, Inc. - FPRX",03/05/2021
Allied Corp. Launches Strategic North American Public Relations and Marketing Campaign,03/05/2021
Reinventions are good news for Volkswagen and ViacomCBS investors: Barron's,03/05/2021
"MPLN ALERT: Kessler Topaz Meltzer & Check, LLP Reminds Investors of Securities Fraud Class Action Lawsuit Filed Against MultiPlan Corporation",03/05/2021
Okta CEO defends $6.5 billion deal for rival Auth0 after shares fall,03/05/2021
NETSTREIT Corp. (NTST) CEO Mark Manheimer on Q4 2020 Results - Earnings Call Transcript,03/05/2021
Tesla and Other Hypergrowth Stocks Could Tear Down What They Built Up,03/05/2021
YPF Sociedad Anónima (YPF) CEO Sergio Affronti on Q4 2020 Results - Earnings Call Transcript,03/05/2021
"LEIDOS HOLDINGS ALERT: Bragar Eagel & Squire, P.C. Announces That a Class Action Lawsuit Has Been Filed Against Leidos Holdings, Inc. and Encourages Investors to Contact the Firm",03/05/2021
"BAKER HUGHES ALERT: Bragar Eagel & Squire, P.C. is Investigating Baker Hughes Company on Behalf of Baker Hughes Stockholders and Encourages Investors to Contact the Firm",03/05/2021
SHAREHOLDER ALERT: Monteverde & Associates PC Announces an Investigation of Atlantic Power Corp. - AT,03/05/2021
"Cathie Wood's ARK Invest Buys Over 108,000 Shares of Tesla",03/05/2021
Trex Company CEO on elevated demand for composite decking and railing products,03/05/2021
Okta CEO defends move to acquire rival cybersecurity firm Auth0: 'The two solutions together are so,03/05/2021
Bitcoin Miner Cipher Mining Going Public in SPAC Merger,03/05/2021
MAA to Present at the 2021 Citi Virtual Global Property CEO Conference,03/05/2021
Cathie Wood's ARK Invest Buys and Sells 3/5,03/05/2021
Columbia Care: No Longer A Small Operator,03/05/2021
Nutanix CEO: We are in the heart of moving to a subscription model,03/05/2021
"HAGENS BERMAN, NATIONAL TRIAL ATTORNEYS, Notifies Ebix (EBIX) Investors of Application Deadline in Securities Fraud Lawsuit and Encourages Investors with Losses to Contact Firm",03/05/2021
Don't Sleep On ResMed,03/05/2021
"Deadline Approaching: Kessler Topaz Meltzer & Check, LLP Reminds Investors of Deadline in Securities Fraud Class Action Lawsuit Filed Against Penumbra, Inc.",03/05/2021
DTN: Average In Quality And Performance,03/05/2021
Why Moderna Was a Roller Coaster Today,03/05/2021
LGI Homes CEO expects housing demand to remain strong even as mortgage rates tick up,03/05/2021
This Is Why Docusign Will Succeed Even Beyond The Pandemic,03/05/2021
Benchmark Drills 1.66 Gold Equivalent Over 186.00 Metres Extending Depth And Continuity Of The Mineralizing System At Cliff Creek South,03/05/2021
Lyft President Zimmer Says Demand Is Returning,03/05/2021
U.S. FDA Approves Yescarta® for Relapsed or Refractory Follicular Lymphoma After Two or More Lines of Systemic Therapy,03/05/2021
2 Cheap Stocks Under $25 to Buy that Shrugged Off the Market Rout,03/05/2021
"Shift4 Payments CEO on Earnings, SpaceX SN10 Fireball",03/05/2021
"More than 20,000 U.S. organizations compromised through Microsoft flaw: source",03/05/2021
Aeromexico Reports February 2021 Traffic Results,03/05/2021
Algernon Pharmaceuticals Announces Increase and Close of Private Placement,03/05/2021
"Source Capital, Inc. Increases Monthly Distribution Rate to 5.25%, Implements Discount Management Program, and Announces Investor Call",03/05/2021
Boeing Reportedly Seeking New $4 Billion Credit Facility,03/05/2021
"Exclusive: U.S. agency probes Facebook for 'systemic' racial bias in hiring, promotions - attorneys",03/05/2021
"Why Norwegian Cruise Line, Royal Caribbean, and Carnival Sank Today",03/05/2021
PLUG Stock Price: $65 Target By JPMorgan,03/06/2021
HCAT Stock Price: $54 Target (Up From $50) By Piper Sandler,03/06/2021
"SHAREHOLDER ALERT: Levi & Korsinsky, LLP Notifies Shareholders of Tricida, Inc. of a Class Action Lawsuit and a Lead Plaintiff Deadline of March 8, 2021 - TCDA",03/06/2021
Why Marriott International Stock Climbed in February,03/06/2021
"ROSEN, A HIGHLY RECOGNIZED LAW FIRM, Encourages Renewable Energy Group, Inc. Investors with Losses in Excess of $100K to Secure Counsel Before Important Deadline - REGI",03/06/2021
Why Shares of Plug Power Dropped 24% in February,03/06/2021
"BREAKING NEWS: ROSEN, A TOP RANKED LAW FIRM, Encourages AgEagle Aerial Systems, Inc. Investors with Losses in Excess of $100K to Secure Counsel Before Important Deadline in Securities Class Action First Filed by the Firm – UAVS",03/06/2021
"BREAKING ALERT: ROSEN, GLOBAL INVESTOR COUNSEL, Encourages APA Corporation f/k/a Apache Corporation Investors with Losses in Excess of $100K to Secure Counsel Before Important Deadline – APA",03/06/2021
Best REITs On Sale,03/06/2021
Royal Gold: A High-Margin Business At A Reasonable Price,03/06/2021
"ROSEN, A GLOBALLY RECOGNIZED FIRM, Encourages Athenex, Inc. Investors with Losses in Excess of $100K to Secure Counsel Before Important Deadline - ATNX",03/06/2021
Investor Chamath Palihapitiya confirms selling shares in Virgin Galactic,03/06/2021
"ROSEN, A LEADING AND LONGSTANDING LAW FIRM, Encourages Ebix, Inc. Investors with Losses Exceeding $100K to Secure Counsel Before Important Deadline – EBIX",03/06/2021
Disney shares remain in a bull market supported by Q1 results,03/06/2021
Tesla Model 3 Demand Spikes In Japan Following 25% Price Slash,03/06/2021
ARKG: Evaluating High Ownership And Herd Behavior Risk Factors,03/06/2021
44 10%-Plus Yield Dividend Stocks Priced $5-$25 For March,03/06/2021
"ROSEN, A TOP RANKED LAW FIRM, Encourages Velodyne Lidar, Inc. Investors with Losses in Excess of $100K to Secure Counsel Before Important Deadline – VLDR, VLDRW",03/06/2021
This Could Be A Watershed Year For Infinity Pharma Stock,03/06/2021
Why Investors Should Watch Transports (IYT) and Retail (XRT) On Monday,03/06/2021
"Rosen, Top Ranked Investor Counsel, Encourages fuboTV Inc. Investors with Losses in Excess of $100K to Secure Counsel Before Important Deadline - FUBO",03/06/2021
Cousins Properties: More Or Less At Fair Value,03/06/2021
Disneyland Might Be Open as Soon as Next Month,03/06/2021
Buy The FAN ETF As The Global Wind Energy Sector Looks Set To Take Off,03/06/2021
Tesla Launches Social Media Platform For Public Policy Team & Owners Clubs,03/06/2021
V&M Breakouts: Top Growth And Dividend Stocks For March 2021,03/06/2021
Week 10 MDA Breakout Stocks - March 2021: Short-Term Picks To Give You An Edge,03/06/2021
"Kessler Topaz Meltzer & Check, LLP - Important Deadline Reminder for iRhythm Technologies, Inc. Investors",03/06/2021
"The Past Week's Most Notable Insider Buys: Editas, Exxon Mobil, Wayfare And More",03/06/2021
CLOV SHAREHOLDER DEADLINE: Bernstein Liebhard LLP Reminds Investors of the Deadline to File a Lead Plaintiff Motion in a Securities Class Action Lawsuit Against Clover Health Investments Corp.,03/06/2021
"ROSEN, TRUSTED NATIONAL TRIAL COUNSEL, Encourages MoneyGram International, Inc. Investors with Losses in Excess of $100K to Secure Counsel Before Important Deadline in Securities Class Action First Filed by the Firm - MGI",03/06/2021
2 Top SPAC Stocks to Buy Amid the Market Carnage,03/06/2021
Moderna Announces Supply Agreement to Provide 13 Million Doses of COVID-19 Vaccine Moderna to the Philippines,03/06/2021
Why Is Merck (MRK) Down 3.8% Since Last Earnings Report?,03/06/2021
Why Is NortonLifeLock (NLOK) Down 5.8% Since Last Earnings Report?,03/06/2021
Mettler-Toledo (MTD) Down 12.9% Since Last Earnings Report: Can It Rebound?,03/06/2021
Why Is Gilead (GILD) Down 1.8% Since Last Earnings Report?,03/06/2021
Why Is Hershey (HSY) Up 2.2% Since Last Earnings Report?,03/06/2021
ICE (ICE) Up 0.4% Since Last Earnings Report: Can It Continue?,03/06/2021
Why Is Lear (LEA) Up 15.3% Since Last Earnings Report?,03/06/2021
International Paper (IP) Up 15.8% Since Last Earnings Report: Can It Continue?,03/06/2021
LPL Financial Holdings Inc. (LPLA) Up 13.6% Since Last Earnings Report: Can It Continue?,03/06/2021
Lions Gate (LGF.A) Up 19.9% Since Last Earnings Report: Can It Continue?,03/06/2021
Why Is Essex Property Trust (ESS) Up 4.9% Since Last Earnings Report?,03/06/2021
Why Is Alexion (ALXN) Down 3.5% Since Last Earnings Report?,03/06/2021
Ametek (AME) Up 4.4% Since Last Earnings Report: Can It Continue?,03/06/2021
Why Is Arrow Electronics (ARW) Up 0.4% Since Last Earnings Report?,03/06/2021
