"ROSEN, A LEADING LAW FIRM, Encourages Champignon Brands Inc. Investors with Losses to Secure Counsel Before Important Deadline - SHRMF",04/19/2021
Microsoft's Acquisition Of Nuance Reaffirms Its Interest In Dominating The $11+ Trillion Healthcare Market,04/19/2021
"WEINGARTEN REALTY INVESTOR ALERT by the Former Attorney General of Louisiana: Kahn Swick & Foti, LLC Investigates Adequacy of Price and Process in Proposed Sale of Weingarten Realty Investors - WRI",04/19/2021
Doctor on J&J vaccine: ‘You have a much higher risk of getting a blood clot if you smoke',04/19/2021
"GENERAL FINANCE CORP INVESTOR ALERT by the Former Attorney General of Louisiana: Kahn Swick & Foti, LLC Investigates Adequacy of Price and Process in Proposed Sale of General Finance Corporation - GFN",04/19/2021
"PPD INVESTOR ALERT by the Former Attorney General of Louisiana: Kahn Swick & Foti, LLC Investigates Adequacy of Price and Process in Proposed Sale of PPD, Inc. - PPD",04/19/2021
"KNOLL INVESTOR ALERT by the Former Attorney General of Louisiana: Kahn Swick & Foti, LLC Investigates Adequacy of Price and Process in Proposed Sale of Knoll Inc. - KNL",04/19/2021
"Cathie Wood's ARK Invest Sells Over 590,000 Shares of Virgin Galactic",04/19/2021
"STERLING BANCORP INVESTOR ALERT by the Former Attorney General of Louisiana: Kahn Swick & Foti, LLC Investigates Adequacy of Price and Process in Proposed Sale of Sterling Bancorp - STL",04/19/2021
Sprott Inc. Files Early Warning Report in Respect of SRHI Inc.,04/19/2021
"AMERICAN RIVER BANKSHARES INVESTOR ALERT by the Former Attorney General of Louisiana: Kahn Swick & Foti, LLC Investigates Adequacy of Price and Process in Proposed Sale of American River Bankshares - AMRB",04/19/2021
"Social Life Network (OTC: WDLF) Files $40,000,000 Complaint in The United States District Court for the Southern District of California",04/19/2021
United Airlines Earnings: What Happened,04/19/2021
"CYDY INVESTOR ALERT: ROSEN, TOP RANKED INVESTOR COUNSEL, Encourages CytoDyn Inc. Investors with Losses to Secure Counsel Before Important Deadline in Securities Class Action - CYDY",04/19/2021
"Facebook is joining the (very) crowded audio space with soundbites, live rooms and podcasts",04/19/2021
Toyota's electric SUV concept is a glimpse at the company's future,04/19/2021
Deadly Tesla crash: No driver was behind the wheel according to police,04/19/2021
Zoom To Back Apps With $100 Million,04/19/2021
What To Watch For At Apple's Big Spring Event,04/19/2021
"Oil prices rise on weaker dollar, likely drawdown in U.S. stocks",04/19/2021
Meituan Raises $10 Billion to Fight Alibaba in Grocery Arena,04/19/2021
"LIFEMD ALERT: Bragar Eagel & Squire, P.C. Announces That a Class Action Lawsuit Has Been Filed Against LifeMD, Inc. and Encourages Investors to Contact the Firm",04/19/2021
"ROMEO POWER ALERT: Bragar Eagel & Squire, P.C. Announces That a Class Action Lawsuit Has Been Filed Against Romeo Power, Inc. and Encourages Investors to Contact the Firm",04/19/2021
"Troika Media Group, Inc. Announces Pricing of $24.0 Million Initial Public Offering and Nasdaq Listing",04/19/2021
Stem Holdings Announces Filing of Final Prospectus,04/19/2021
"GeoPark Limited Announces the Successful Early Tender Results of Its Cash Tender Offer for up to US$255,000,000 of Its 6.500% Senior Notes Due 2024 and Solicitation of Consents for Proposed Amendments to the Related Indenture",04/19/2021
"United stock falls after $1.4B loss as CEO promises a ""clear path to profitability""",04/19/2021
CAN SHAREHOLDER FILING DEADLINE: Bernstein Liebhard LLP Reminds Investors of the Deadline to File a Lead Plaintiff Motion in a Securities Class Action Against Canaan Inc.,04/19/2021
Police to search Tesla after vehicle crash that killed two people,04/19/2021
Uber Posts Record March And Unprecedented Signing Bonus For Drivers,04/19/2021
"CREDIT SUISSE ALERT: Bragar Eagel & Squire, P.C. Announces That a Class Action Lawsuit Has Been Filed Against Credit Suisse Group AG and Encourages Investors to Contact the Firm",04/19/2021
"FRANKLIN WIRELESS ALERT: Bragar Eagel & Squire, P.C. Announces That a Class Action Lawsuit Has Been Filed Against Franklin Wireless Corp. and Encourages Investors to Contact the Firm",04/19/2021
"INTRUSION ALERT: Bragar Eagel & Squire, P.C. Announces That a Class Action Lawsuit Has Been Filed Against Intrusion, Inc. and Encourages Investors to Contact the Firm",04/19/2021
Charter Prices $1.0 Billion Senior Unsecured Notes,04/19/2021
WeCommerce Announces Andrew Dumont Appointed as CEO of Stamped,04/19/2021
"DOX BREAKING NOTICE: ROSEN, TRUSTED INVESTOR COUNSEL, Encourages Amdocs Limited Investors with Losses over $100K to Secure Counsel Before Important Deadline - DOX",04/19/2021
Pinnacle Financial (PNFP) Q1 Earnings and Revenues Beat Estimates,04/19/2021
Physical Gold ETF (AAAU) at a 52-Week High,04/19/2021
PayPal to launch local wallet in China focused on cross-border payments,04/19/2021
Apple Making Progressive Movements in Product Lines: IDC,04/20/2021
China Petroleum & Chemical Corporation Files 2020 Annual Report on Form 20-F,04/20/2021
Zepp Health Corp. Files 2020 Annual Report on Form 20-F,04/20/2021
SoftBank Vision Fund seen posting record earnings on Coupang,04/20/2021
SkyWater Technology Announces Pricing of Upsized Initial Public Offering of Common Stock,04/20/2021
Turquoise Hill: Thoughts On The Recent Update,04/20/2021
GE Renewable Energy CEO on the push to wind power: There is a lot of land in the US with good wind,04/20/2021
Microchip Attractive On Microcontroller Growth Prospects,04/20/2021
EDU Stock: 6.46% Increase Explanation,04/20/2021
BHP ups copper guidance,04/20/2021
Tesla Apologizes to Chinese Customer,04/20/2021
"Intuitive Surgical, Inc.'s (ISRG) CEO Gary Guthart on Q1 2021 Results - Earnings Call Transcript",04/20/2021
Forestar Group Inc. (FOR) CEO Dan Bartok on Q2 2021 Results - Earnings Call Transcript,04/20/2021
"Canopy Growth CEO on cannabis, federal legalization,",04/20/2021
Is Transportation Sector (IYT) the Stock Market's Silver Lining?,04/20/2021
Cathie Wood's ARK Invest Buys Over 1.1 Million Shares of Palantir,04/20/2021
XLY: Hold Off For Now,04/20/2021
Pomerantz Law Firm Announces the Filing of a Class Action against Ebang International Holdings Inc. and Certain Officers - EBON,04/20/2021
Tesla California Registrations Drop In Q1 Driven By Low Model 3 Demand,04/20/2021
IPO Report: UiPath IPO: 5 things to know about the ‘software robots' company valued at nearly $30 billion,04/20/2021
"Netflix, Inc (NFLX) Q1 2021 Results - Earnings Call Transcript",04/20/2021
Oil falls for second day as India's COVID-19 surge to dent fuel demand,04/20/2021
CORRECTING and REPLACING Fulton Financial Announces First Quarter 2021 Results,04/20/2021
Netflix Plunges on Subscriber Growth Miss,04/20/2021
YVR Stock: 4.3% Increase Explanation,04/20/2021
TSLA Stock: $820 Target (Up From $775) By Mizuho,04/20/2021
Frequency Therapeutics: A Look At What's Next After A Disappointing Data Readout,04/20/2021
Mitsubishi Electric to Supply Elevators to 2 Large Luxury Complexes in India,04/20/2021
Interactive Brokers Group's (IBKR) Management on Q1 2021 Results - Earnings Call Transcript,04/20/2021
PLUG Stock: $42 Target By Evercore,04/20/2021
RUN Stock: $87 Target By Evercore,04/20/2021
"Norwegian Cruise Lines Is Now a Buy, Says Goldman Sachs Analyst",04/20/2021
SHAREHOLDER ALERT: Monteverde & Associates PC Announces an Investigation of D8 Holdings Corp. - DEH,04/20/2021
W. R. Berkley Corporation (WRB) CEO Rob Berkley on Q1 2021 Results - Earnings Call Transcript,04/20/2021
"Patrick Industries, Inc. Announces Closing of $350 Million Senior Notes Offering and New Credit Facility",04/20/2021
"U.S. Marijuana Consumption Has Risen 56% Since 2018, New Survey Shows",04/20/2021
"Upstart to Report First Quarter 2021 Earnings on May 11, 2021",04/20/2021
QCOM Stock: $155 Target (Down From $175) By Susquehanna,04/20/2021
NKE Stock: $176 Target By JPMorgan,04/20/2021
NNDM Stock: 7.53% Increase Explanation,04/20/2021
DAL Stock: $57 Target (Down From $58) By Stifel,04/20/2021
UiPath Announces Pricing of Initial Public Offering,04/20/2021
"Broadridge Schedules Webcast and Investor Conference Call to Review Third Quarter Fiscal Year 2021 Results on May 4, 2021",04/20/2021
"BioHiTech Global, Inc.'s (BHTG) CEO Anthony Fuller on Q4 2020 Results - Earnings Call Transcript",04/20/2021
Edwards Lifesciences Corporation (EW) CEO Mike Mussallem on Q1 2021 Results - Earnings Call Transcript,04/20/2021
iFresh: Buy The Recovery Or Wait,04/20/2021
Musgrave Minerals pockets more high-grade gold at Cue with Target 14 returning up to 12 metres at 8.7 g/t,04/20/2021
"ARCIMOTO ALERT: Bragar Eagel & Squire, P.C. Announces That a Class Action Lawsuit Has Been Filed Against Arcimoto, Inc. and Encourages Investors to Contact the Firm",04/20/2021
"ACADIA PHARMACEUTICALS ALERT: Bragar Eagel & Squire, P.C. Announces That a Class Action Lawsuit Has Been Filed Against Acadia Pharmaceuticals, Inc. and Encourages Investors to Contact the Firm",04/20/2021
"EMERGENT BIOSOLUTIONS ALERT: Bragar Eagel & Squire, P.C. Announces That a Class Action Lawsuit Has Been Filed Against Emergent BioSolutions, Inc. and Encourages Investors to Contact the Firm",04/20/2021
"Chipotle's Digital Growth Slows, Though Online Sales Remain High",04/21/2021
SenSen Networks boosts annual recurring revenue guidance to A$4.5 million for FY22 on increasing North American demand,04/21/2021
Alcoa Corporation: Time To Buy The Dip,04/21/2021
Zymergen Announces Pricing of Upsized Initial Public Offering,04/21/2021
"Kinder Morgan, Inc. (KMI) CEO Steven Kean on Q1 2021 Results - Earnings Call Transcript",04/21/2021
$100 million New Jersey deli company Hometown International delisted from an over-the-counter market,04/21/2021
Chindata Group Celebrates Earth Day with its Carbon Neutrality Commitment,04/21/2021
"VYM Invests In Undervalued Dividend Stocks, Yields 2.9%, And Is A Buy",04/21/2021
Qualtrics International Inc. (XM) CEO Zig Serafin on Q1 2021 Results - Earnings Call Transcript,04/21/2021
"No Cameras, But Epic CEO, Apple App Store Chief Will Attend Antitrust Trial",04/21/2021
Robert Half International Inc.'s (RHI) CEO Keith Waddell on Q1 2021 Results - Earnings Call Transcript,04/21/2021
ROBO: Capturing The Autonomous Megatrend,04/21/2021
"Chipotle Mexican Grill, Inc. (CMG) CEO Brian Niccol on Q1 2021 Results - Earnings Call Transcript",04/21/2021
Checkmate: Promising pDC Therapeutic Holds Triple-Digit Upside In Melanoma,04/21/2021
"Analyst is bullish on Apple, plus the latest on the Capitol Hill antitrust hearing over apps",04/21/2021
"CORRECTING and REPLACING Anzu Special Acquisition Corp I Announces the Separate Trading of Its Class A Common Stock and Warrants, Commencing April 22, 2021",04/21/2021
Las Vegas Sands Corp. (LVS) CEO Robert Goldstein on Q1 2021 Results - Earnings Call Transcript,04/21/2021
KnowBe4 Announces Pricing of Initial Public Offering,04/21/2021
SHAREHOLDER ALERT: Pomerantz Law Firm Investigates Claims On Behalf of Investors AdaptHealth Corporation - AHCO,04/21/2021
"The Vanguard Health Care ETF: Timely, Cost-Efficient, Well-Diversified, Attractive Valuation",04/21/2021
"SHAREHOLDER ALERT: Pomerantz Law Firm Investigates Claims On Behalf of Investors of Avenue Therapeutics, Inc. - ATXI",04/21/2021
F Stock: $15 Target By Bank Of America,04/21/2021
Evolus Announces Pricing of Public Offering of Common Stock,04/21/2021
"SHAREHOLDER ALERT: Pomerantz Law Firm Investigates Claims On Behalf of Investors of LifeMD, Inc. - LFMD",04/21/2021
"UFP Industries, Inc. (UFPI) CEO Matt Missad on Q1 2021 Results - Earnings Call Transcript",04/21/2021
"Oil falls 3rd day on U.S. stock build, surging COVID-19 cases",04/21/2021
MGC Pharmaceuticals to acquire worldwide clinical and medical research company MediCaNL,04/21/2021
7.9%-Yielding Teekay LNG Partners Is Our Top Industrials Pick For The Rest Of 2021,04/21/2021
Cathie Wood's Ark Invest Buys Over 5 Million Shares of Skillz,04/21/2021
Toyota Looks To Rival Tesla With The New BZ4X EV,04/21/2021
OCGN Stock: $10 Target By Roth Capital,04/21/2021
Microsoft President on the company's goal to be carbon negative by 2030,04/21/2021
Service and parts carry Rush Enterprises' Q1 earnings,04/21/2021
NorthWestern (NWE) Surpasses Q1 Earnings and Revenue Estimates,04/21/2021
Amazon Now Delves Into Hairdressing Business,04/21/2021
"SHAREHOLDER ALERT: Pomerantz Law Firm Investigates Claims On Behalf of Investors of Ebix, Inc. - EBIX",04/21/2021
"Suntory CEO on Green Initiatives, Pandemic Impact",04/21/2021
"Chipotle Q1 earnings beat Wall Street's estimates, boosted by digital surge",04/21/2021
INVESTOR ALERT: Law Offices of Howard G. Smith Announces Investigation of Credit Suisse Group AG (CS) on Behalf of Investors,04/21/2021
Chalice Mining's Julimar discovery continues to grow as drilling expands high-grade zones,04/21/2021
P.A.M. Transportation sees turnaround in Q1,04/21/2021
China Unicom (Hong Kong) Limited 2020 Annual Report on Form 20-F Filed With the SEC,04/21/2021
INVESTOR ALERT: Law Offices of Howard G. Smith Announces Investigation of Porch Group Inc. (PRCH) on Behalf of Investors,04/21/2021
SHAREHOLDER ALERT: Pomerantz Law Firm Investigates Claims On Behalf of Investors of Infinity Q Diversified Alpha Fund Institutional Class (IQDNX) and Infinity Q Diversified Alpha Fund Investor Class (IQDAX),04/21/2021
Atico Reports Consolidated Financial Results for 2020,04/21/2021
AdvanceTC Received DWAC/FAST Eligibility Approval From DTC,04/21/2021
"Scripps Howard Awards announce 2020 winners, recognize excellence in journalism",04/21/2021
iClick Interactive Asia Group Limited Files 2020 Annual Report on Form 20,04/21/2021
SenSen: North American Operations and Expansion Update,04/21/2021
General Motors and the path to an all-electric future,04/21/2021
CytoDyn Completes $28.5 Million Convertible Note Financing with Conversion Rate at $10.00 Per Share Without Warrants,04/22/2021
"CAT Strategic Metals Closes Second, and Final, Tranche of Private Placement",04/22/2021
Core Lithium makes exploration breakthrough as gravity geophysical survey correlates with Finniss lithium pegmatite distribution,04/22/2021
"Volaris, the Lowest Cost Publicly Traded Airline in the Americas reports Strong Liquidity Position of Ps.8.7 billion as of March 31, 2021",04/22/2021
Central Puerto May Be An Interesting Value Proposition,04/22/2021
SVB Financial Group (SIVB) CEO Gregory Becker on Q1 2021 Results - Earnings Call Transcript,04/22/2021
Crispr Therapeutics: Pipeline Catalyst Triggering Upside,04/22/2021
"Intuitive Surgical, Inc. (ISRG) Presents at Annual Shareholder Meeting Broker Conference Call - (Transcript)",04/22/2021
"U.S. Xpress Enterprises, Inc. (USX) CEO Eric Fuller on Q1 2021 Results - Earnings Call Transcript",04/22/2021
"Skechers U.S.A., Inc. (SKX) Q1 2021 Results - Earnings Call Transcript",04/22/2021
Snap Inc. (SNAP) CEO Evan Spiegel on Q1 2021 Results - Earnings Call Transcript,04/22/2021
"Mattel, Inc. (MAT) CEO Ynon Kreiz on Q1 2021 Results - Earnings Call Transcript",04/22/2021
What Went Down With Skillz Stock Today?,04/22/2021
"Kessler Topaz Meltzer & Check, LLP Reminds Investors of Securities Fraud Class Action Lawsuit Filed Against Canaan Inc.",04/22/2021
"The Hartford Financial Services Group, Inc. (HIG) CEO Chris Swift on Q1 2021 Results - Earnings Call Transcript",04/22/2021
Knowles Corporation's (KN) CEO Jeffrey Niew on Q1 2021 Results - Earnings Call Transcript,04/22/2021
"SHAREHOLDER ALERT: WeissLaw LLP Investigates Colony Bancorp, Inc.",04/22/2021
Voyager Digital's Selloff Will Be Short-Lived,04/22/2021
Tesla branded as 'arrogant' in China as pressure mounts on the electric carmaker,04/22/2021
CalAmp Corp. (CAMP) CEO Jeff Gardner on Q4 2021 Results - Earnings Call Transcript,04/22/2021
"CrossFirst Bankshares, Inc. (CFB) CEOMichael Maddoxon Q1 2021 Results - Earnings Call Transcript",04/22/2021
Carlisle Companies Inc. (CSL) CEO Chris Koch on Q1 2021 Results - Earnings Call Transcript,04/22/2021
Seagate Technology plc (STX) CEO Dave Mosley on Q3 2021 Results - Earnings Call Transcript,04/22/2021
"China's best-selling, GM-backed electric car brand launches a mini convertible",04/22/2021
"Important Investor Reminder: Kessler Topaz Meltzer & Check, LLP Reminds Canoo Inc. Investors of Deadline in Securities Fraud Class Action Lawsuit",04/22/2021
"Kessler Topaz Meltzer & Check, LLP Reminds Investors of Deadline for Securities Fraud Class Action Lawsuit Filed Against Romeo Power, Inc.",04/22/2021
"Oil edges higher on U.S., Europe demand hopes",04/22/2021
Why Ocugen Shares Skyrocketed Today,04/22/2021
Agiliti Announces Pricing of Initial Public Offering,04/22/2021
The Bullish Case On Bumble,04/22/2021
UPDATE - Treace Medical Concepts Announces Pricing of Upsized Initial Public Offering,04/22/2021
Snap Inc beats Wall Street estimates in the fiscal first quarter,04/22/2021
"Profire Energy Sets First Quarter 2021 Conference Call for Thursday, May 6, 2021 at 1:00 p.m. ET",04/22/2021
"MULTIPLAN CORPORATION SHAREHOLDER ALERT BY FORMER LOUISIANA ATTORNEY GENERAL: Kahn Swick & Foti, LLC Reminds Investors with Losses in Excess Of $100,000 of Lead Plaintiff Deadline in Class Action Lawsuits Against MultiPlan Corporation - MPLN",04/22/2021
Alibaba Logistics Arm Starts Daily Hainan-Singapore Cargo Route,04/22/2021
Archegos Mess Hurts Nomura's Key Goal,04/22/2021
Brookside Energy on cusp of spudding high-impact Jewell Well in world-class Anadarko Basin of US,04/22/2021
Pandemic worries boosted silver investing in 2020,04/22/2021
"World Wrestling Entertainment, Inc. (WWE) CEO Vincent McMahon on Q1 2021 Results - Earnings Call Transcript",04/22/2021
DMC Global Inc. (BOOM) CEO Kevin Longe on Q1 2021 Results - Earnings Call Transcript,04/22/2021
SL Green Realty Corp. (SLG) CEO Marc Holliday on Q1 2021 Results - Earnings Call Transcript,04/22/2021
"Socket Mobile, Inc. (SCKT) CEO Kevin Mills on Q1 2021 Results - Earnings Call Transcript",04/22/2021
"VRM CLASS ACTION ALERT: Kessler Topaz Meltzer & Check, LLP Reminds Vroom, Inc. Shareholders of Securities Fraud Class Action Lawsuit",04/22/2021
"Kessler Topaz Meltzer & Check, LLP Announces a Securities Fraud Class Action Lawsuit Filed Against Credit Suisse Group AG (CS)",04/22/2021
Square Widens Its Ecosystem With New Inventory Management Offering,04/22/2021
Treace Medical Concepts Announces Pricing of Upsized Initial Public Offering,04/22/2021
Mattel Seeing Success of Multi-Year Transformation Strategy: CEO,04/22/2021
Freeport-McMoRan Inc. (FCX) CEO Richard Adkerson on Q1 2021 Results - Earnings Call Transcript,04/22/2021
"Sigma Labs, Inc. (SGLB) CEO Mark Ruport on Q1 2021 Results - Earnings Call Transcript",04/22/2021
Braemar Hotels & Resorts Announces Preliminary First Quarter 2021 Results,04/22/2021
Saab AB (SAABF) CEO Micael Johansson on Q1 2021 Results - Earnings Call Transcript,04/23/2021
Depressed Cannabis Stocks Ready To Move Higher,04/23/2021
Carlyle Announces Share Issuances to Consultants,04/23/2021
Coronavirus vaccine: CDC panel recommends using Johnson & Johnson covid vaccine for ages 18+,04/23/2021
"ROSEN, SKILLED INVESTOR COUNSEL, Encourages Romeo Power, Inc. f/k/a RMG Acquisition Corp. Investors with Losses Over $100K to Secure Counsel Before Important Deadline - RMO, RMO.WT, RMG, RMG.WS",04/23/2021
PrimeEnergy Resources Corporation Announces Receipt of Determination Letter from Nasdaq,04/23/2021
Toga Limited's ‘Yippi' App Is Recognized by Alibaba Cloud and Its Listing in the Alibaba Cloud EBook “Global Industry Best Practices on Alibaba Cloud”,04/23/2021
News Alert: Regulators say older merger rules apply to Kansas City Southern,04/23/2021
"WELBILT INVESTOR ALERT By the Former Attorney General of Louisiana: Kahn Swick & Foti, LLC Investigates Adequacy of Price and Process in Proposed Sale of Welbilt, Inc. - WBT",04/23/2021
"SOUTHCREST FINANCIAL INVESTOR ALERT by the Former Attorney General of Louisiana: Kahn Swick & Foti, LLC Investigates Adequacy of Price and Process in Proposed Sale of SouthCrest Financial Group, Inc. - SCSG",04/23/2021
"Deadline Approaching: Kessler Topaz Meltzer & Check, LLP Reminds Investors of Deadline in Securities Fraud Class Action Lawsuit Filed Against Workhorse Group Inc.",04/23/2021
Here's Why Ocugen Stock Rocketed 47% Today -- and Then Gave Up Almost All Its Gains,04/23/2021
Cisco Commits $100 Million to Help Fight Climate Crisis,04/23/2021
"ROSEN, A RESPECTED LAW FIRM, Encourages BELLUS Health Inc. Investors With Losses to Secure Counsel Before Important May 17 Deadline in Securities Class Action - BLU",04/23/2021
Snap Solidifies Its Social Commerce Ambitions,04/23/2021
SHAREHOLDER ALERT: Monteverde & Associates PC Announces an Investigation of Sterling Bancorp - STL,04/23/2021
"ROSEN, RESPECTED INVESTOR COUNSEL, Encourages XL Fleet Corp. Investors With Losses to Secure Counsel Before Important May 7 Deadline in Securities Class Action - XL",04/23/2021
PrimeEnergy Resources Corporation (PNRG) Announces Yearend Production and Financial Results,04/23/2021
"Canoo Inc. Reminder: Kessler Topaz Meltzer & Check, LLP Reminds Investors of Securities Fraud Class Action Lawsuit Filed Against Canoo Inc.",04/23/2021
"Kessler Topaz Meltzer & Check, LLP: Reminds Investors of Securities Fraud Class Action Filed Against FibroGen, Inc.",04/23/2021
"SHAREHOLDER ALERT: Monteverde & Associates PC Announces an Investigation of Knoll, Inc. - KNL",04/23/2021
"ROSEN, RESPECTED INVESTOR COUNSEL, Encourages Ontrak, Inc. Investors With Losses Over $100K to Secure Counsel Before Important May 3 Deadline in Securities Class Action - OTRK",04/23/2021
"ROSEN, LEADING INVESTOR COUNSEL, Encourages 3D Systems Corp. Investors with Losses Over $100K to Secure Counsel Before Important Deadline in First Filed Securities Class Action Commenced by the Firm - DDD",04/23/2021
"ROSEN, SKILLED INVESTOR COUNSEL, Encourages Athenex, Inc. Investors With Losses Over $100K to Secure Counsel Before Important May 3 Deadline in Securities Class Action - ATNX",04/23/2021
"Investor Reminder: Kessler Topaz Meltzer & Check, LLP Reminds Investors of Securities Fraud Class Action Lawsuit Filed Against Romeo Power, Inc. - RMO",04/23/2021
American Electric Power CEO: The clean energy economy is moving,04/23/2021
"Marquette National Corporation Annual Meeting of Stockholders Will Be Held on May 13, 2021",04/23/2021
Nucor CEO: We anticipate 2021 staying strong throughout the year,04/23/2021
Skyworks CEO on chipmaker's planned entrance into the automotive end market,04/23/2021
"Class Action Alert: Kessler Topaz Meltzer & Check, LLP Reminds CAN Investors for Securities Fraud Class Action Lawsuit",04/23/2021
"ROSEN, RESPECTED INVESTOR COUNSEL, Encourages Renewable Energy Group, Inc. Investors to Secure Counsel Before Important May 3 Deadline in Securities Class Action - REGI",04/23/2021
Report: AT&T Seeking Buyer for WarnerMedia Unit Rooster Teeth,04/23/2021
The Community Financial Corporation Announces Record Results of 1.22% Return on Average Assets for First Quarter 2021,04/23/2021
"Kessler Topaz Meltzer & Check, LLP Announces a Securities Fraud Class Action Lawsuit Filed Against Root, Inc. (ROOT)",04/23/2021
"ROK Files 2020 Financial Results, Reserve Report, and Management Discussion & Analysis",04/23/2021
Johnson & Johnson Single-Shot COVID-19 Vaccinations to Resume in the U.S. for All Adults Aged 18 and Older Following CDC and FDA Decision,04/23/2021
"Shareholder Alert: Kessler Topaz Meltzer & Check, LLP Reminds Shareholders of CytoDyn Inc. of Securities Class Action Lawsuit",04/23/2021
Electronic Arts Has Trailed Videogame Rivals. Why the Stock Could Catch Up Soon.,04/23/2021
"MMTEC, Inc. Announces 2020 Year-End Financial Results",04/23/2021
GW Pharmaceuticals Stockholders Approve Acquisition by Jazz Pharmaceuticals,04/23/2021
"CDC, FDA lift recommended pause on use of J&J vaccine",04/23/2021
"Kessler Topaz Meltzer & Check, LLP Reminds Shareholders of Leidos Holdings, Inc. of Deadline in Securities Fraud Class Action Lawsuit",04/23/2021
"SHAREHOLDER ALERT: Monteverde & Associates PC Announces an Investigation of Colony Bancorp, Inc. - CBAN",04/23/2021
New Kardashian Skincare Line Helps Coty Relaunch,04/23/2021
How Soon Before the Chip Shortage Ends? Taiwan Semi Looks to 2022.,04/23/2021
Why Snap Stock Surged Today,04/23/2021
Indiva May be Delayed in Filing Annual Audited Financial Statements,04/23/2021
Weekend Unlimited Announces Name Change and Share Split,04/23/2021
"U.S. lifts pause, allowing J&J COVID-19 vaccinations to resume",04/23/2021
"Subversive Acquisition LP Closes Transaction With InterCure, Israel's Leading and Fastest-Growing Cannabis Company",04/23/2021
U.S. IPO Weekly Recap: UiPath's Billion-Dollar Deal Leads A 12 IPO Week,04/24/2021
"Mastercard executive discusses building a brand, and focusing on consumers and their emotions",04/24/2021
FSR Stock Price: $10 Target (Down From $15) By Goldman Sachs,04/24/2021
F Stock Price: $15 Target (Up From $13) By Wolfe Research,04/24/2021
"INTZ BREAKING NEWS: ROSEN, GLOBAL INVESTOR COUNSEL, Encourages Intrusion Inc. Investors with Losses Exceeding $100K to Secure Counsel Before Important Deadline - INTZ",04/24/2021
KHC Stock: $41 Target By Piper Sandler,04/24/2021
"EBS INVESTOR NOTICE: ROSEN, LEADING INVESTOR COUNSEL, Encourages Emergent BioSolutions Inc. Investors with Losses Exceeding $100K to Secure Counsel Before Important Deadline - EBS",04/24/2021
"U.S. Weekly FundFlows Insight Report: ETF, Mutual Fund Investors Inject Taxable Fixed Income Funds With $8.6 Billion In Cash",04/24/2021
These Sports Betting Stocks Have the Best Chance to Profit Now,04/24/2021
These Big Dividends Are The Market's Last True Bargains,04/24/2021
"ROSEN, A LEADING AND LONGSTANDING LAW FIRM, Encourages Neptune Wellness Solutions Inc. Investors with Losses to Secure Counsel Before Important May 17 Deadline in Securities Class Action – NEPT",04/24/2021
