HSBC Grooms Leaders for China Push,01/12/2021
NVIDIA Corporation (NVDA) Management Presents at Goldman Sachs Technology & Internet Conference (Transcript),01/12/2021
Mondelez International Among Three Analyst Food Industry Top Stocks,01/12/2021
AAPL Stock Price: $155 Target (Raised From $140) By Wells Fargo,01/12/2021
Zoom Announces Pricing of $1.75 Billion Public Offering,01/12/2021
Moderna and Uber Teaming Up on Coronavirus Vaccine Awareness Push,01/12/2021
Stop Picking Tulips And Take A Look At OneWater,01/12/2021
Why Gevo Stock Surged 27% Today,01/12/2021
Oil prices extend gains after U.S. inventory drop,01/12/2021
Allegiant Reports December 2020 Traffic,01/12/2021
Nokia and M1 partner with 5G standalone Core to drive Singapore's 5G ecosystem,01/12/2021
"Solar Stocks On Fire: Sunrun CFO Discusses Industry Growth, Company Plans",01/12/2021
Billtrust Finishes SPAC Merger To Go Public,01/12/2021
IPO Report: Affirm reportedly prices IPO well above target to raise $1.2 billion,01/12/2021
Mountain Crest Acquisition Corp. II Announces Closing of $50 Million Initial Public Offering,01/12/2021
FCEL Stock Price Increased 20.95%: Why It Happened,01/12/2021
These Favorite IPO Stocks Could Be the Market's Biggest Winners From Pent-Up Demand,01/12/2021
Zoom Video Communications Floating $1.5 Billion Stock Issue,01/12/2021
"Alcon, Inc. (ALC) Presents at JPMorgan Healthcare Conference - (Transcript)",01/12/2021
Amarin Corporation PLC (AMRN) CEO John Thero Presents at the 39th Annual JPMorgan Virtual Healthcare Conference (Transcript),01/12/2021
Buyer Consortium Responds to Hollysys Automation Technologies' Rejection of the Proposal and Recent Efforts to Further Disenfranchise Shareholders and Entrench the Board,01/12/2021
NorthWestern Energy to Host Year-End 2020 Financial Results Webcast,01/12/2021
Realty Income Floating $582 Million Stock Issue,01/12/2021
Braveheart Announces Renegotiation of Loan Agreement and Partial Settlement of Debt,01/12/2021
"Concrete Pumping Holdings, Inc. (BBCP) CEO Bruce Young on Q4 2020 Results - Earnings Call Transcript",01/12/2021
5 ETFs to Enhance to Your Portfolio in 2021,01/12/2021
Exfo (EXFO) Tops Q1 Earnings and Revenue Estimates,01/12/2021
KAR Auction CEO says pandemic sped up digital transition by three years,01/12/2021
Hewlett Packard Enterprise Co (HPE) Presents at Jefferies Virtual Software Bus Tour - (Transcript),01/13/2021
Nano Dimension Prices $332.5 Million Registered Direct Offering,01/13/2021
Connecticut investigating Amazon's e-book business,01/13/2021
"Minerco, Inc the Magic Mushroom Company Announces Sankofa Shareholder and Vision Summit on January 24, 2021",01/13/2021
"Spero: Tebipenem HBr's H2 2021 NDA, SPR720's Phase 2a Data Release And More",01/13/2021
Score Media and Gaming Inc. (TSCRF) CEO John Levy on Q1 2021 Results - Earnings Call Transcript,01/13/2021
China National Medical Products Administration Approves Tislelizumab in Combination with Chemotherapy in First-Line Advanced Squamous Non-Small Cell Lung Cancer,01/13/2021
China's Xi asks Starbucks' Schultz to help promote U.S.-China cooperation: state media,01/13/2021
Aritzia Inc. (ATZAF) CEO Brian Hill on Q3 2021 Results - Earnings Call Transcript,01/13/2021
Poshmark is pushing into the public market at a high-end valuation as the resale market sizzles,01/13/2021
"Safe Dividend, Why Reinsurance Group Of America Is Set For A Comeback",01/13/2021
"ALJ Regional Holdings, Inc.'s (ALJJ) CEO Jess Ravich on Q4 2020 Results - Earnings Call Transcript",01/13/2021
"LAWSUITS FILED AGAINST PINS, SPLK and KNDI - Jakubowitz Law Pursues Shareholders Claims",01/13/2021
Tesla's Success in China,01/13/2021
Alibaba's Jumbo Bond Sale in Doubt,01/13/2021
"Aldeyra Therapeutics, Inc. Announces Pricing of Public Offering of Common Stock",01/13/2021
"Volt Information Sciences, Inc. (VOLT) CEO Linda Perneau on Q4 2020 Results - Earnings Call Transcript",01/13/2021
"The Klein Law Firm Reminds Investors of Class Actions on Behalf of Shareholders of LRN, BRY and OTGLY",01/13/2021
"Tesla Asked To Recall 158,000 Model S, X Units By US Over Touchscreen Failures",01/13/2021
Department Stores Continue Slide As Nordstrom Reports 22 Pct Holiday Drop,01/13/2021
Environmental Impact Acquisition Corp. Announces Pricing of Upsized $180 Million Initial Public Offering,01/13/2021
"Alibaba's Cainiao launches container booking service, cites global cargo woes",01/13/2021
"DEADLINE ALERT: Bragar Eagel & Squire, P.C. Reminds Investors That a Class Action Lawsuit Has Been Filed Against Berry Corporation and Encourages Investors to Contact the Firm",01/13/2021
"DEADLINE ALERT: Bragar Eagel & Squire, P.C. Reminds Investors That a Class Action Lawsuit Has Been Filed Against Stride, Inc. (f/k/a K12, Inc.) and Encourages Investors to Contact the Firm",01/13/2021
"DEADLINE ALERT: Bragar Eagel & Squire, P.C. Reminds Investors That a Class Action Lawsuit Has Been Filed Against Pinterest, Inc. and Encourages Investors to Contact the Firm",01/13/2021
BP Admits It Supplied Oil To Mauritius Oil Spill Ship MV Wakashio,01/13/2021
REPAY Announces Pricing of Upsized Convertible Notes Offering,01/13/2021
"Poshmark, Inc. Announces Pricing of Initial Public Offering",01/13/2021
"Tesla asked by federal regulators to voluntarily recall 158,000 vehicles over safety-functions defect",01/13/2021
REPAY Announces Pricing of Public Offering of Common Stock,01/13/2021
Oil prices dip on rise in virus cases; U.S. stock draw checks losses,01/13/2021
"Shareholder Alert: Ademi LLP Investigates whether FBL Financial Group, Inc. has obtained a Fair Price in its transaction with Farm Bureau Property & Casualty Insurance Company and Iowa Farm Bureau Federation",01/13/2021
Petco prices IPO above target range to raise $816 million,01/13/2021
Snapchat Follows In Twitter's Footsteps To Permanently Boot Out Donald Trump,01/13/2021
"Kessler Topaz Meltzer & Check, LLP: Securities Fraud Class Action Filed Against Restaurant Brands International Inc.",01/13/2021
Lemonade Announces Upsizing and Pricing of Public Offering of Common Stock,01/13/2021
Connecticut probes Amazon's e-book business for anti-competitive practices,01/13/2021
"CORRECTION -- INTRUSION Successfully Completes Beta Testing of its Newest Cybersecurity Solution, Shield; Announces General Availability",01/13/2021
KKR Closes First Asia Real Estate Fund at US$1.7 billion,01/13/2021
Are Airline Stocks Ready To Move Higher?,01/13/2021
"U.S. vehicle safety agency asks Tesla to recall 158,716 older vehicles over touchscreen glitches",01/13/2021
Parler asks U.S. court to order Amazon to restore service to social media app,01/13/2021
"Tesla asked to recall 158,000 Model S and Model X vehicles over a safety defect involving failing touchscreens (TSLA)",01/13/2021
Evoke Pharma Announces Pricing of Public Offering of Common Stock,01/13/2021
Connecticut is investigating Amazon's practices in the e-books market.,01/13/2021
Petco Announces Pricing of Initial Public Offering,01/13/2021
Snapchat is permanently banning Trump's account,01/13/2021
"Petco prices IPO above estimated range, raising $864 million",01/13/2021
Snapchat Will Permanently Ban Trump,01/13/2021
Airbnb's Head Of Global Policy on Cancelling D.C. Reservations During Biden's Inauguration,01/13/2021
"Axion Ventures Files Claim Against Former CEO and Monaker Group, Inc.",01/14/2021
Dynex Capital: This Time Isn't Different,01/14/2021
Facebook Sues Two Over Scraping User Data Through Malicious Browser Extensions,01/14/2021
Xiaomi and other Chinese companies slapped with US restrictions as Trump's term winds down,01/14/2021
New Oriental: Well-Positioned For Growth In Chinese After-School Tutoring,01/14/2021
"Canopy Rivers: 30% Price Increase Baked In, But There's Potential For More",01/14/2021
Moderna to Test Coronavirus Vaccine Booster Shot in New Clinical Trial,01/14/2021
"Tesla Gets $1,250 Bull Case Target From Wedbush As EV Market Remains Its World Where Others 'Paying Rent'",01/14/2021
Airbnb CEO: Post-Pandemic Travel Will Focus On Smaller Cities,01/14/2021
"890 5th Avenue Partners, Inc. Announces Closing of $287.5 Million Initial Public Offering",01/14/2021
Triumph Group to Webcast Third Quarter Fiscal Year 2021 Earnings Conference Call,01/14/2021
Accolade To Buy 2nd.MD To Boost Telehealth Options,01/14/2021
IMAX: More Upside Than Downside,01/14/2021
Moderna Plans COVID-19 Booster Shots: What You Need To Know,01/14/2021
Cresco Labs Announces Proposed Offering of Subordinate Voting Shares,01/14/2021
"Rosen Law Firm Announces Filing of Securities Class Action Lawsuit Against Tricida, Inc. – TCDA",01/14/2021
Skillful Craftsman Announces Financial Results for The First Six Months of Fiscal Year 2021,01/14/2021
"Cisco and Acacia Communications Merger Going Forward After All, With Revisions",01/14/2021
Why BorgWarner Lets You Participate In EV Growth On The Cheap,01/14/2021
Alarm.com Prices $435.0 Million 0% Convertible Senior Notes Offering (up 47.5% Conversion Premium),01/14/2021
Lantern Pharma Announces Pricing of $60 Million Public Offering,01/14/2021
U.S. Banks to Benefit From 'Peace Dividend': Analyst Mayo,01/14/2021
Why BlackBerry Stock Spiked 37% Today,01/14/2021
Driven Brands Holdings Inc. Announces Pricing of Initial Public Offering,01/14/2021
Amazon faces class-action lawsuit over eBook pricing,01/14/2021
Trump designates Xiaomi as 'Communist Chinese military' company,01/14/2021
Washington Federal (WAFD) Beats Q1 Earnings and Revenue Estimates,01/14/2021
Oil mixed as Chinese lockdowns raise demand questions,01/14/2021
Amwell Announces Pricing of Secondary Public Offering,01/14/2021
Xiaomi shares fall 10% as U.S. adds smartphone-maker to 'blacklist',01/14/2021
ConocoPhillips Announces Extension of the Expiration Date for Exchange Offers and Consent Solicitations,01/14/2021
"Cisco CEO defends revised Acacia deal, calls new valuation 'reasonable'",01/14/2021
Playtika Announces Pricing of Initial Public Offering,01/14/2021
Atlantic Power Agrees to be Acquired by I Squared Capital,01/14/2021
"Hennessy Capital Investment Corp. V Announces Pricing of Upsized $300,000,000 Initial Public Offering",01/14/2021
"Why Oceaneering Intl., GasLog, Occidental, and Patterson-UTI Energy All Rallied Strongly Today",01/14/2021
Boral Class Action Reminder,01/14/2021
Healthcare Capital Corp. Announces Pricing of Upsized $240 Million Initial Public Offering,01/14/2021
SHAREHOLDER ALERT: WeissLaw LLP Investigates Crescent Acquisition Corp,01/14/2021
Qilian International Holding Group Limited Announces Closing of Initial Public Offering,01/14/2021
Tanger Factory Outlets Reinstates Dividend; Yield Is 5.5%,01/14/2021
Interxion: A Digital Realty Company Collaborates With PCCW Global To Deliver Submarine Cable Gateway To Europe,01/14/2021
"SHAREHOLDER ALERT: Rigrodsky Law, P.A. Announces Investigation of Hudson Executive Investment Corp. Merger",01/14/2021
"Signet's move into selling jewelry online yields strong holiday results, CEO says",01/14/2021
Jewett-Cameron Is An Overlooked Pandemic Winner,01/14/2021
"Pioneer Natural Resources Announces Pricing of Public Offering of $750.0 Million of 0.750% Senior Notes Due 2024, $750.0 Million of 1.125% Senior Notes Due 2026 and $1.0 Billion of 2.150% Senior Notes Due 2031",01/14/2021
"New strains of virus discovered in the U.S., J&J vaccine generates immune response",01/14/2021
Cruz Cobalt Corporate Update,01/14/2021
Honeywell teams with North Carolina businesses to help accelerate Covid vaccine rollout,01/14/2021
"iSIGN Media Announces Closing of the First Tranche of its Previously Announced Private Placement of up to $236,700",01/14/2021
Pomerantz Law Firm Announces the Filing of a Class Action against Decision Diagnostics Corporation and Certain Officers - DECN,01/15/2021
ZM Stock Price: $550 Target By BTIG,01/15/2021
GM to invest C$1 billion in Canada plant to manufacture electric vans,01/15/2021
"Saxena White P.A. Files Securities Fraud Class Action Against Penumbra, Inc.",01/15/2021
"PEABODY ENERGY INVESTIGATION INITIATED by Former Louisiana Attorney General: Kahn Swick & Foti, LLC Investigates the Officers and Directors of Peabody Energy Corp. - BTU",01/15/2021
NOK Stock Price Increased By 6.25% This Past Week: Why It Happened,01/15/2021
TLRY Stock Price Increased 78.44% This Past Week: Why It Happened,01/15/2021
"Bank earnings: JPMorgan, Citigroup, Wells Fargo kick off earnings season",01/15/2021
Apartment Investment and Management Company Announces 2020 Dividend Income Tax Allocation,01/15/2021
Walgreens Statement in Support of President-Elect Biden's COVID-19 Update,01/15/2021
Altabancorp (ALTA) Surges: Stock Moves 6.4% Higher,01/15/2021
"SHAREHOLDER ALERT: Monteverde & Associates PC Announces an Investigation of FBL Financial Group, Inc. - FFG",01/15/2021
"DEADLINE ALERT: Bragar Eagel & Squire, P.C. Reminds Investors That a Class Action Lawsuit Has Been Filed Against JOYY, Inc. and Encourages Investors to Contact the Firm",01/15/2021
"Peabody Announces Extended Early Tender Results Of Exchange Offer And Consent Solicitation, Further Extension Of Early Tender Date And Waiver And Satisfaction Of Minimum Tender Condition",01/15/2021
3M Stock Is Unloved and Underpriced. Here's Why It Could Shoot Up Higher.,01/15/2021
"Citigroup, Inc. (C) CEO Michael Corbat on Q4 2020 Results - Earnings Call Transcript",01/15/2021
"The Dow Dropped Exxon Mobil in August. But as Oil Prices Rise, So Does Its Stock.",01/15/2021
"Porch Group boosts 2021 forecasts with new acquisitions, in wake of December SPAC deal",01/15/2021
"NW Natural Holdings Schedules Earnings Release and Conference Call for Friday, February 26",01/15/2021
Toyota hit with a $180 million fine for Clean Air Act violations,01/15/2021
MercadoLibre To Expand Electric Fleet After $1.1 Billion Bond Sale,01/15/2021
Jim Cramer: 5G now has momentum needed to invest in,01/15/2021
"Hamilton Lane Alliance Holdings I, Inc. Announces Closing of Initial Public Offering and Full Exercise of Overallotment Option",01/15/2021
Credit card firm Capital One fined for violating U.S. anti-money laundering law,01/15/2021
NuLegacy Gold Reports Closing 100 Million Units PP,01/15/2021
Similar Shares Duel,01/15/2021
Why Ceragon Networks Stock Rocketed 54% Friday,01/15/2021
"Integer Schedules Fourth Quarter and Full-Year 2020 Earnings Release and Conference Call for February 18, 2021",01/15/2021
American Lithium Comments on Recent Promotional Activity,01/15/2021
"All lending is heading toward the use of AI, online lending marketplace Upstart CEO says",01/15/2021
Why Tellurian Blasted 25% Higher on Friday,01/15/2021
Porch Group CEO on developing a marketplace to connect consumers with home service providers,01/15/2021
"After long journey, Fiat Chrysler and PSA to seal merger to become Stellantis",01/15/2021
"Harborside Inc. Announces Departure of Chief Operating Officer, Greg Sutton",01/15/2021
Why Marijuana Stock Aphria Climbed as High as 15% Today,01/15/2021
"The Law Offices of Frank R. Cruz Announces Investigation of CleanSpark, Inc. (CLSK) on Behalf of Investors",01/15/2021
Why AMC Entertainment Stock Finished Higher Today,01/15/2021
Lithium Americas Receives Record of Decision for Thacker Pass,01/15/2021
FinCEN Hits Capital One For $390 Million; Says Bank Violated Bank Secrecy Act,01/15/2021
TSMC's Earnings Paints Bright Future For Chip Makers,01/15/2021
FIVERR INTL LTD (FVRR) Dips More Than Broader Markets: What You Should Know,01/15/2021
Vertex Pharmaceuticals (VRTX) Stock Moves -0.25%: What You Should Know,01/15/2021
"Zoom Video Communications, Inc. (ZM) Gains As Market Dips: What You Should Know",01/15/2021
Bristol-Myers Squibb (BMY) Gains As Market Dips: What You Should Know,01/15/2021
Teladoc (TDOC) Stock Moves -0.13%: What You Should Know,01/15/2021
Lockheed Martin (LMT) Stock Moves -0.05%: What You Should Know,01/15/2021
Editas Medicine (EDIT) Gains As Market Dips: What You Should Know,01/15/2021
NextEra Energy (NEE) Stock Moves -0.59%: What You Should Know,01/15/2021
DocuSign (DOCU) Stock Moves -0.39%: What You Should Know,01/15/2021
3M (MMM) Stock Moves -0.52%: What You Should Know,01/15/2021
SHAREHOLDER ALERT: Pomerantz Law Firm Investigates Claims On Behalf of Investors of JOYY Inc. - YY,01/16/2021
CRNT Stock Price Increases 53.97%: Why It Happened,01/16/2021
"Potential for Small, Targeted PSPS Event in Nine Counties: Forecasted Strong, Offshore Winds and Dry Conditions Mean PG&E May Need to Proactively Turn Off Power for Safety to Approximately 21,000 Customers Monday Night",01/16/2021
Quantumscape (QS): Jens Wiese Joins Board Of Directors,01/16/2021
AVGR Stock Price Increased 32.43%: Why It Happened,01/16/2021
Expedia's Vrbo hit with backlash for not following Airbnb's lead and canceling D.C. reservations,01/16/2021
"BNGO Stock Price Increases 1,552.94% Over The Past Month: Why It Happened",01/16/2021
Stitch Fix President On Booming Growth Amid Pandemic,01/16/2021
"Facebook to ban ads promoting weapon accessories, protective gear in U.S.",01/16/2021
Activision Blizzard shares are trading near an all-time high as video game sales continue to rise,01/16/2021
"Investor Reminder: Kessler Topaz Meltzer & Check, LLC Reminds Investors of Splunk Inc. of Fast Approaching Deadline",01/16/2021
"ROSEN, LEADING GLOBAL INVESTOR COUNSEL, Reminds QuantumScape Corporation Investors of Important March 8 Deadline in Securities Class Action; Encourages Investors with Losses in Excess of $100K to Contact Firm - QS",01/16/2021
Apple Tests Foldable Screen For iPhone: Bloomberg,01/16/2021
Airline Industry's Top Lobbying Group Will Retain Its Republican Chief,01/16/2021
"ROSEN, GLOBALLY RECOGNIZED INVESTOR COUNSEL, Reminds CD Projekt S.A. Investors of Important February 22 Deadline in Securities Class Action First Filed by the Firm; Encourages Investors with Losses in Excess of $100K to Contact Firm - OTGLY, OTGLF",01/16/2021
Notable Insider Buys Of The Past Week: Conagra Brands Plus Plenty Of Biotech Activity,01/16/2021
"Canada's Couche-Tard drops Carrefour takeover plan, companies say",01/16/2021
"ROSEN, A LEADING AND LONGSTANDING LAW FIRM, Reminds Splunk Inc. Investors of Important Deadline in Securities Class Action - SPLK",01/16/2021
Alimentation Couche-Tard to Host Conference Call,01/16/2021
Couche-Tard and Carrefour seek cooperation after takeover scrapped: BFM TV,01/16/2021
Joint Announcement Between Alimentation Couche-Tard and Carrefour,01/16/2021
"ROSEN, A TOP RANKED LAW FIRM, Reminds Sona Nanotech Inc. Investors of Important February 16 Deadline in First Filed Securities Class Action Commenced by the Firm; Encourages Investors with Losses in Excess of $100K to Contact Firm - SNANF",01/16/2021
Wynn Resorts Gets Its WynnBET App Into Four More States,01/16/2021
GM To Begin Producing New Line Of Electric Commercial Vans This Year In Canada,01/16/2021
Analyst: PayPal Holdings Has 46% Upside Thanks to Bitcoin Surge,01/16/2021
"ROSEN, A TOP RANKED LAW FIRM, Reminds ACM Research, Inc. Investors of Important February 19 Deadline in Securities Class Action – ACMR",01/16/2021
"ROSEN, LEADING AND LONGSTANDING INVESTOR COUNSEL, Reminds SolarWinds Corporation Investors of Important March 5 Deadline in First Filed Securities Class Action Commenced by the Firm; Encourages Investors with Losses in Excess of $100K to Contact Firm – SW",01/16/2021
The Only Tech Stock You Need to Buy in 2021,01/16/2021
S.E.C. Probe Of Exxon Renews Focus On Company's Resistance To Write-downs,01/16/2021
American Airlines and JetBlue Get DOT Clearance for Northeast Alliance,01/16/2021
"HAGENS BERMAN, NATIONAL TRIAL ATTORNEYS, Alerts JOYY (YY) Investors to January 19th Deadline in Securities Fraud Lawsuit, Investors with $250K+ Losses Should Contact Its Attorneys Now",01/16/2021
Report: Uber Technologies to Spin Off Postmates Robot Delivery Unit,01/16/2021
AAR (AIR) Up 10.3% Since Last Earnings Report: Can It Continue?,01/16/2021
Accenture (ACN) Down 4.1% Since Last Earnings Report: Can It Rebound?,01/16/2021
FedEx (FDX) Down 13.6% Since Last Earnings Report: Can It Rebound?,01/16/2021
Why Is BlackBerry (BB) Up 19.1% Since Last Earnings Report?,01/16/2021
General Mills (GIS) Down 5.8% Since Last Earnings Report: Can It Rebound?,01/16/2021
Jabil (JBL) Up 1.2% Since Last Earnings Report: Can It Continue?,01/16/2021
Why Is Navistar (NAV) Down 0.5% Since Last Earnings Report?,01/16/2021
Rite Aid (RAD) Down 9.1% Since Last Earnings Report: Can It Rebound?,01/16/2021
Sanderson Farms (SAFM) Down 7.3% Since Last Earnings Report: Can It Rebound?,01/16/2021
"Rosen, Globally Recognized Investor Counsel, Reminds Restaurant Brands International Inc. Investors of Important February 19 Deadline in Securities Class Action; Encourages Investors with Losses in Excess of $100K to Contact the Firm - QSR",01/16/2021
Apple Reportedly Considering iPhone With Foldable Screen,01/16/2021
"Manulife: With A Dividend Yield Of 4.6%, The Common Shares Are Now Very Appealing",01/16/2021
"Rosen, A Top Ranked Law Firm, Reminds Kandi Technologies Group, Inc. Investors of Important Deadline in Securities Class Action; Encourages Investors with Losses in Excess of $100K to Contact Firm - KNDI",01/16/2021
EnerSys: Protecting The Free Cash Flows During The Pandemic,01/16/2021
"Short Seller Andrew Left Goes Sour On Lemonade, Says Company Lies To Shareholders",01/16/2021
3 of the Best Dividend Stocks to Buy in 2021,01/16/2021
"Toga Limited Unveils Yippi X, New Mobile Apps and Partnerships at the Inaugural ASEAN New Tech Conference",01/16/2021
"Nestle recalls more than 760,000 pounds of Hot Pockets because they might contain bits of plastic and glass",01/16/2021
The Best ETFs For Dividend Investors: 1-Year Review,01/17/2021
Heritage Commerce Corp.: Reliable Rising Dividends,01/17/2021
Gladstone Commercial: Preferreds Offer More Attractive Risk-Adjusted Return Than Common Shares,01/17/2021
Altria: Reasons To Buy And Reasons To Avoid,01/17/2021
Tesla says starts delivering Shanghai-made Model Y in China,01/17/2021
Oil drops 1% as rising coronavirus cases end supply-led rally,01/17/2021
Delivery Delays Of 3 Months Or More Hamper Peloton,01/17/2021
Senseonics Holdings Announces $50.0 Million Registered Direct Offering of Common Stock,01/17/2021
UBS Eyes $400 Million Investment In India's Paytm,01/17/2021
"XITK: Innovation Growth Fund, Strong High-Growth Holdings, Market-Beating Shareholder Returns",01/17/2021
Mitsubishi Electric and Tokyo Tech Develop Blockchain Technology to Optimize P2P Energy Trading,01/17/2021
JPMorgan Provides $100 Million Financing Facility To Figure For Mortgage Lending,01/17/2021
Keystone XL commits to become first pipeline to be fully powered by renewable energy,01/17/2021
CII: Discounted And Attractive ~6% Yield,01/17/2021
United Natural Foods' Pension Problems: Not As Significant As You Think,01/17/2021
Score Media: Scoring The Canadian Opportunity,01/17/2021
Hilton Worldwide Holdings: Showing Resilience In A Tough Environment,01/17/2021
"As Major Offshore Windstorm Approaches, PG&E Prepares for Potential Widespread, Wind-Driven Outages Throughout Its Service Area and Potential for Targeted Public Safety Power Shutoffs in Small Portions of the Driest Locations",01/17/2021
Greenbriar Provides Montalva Update,01/17/2021
J.C. Penney Is Searching For Its Next CEO. Here's What The Board Should Be Shopping For,01/17/2021
SRNE Stock Price: $30 Target From H.C. Wainwright,01/17/2021
Altria Is The Anti-Tesla,01/17/2021
"Equity Bancshares, Inc. Will Announce Fourth Quarter 2020 Results on January 25, 2021",01/17/2021
Week In Review: BeiGene Signs $2.2 Billion Deal With Novartis For PD-1,01/17/2021
Howard Hughes: Bill Ackman Is Buying And I Am Too,01/17/2021
Armanino Foods: A True Cash Cow,01/17/2021
Magnite: A Second Chance At Investing In A High Growth Industry,01/17/2021
DRVN Stock Price Climbs 21.32% In Public Debut,01/17/2021
Elevate Credit: Time To Elevate This Fintech In Your Portfolio,01/17/2021
Zoom Stock (ZM) Reversal Triggers Trading Buy Signal,01/17/2021
In ExxonMobil's Defense,01/17/2021
Apple's Tim Cook On Taking Down Parler: 'We're always trying to do the right thing',01/17/2021
Boston Properties Was Built For A Pre-COVID-19 World,01/17/2021
Google disputes Texas' suit claiming unfair advertising sales practices,01/17/2021
Axon: Ride The Lightning,01/17/2021
Retail Series: Costco Still Has Long Growth Runway,01/17/2021
"Nordic American Tankers: Good Dividends For An Oil Tanker Company, But That's Not Saying Much",01/17/2021
"Banco Santander: Dividend Green Light, But Shares At Fair Value",01/17/2021
T. Rowe Price: A Steady Hand In A Changing Sector,01/17/2021
CVS: Don't Invest Using The Rearview Mirror,01/17/2021
Has Prince Charles' Nature Pledge Become A Platform For BP To Greenwash Oil Spills?,01/17/2021
Flexion Therapeutics: Fighting Through COVID-19 Headwinds,01/17/2021
Exxon Mobil: Starting 2021 On (Almost) The Right Track,01/17/2021
"Kessler Topaz Meltzer & Check, LLP: Securities Fraud Class Action Filed Against QuantumScape Corporation (NYSE: QS)",01/17/2021
"Celldex: New Monoclonal Therapeutic Line, 1Q21's CDX-0159's Initial Trial Data, And More",01/17/2021
The new name and governance of Stellantis take effect,01/17/2021
Dorchester Minerals: A Warren Buffett Investment,01/17/2021
IMAX CEO discusses streaming competition and how the coronavirus impacted going to movies,01/17/2021
"ROSEN, TRUSTED INVESTOR COUNSEL, Reminds Qiwi plc Investors of Important February 9 Deadline in First Filed Securities Class Action Commenced by the Firm; Encourages Investors with Losses in Excess of $100K to Contact the Firm - QIWI",01/17/2021
Zscaler: Will Remain An Industry Leader For Much Of This Decade; Buy Shares Opportunistically,01/17/2021
Triterras Authorizes $50 Million Share Repurchase Program and Provides Update on Recent Events,01/18/2021
Cuomo Asks Pfizer To Let New York Purchase COVID-19 Vaccine Directly,01/18/2021
Letting Your Winners Run: A Dividend Growth Investor's Perspective,01/18/2021
Slate Grocery REIT: Buy Its Dividend Yield Of ~9%,01/18/2021
