Caught my Eye: Newspaper Giant McClatchy Files for Bankruptcy,2/14/2020
Capgemini SE (CAPMF) CEO Paul Hermelin on Q4 2019 Results - Earnings Call Transcript,2/14/2020
Merck's Ebola Vaccine Approved for Use in Four African Countries,2/14/2020
"Warren Buffett's Berkshire Hathaway increases shares of Kroger, decreases shares of major banks",2/14/2020
Berkshire's new stakes: 4 trades,2/14/2020
Medical Pot Legalization Bill Introduced in Alabama,2/14/2020
IBD Live: Are Marijuana Stocks Due For A Comeback?,2/14/2020
AstraZeneca's (AZN) CEO Pascal Soriot on Q4 2019 Results - Earnings Call Transcript,2/14/2020
"Google to restructure Cloud business, with some roles eliminated",2/14/2020
Banco Latinoamericano de Comercio Exterior's (BLX) CEO Gabriel Tolchinsky on Q4 2019 Results - Earnings Call Transcript,2/14/2020
Chartmaster looks at Dupont and Halliburton,2/14/2020
"Weak Apparel Spending in January Underscores Macy's, Kohl's Struggle",2/14/2020
Boeing tells FAA it does not believe 737 MAX wiring should be moved: sources,2/14/2020
Inside Berkshire's playbook,2/14/2020
Banco Macro (BMA) Outpaces Stock Market Gains: What You Should Know,2/14/2020
Talend S.A. (TLND) CEO Christal Bemont on Q4 2019 Results - Earnings Call Transcript,2/14/2020
"Buffett's Berkshire buys Kroger and Biogen, reduces Wells Fargo and Goldman stakes",2/14/2020
"Cost-cutting, layoffs ahead for scandal-plagued Wells Fargo, analyst warns",2/15/2020
Where Does AT&T TV Fit Into the Pay-TV Market?,2/15/2020
"New Illegal Blockades in Vaughan and Vancouver, CN Concerned About Safety",2/15/2020
Microsoft president says big tech has 'fundamental responsibility' to protect US voting process,2/15/2020
Is This 14% Yield a Dividend Trap or an Unbeatable Buy?,2/15/2020
Samsung Galaxy Z Flip: Our first 24 hours,2/15/2020
3 Top Energy Stocks to Buy in February,2/15/2020
U.S. weighs blocking GE engine sales for China's new airplane: sources,2/15/2020
Tesla Model S Now Boasts Up to 390 Miles of Range,2/15/2020
"Despite a Fat Dividend, Kraft Heinz Is a Terrible Investment",2/15/2020
"Trump administration may stop exporting engines co-manufactured by GE to China, WSJ says",2/15/2020
Air Lease Corporation (AL) CEO John Plueger on Q4 2019 Results - Earnings Call Transcript,2/15/2020
Glu Mobile Surged on Earnings: Is It Time to Believe in the Turnaround?,2/15/2020
Under 5 Hours: British Airways Boeing 747 Sets The Record For The Quickest Flight Between New York And London,2/15/2020
Factbox: Carmakers look to resume China output after virus forced closures,2/15/2020
"Gold, Gold ETFs Make A Move As Foreign Currencies Weaken",2/15/2020
Mark Zuckerberg: Facebook must accept some state regulation,2/15/2020
This Renewable Energy Stock Has Plenty of Power to Keep Growing its High-Yielding Payout,2/15/2020
Crude Oil Rallies Off $50 Level Amid Declining Fuel Demand,2/15/2020
Huawei is Criticized as 5G Development is in the Spotlight In Munich,2/15/2020
Why Spotify Is Cheaper Than You Think,2/15/2020
Don’t Overlook Healthcare Sector ETFs Even in an Election Year,2/15/2020
Facebook cancels global marketing summit because of COVID-19 concerns,2/15/2020
Is Insulet a Buy?,2/15/2020
Better Buy:  Veeva Systems vs.  Salesforce,2/15/2020
3 Stocks to  Buy and  Hold for the Next 50 Years,2/15/2020
AGFiQ On BTAL’s Function During A Market Correction,2/15/2020
"Coffee ETNs Jump After Steep Sell-Off, Growing Supply Concerns",2/15/2020
3 High-Yield Energy Stocks to Buy Now,2/15/2020
Toyota to resume China output at three plants next week,2/15/2020
3 Ways to Invest in the Space Economy,2/15/2020
3 Reasons to Avoid Travel Stocks in 2020,2/15/2020
"3 Dividend Stocks Perfect for Retirees: DAR, VLO & XOM",2/15/2020
Why Retirees Won't Want to Miss What's Ahead at This 9%-Yielding Dividend Stock,2/15/2020
American Airlines and Alaska Air Join Forces to Take On Delta,2/15/2020
TKK Symphony Acquisition Corporation and Glory Star New Media Group Limited Announce Closing of Business Combination,2/15/2020
Uber's Latest Trick Is Working,2/15/2020
Cisco Raises Its Dividend Despite Declining Revenue: Key Takeaways From Second-Quarter Earnings,2/15/2020
Palladium ETF Continues to Surge on Strong Fundamentals,2/15/2020
Is Walmart's E-Commerce Strategy Failing?,2/15/2020
Why Is Bank OZK (OZK) Down 8.8% Since Last Earnings Report?,2/15/2020
People's United (PBCT) Down 2.2% Since Last Earnings Report: Can It Rebound?,2/15/2020
Why Is PPG Industries (PPG) Down 5.7% Since Last Earnings Report?,2/15/2020
Morgan Stanley (MS) Down 1.1% Since Last Earnings Report: Can It Rebound?,2/15/2020
Why Is CSX (CSX) Up 3.7% Since Last Earnings Report?,2/15/2020
"With Triple-Digit Payments Growth, This Fintech Leader Shows No Signs of Slowing",2/15/2020
Warren Buffett's Berkshire Hathaway Dives Into Biotechnology,2/15/2020
Roku Delivers on Its Billion-Dollar Promise,2/15/2020
Facebook CEO says backs regulation of harmful online content,2/15/2020
"Let's Face It, Marijuana Equity Investments Have Flopped",2/15/2020
Timeline: General Motors streamlines its international operations,2/16/2020
Plains All American Pipeline: Incredibly Cheap With A 9% Yield And Strong Dividends,2/16/2020
Easy Money: How PepsiCo Can Grow Earnings by 15%,2/16/2020
Lesser Known E-Commerce Platform Posts Blowout Quarter,2/16/2020
Valero's High-ROIC Investments Present Opportunity,2/16/2020
GM To Retire Holden Brand In Continuing International Restructuring,2/16/2020
Great Wall says to buy GM's Thailand car plant,2/16/2020
"General Motors to wind down Australia, New Zealand operations, sell Thailand plant",2/16/2020
CN Supportive of the Amendment to the Ministerial Order on Train Speed,2/16/2020
Zogenix: Buying Opportunity,2/16/2020
New York Will Not Appeal Sprint/T-Mobile Decision,2/16/2020
CNH Industrial: Current Weakness Presents An Attractive Entry Point For Longer-Term Investors,2/16/2020
"Cisco Systems: Not Inspiring, But Cheap",2/16/2020
Massive 2020s Gold And Gold Stock Bull Market Is Just Beginning,2/16/2020
To Survive Philip Morris Must Innovate,2/16/2020
Xerox courts HP shareholders as takeover battle heats up,2/16/2020
"Wirecard Nears Inflection Point, Could Break Out Soon",2/16/2020
Veeva: A Compelling Buy In The Niche Healthcare Cloud Sector,2/16/2020
"Key Words: Mark Zuckerberg again calls for Big Tech to be regulated, even if it’s bad for business",2/16/2020
When Will The Boeing 737 Max Return To Service—Production Now Officially Halted,2/16/2020
Cisco Systems: Is It Worth Holding The Stock?,2/16/2020
"PAX Global Technology: High Margin, Strong Growth And Cash Rich - Our Top Pick For 2020",2/16/2020
Australian government granted BHP repeated approval to increase carbon emissions,2/16/2020
Lots of Risks Remain at This 15.5%-Yielding Dividend Stock,2/16/2020
Clock's ticking for Nissan boss Uchida to show he has a plan: sources,2/16/2020
"This is the no. 1 S&P 500 sector to avoid here, market bull Jeff Saut says",2/16/2020
Is Panasonic Stock a Buy?,2/16/2020
3 Reasons NetEase Is Hitting New Highs Ahead of Quarterly Results,2/16/2020
"After McClatchy bankruptcy, reporter Julie K. Brown urges Americans to subscribe to local newspapers",2/16/2020
New York drops fight against T-Mobile-Sprint merger,2/16/2020
'High-Yield Stocks' for the Dividend Investor,2/16/2020
These 3 Numbers Show That This Is a Great Dividend Stock,2/16/2020
Sentiment Speaks: Gold Is Getting Ready For Its Next Break Out,2/16/2020
My Most Highly Anticipated Tech Earnings for February,2/16/2020
British Airways COO and director of people to leave,2/16/2020
New York attorney general says she won't appeal T-Mobile merger ruling,2/16/2020
2 Robotics Stocks to Buy Now,2/16/2020
New York Attorney General will not appeal judge's decision to green light T-Mobile and Sprint merger,2/16/2020
REET: Evaluating This Global Real Estate Play,2/16/2020
"Notable Insider Buys Last Week: Enterprise Products Partners, Kellogg And More",2/16/2020
The Ups and Downs of Roku's Blowout Quarter,2/16/2020
Better Buy: AbbVie vs.  Gilead Sciences,2/16/2020
USO: The Bottom Is Likely In,2/16/2020
Still Holding Lockheed For The Long Term,2/16/2020
"At an All-Time High, Is Amazon Still a Buy?",2/16/2020
This Stock Can Absolutely Thrive at $50 Oil,2/16/2020
Bears vs. Bulls: Who’s Right About Kraft Heinz Stock?,2/16/2020
"Walmart Looks Overvalued, But It's Not",2/16/2020
"U.S. farmer wins $265 million weedkiller award from Bayer, BASF lawsuit",2/16/2020
German court orders Tesla to stop felling trees for Gigafactory,2/16/2020
Apple To Miss Q2 Earnings As Coronavirus Outbreak Hits Both Supply And Demand,2/17/2020
"BHP CEO on First-Half Earnings, Coronavirus, Iron Ore",2/17/2020
Correcting The Record On Why The WWF Changed Its Name To WWE,2/17/2020
Apple warns sales to fall short of target due to coronavirus impact,2/17/2020
"HSBC 2019 profit falls 33%, misses estimates",2/17/2020
"BHP says coronavirus outbreak has had 'muted' impact, warns of uncertainty to outlook",2/17/2020
AT&T’s auction to sell four regional sports channels falls short,2/17/2020
7 High-Yield Stocks I'm Buying For My Retirement Portfolio In This Red-Hot Market,2/17/2020
Faurecia S.E. (FURCF) CEO Patrick Koller on Q4 2019 Results - Earnings Call Transcript,2/17/2020
"Apple Sounds Alarm Bell In China, Won’t Hit Current Quarter Sales Target",2/17/2020
Europe's largest bank will report its earnings today. Here's what to expect,2/17/2020
Sims Ltd ADR (SMSMY) CEO Alistair Field on Q2 2020 Results - Earnings Call Transcript,2/17/2020
Baytex Energy: Maturities Are Slip-Sliding Away,2/17/2020
Bayer Finds New Herbicide Molecule Amid More Lawsuits,2/17/2020
"Nissan CEO sees earnings, cashflow under pressure for current financial year",2/17/2020
Urban Outfitters: Take Some Profit,2/17/2020
Agile Could Reach $10/Share After Twirla Approval,2/17/2020
Apple’s Profit Warning Will Be The First Of Many From U.S. Companies As The Coronavirus Has Decimated China’s Economy,2/17/2020
'Hellish conditions' at Amazon warehouses 'seriously hurt hundreds',2/17/2020
Lilis Energy Announces Extension of Expiration Date for Take Private Offer From Major Shareholder,2/17/2020
"Cathay Pacific Airways Sees ""Crisis"" As Coronavirus Reduces Traffic",2/17/2020
Apple warns coronavirus impact will temporarily limit iPhone supply,2/17/2020
Lyft is offering free rides for 2020 primary and election voters,2/17/2020
Apple unlikely to meet revenue guidance due to coronavirus impact,2/17/2020
BHP Profit Jumps 29% as New CEO Warns Over Virus Impact,2/17/2020
Timeline: Bombardier's journey from Ski-Doo maker to business jet maker,2/17/2020
Apple Cuts Its Revenue Guidance for Fiscal Q2,2/17/2020
Western Asset Mortgage: Still Winning,2/17/2020
Apple Withdraws Its March Quarter Revenue Guidance Due To The Coronavirus,2/17/2020
Apple warns of coronavirus causing iPhone shortages,2/17/2020
FDA Approves 3 Drugs for the Switch From Prescription to Over the Counter,2/17/2020
Arista Networks: Starting To Look Interesting,2/17/2020
Apple Chops Guidance Due To COVID-19!,2/17/2020
MediciNova Receives Notice of Allowance for New Patent Covering MN-001 and MN-002 for the Treatment of Advanced NASH in Japan,2/17/2020
Harvest Health & Recreation Opens its First Dispensary in Arkansas,2/17/2020
Coronavirus Slows iPhone Production; Apple Will Miss Quarterly Sales,2/17/2020
Conagra Cuts Full-Year Guidance Targets on Presidents Day,2/17/2020
"New Oriental Education: Strong Growth, Rising Profitability, And Attractive Valuation",2/17/2020
'Wake up Zuck!' Protesters gather outside of Facebook CEO's San Francisco home,2/17/2020
Apple says will not meet revenue guidance for March quarter due to coronavirus impact,2/17/2020
Apple warns that coronavirus is limiting how many devices it can make and sell in China,2/17/2020
Concerns over safety at Amazon warehouses as number of incidents rise,2/17/2020
"Apple will miss revenue forecast as coronavirus impacts its manufacturing, sales",2/17/2020
"Baozun: Short-Term Pain, Long-Term Gain",2/17/2020
Apple warns it will miss quarterly revenue target due to effects of coronavirus,2/17/2020
VFH: Financials Will Continue To Move Along With The Market,2/17/2020
Hecla Mining: Strong Under $3,2/17/2020
Apple warns it may miss revenue guidance due to coronavirus,2/17/2020
Apple says will not meet revenue guidance for March quarter due to coronavirus outbreak,2/17/2020
DCP Midstream Names Corey Walker President of Operations,2/17/2020
Boeing Finds Yet Another Problem In The Grounded 737 Max Aircraft,2/18/2020
Atrion Corp.: Mini Share Price Uptick Indicative Of Further Gains,2/18/2020
What Walmart’s Fourth-Quarter Earnings Mean For Online Grocery Services,2/18/2020
Sciplay Corp (SCPL) CEO Joshua Wilson on Q4 2019 Results - Earnings Call Transcript,2/18/2020
Uber closing office in downtown Los Angeles,2/18/2020
Xperi Corp (XPER) CEO Jon Kirchner on Q4 2019 Results - Earnings Call Transcript,2/18/2020
"10x Genomics, Inc. (TXG) CEO Serge Saxonov on Q4 2019 Results - Earnings Call Transcript",2/18/2020
"Burning Issues: Franklin Buys Legg Mason, SoftBank's Missteps & Real Estate Redemptions",2/18/2020
Scientific Games' (SGMS) CEO Barry Cottle on Q4 2019 Results - Earnings Call Transcript,2/18/2020
"Shotspotter, Inc. (SSTI) CEO Ralph Clark on Q4 2019 Results - Earnings Call Transcript",2/18/2020
Uber says it is closing office in downtown Los Angeles,2/18/2020
LendingClub Corporation (LC) CEO Scott Sanborn on Q4 2019 - Earnings Call Transcript,2/18/2020
"Agilent Technologies, Inc. (A) CEO Mike McMullen on Q1 2020 Results - Earnings Call Transcript",2/18/2020
"AtriCure, Inc. (ATRC) CEO Mike Carrel on Q4 2019 Results - Earnings Call Transcript",2/18/2020
Continental Materials Corporation's Board of Directors to Review Unsolicited Tender Offer from Bee Street Holdings LLC,2/18/2020
Phathom Pharmaceuticals: A Clinical-Stage Company With A De-Risked Pipeline For 2020,2/18/2020
"The Hackett Group, Inc. (HCKT) CEO Ted Fernandez on Q4 2019 Results - Earnings Call Transcript",2/18/2020
Herbalife Nutrition Ltd. (HLF) CEO Michael Johnson on Q4 2019 Results - Earnings Call Transcript,2/18/2020
"Hormel joins Tyson Foods, JBS in removing drug banned by China from hog supply",2/18/2020
Bombardier As The Only Pure-Play Business Jet Maker; How Things Could Play Out,2/18/2020
Why Gap Inc. Stock Slipped Today,2/18/2020
"Knoll, Inc. (KNL) CEO Andrew Cogan on Q4 2019 Results - Earnings Call Transcript",2/18/2020
"Well, Bill Gates is never going to buy a Tesla now",2/18/2020
TiVo Corporation (TIVO) CEO Dave Shull on Q4 2019 Results - Earnings Call Transcript,2/18/2020
"Herbalife Reports Q4 Earnings, and Shares Surge in After-Hours Trading",2/18/2020
Davide Campari-Milano's (DVDCF) CEO Bob Kunze-Concewitz on Q4 2019 Results - Earnings Call Transcript,2/18/2020
Google Announces First Additions to Stadia Gaming Service Since Its Launch,2/18/2020
"Why These Gold Stocks Surged Today, and What Every Investor Needs to Know",2/18/2020
TRI Pointe Group's (TPH) CEO Doug Bauer on Q4 2019 Results - Earnings Call Transcript,2/18/2020
HealthEquity's (HQY) CEO Jon Kessler on Year-End Sales Metrics Conference Call Transcript,2/18/2020
"Some companies are benefiting from the coronavirus outbreak, Jim Cramer says",2/18/2020
"Alphabet Shutters Its Energy Kite Company, Makani",2/18/2020
CEO says he wants LivePerson to be a 'trillion-dollar company' in conversational commerce,2/18/2020
Vulcan Materials Company (VMC) CEO Tom Hill on Q4 2019 Results - Earnings Call Transcript,2/18/2020
CARZ ETF Gains on Tesla's Rally Despite Mixed Auto Earnings,2/18/2020
Retail stocks: 3 trades,2/18/2020
Apple's Coronavirus Warning to Wall Street,2/18/2020
Bed Bath & Beyond CEO Moving Fast And Furiously With $1 Billion Plan,2/18/2020
Qingke Files Annual Report on Form 20-F for Fiscal Year 2019,2/18/2020
Boeing finds debris in 737 MAX jetliners: company memo,2/18/2020
Tesla Stock (TSLA) Rallies As Analysts Raise Price Targets and Cycles Point Higher,2/18/2020
ConocoPhillips: Looking Strong Heading Into 2020,2/18/2020
"Apple's Problem Is Supply Chain Disruption, Says Cowen Analyst",2/18/2020
Starbucks and McDonald's Collaborate on Reusable Cup Pilot Program,2/18/2020
Sustainable Strategies to Add to Portfolios in 2020,2/18/2020
Silver Has Big Day: What’s Next For Precious Metals?,2/18/2020
"Palo Alto Networks Analyst Bullish Ahead Of Q1 Report, Says 'Secular Story Remains Well Intact'",2/18/2020
"Tesla to $1,200? Morgan Stanley lays out the bull case",2/18/2020
Macy's Debt Cut to Junk Amid Soft Sales Performance,2/18/2020
Coronavirus and the Apple impact,2/18/2020
"Zillow, Inc. (Z) CEO Rich Barton on Q4 2019 Results - Earnings Call Transcript",2/19/2020
"Kirkland Lake Gold Announces Value Enhancement Program, Increases 2020 Production Guidance and Grows Mineral Reserves",2/19/2020
Washington state moves to drop Boeing tax break to head off possible EU tariffs,2/19/2020
Target: Pre-Earnings Buy Signals,2/19/2020
"Tivity Health, Inc. (TVTY) on Q4 2019 Results - Earnings Call Transcript",2/19/2020
"OraSure Technologies, Inc. (OSUR) CEO Stephen Tang on Q4 2019 Results - Earnings Call Transcript",2/19/2020
"Inovalon Holdings, Inc. (INOV) CEO Keith Dunleavy on Q4 2019 Results - Earnings Call Transcript",2/19/2020
"Warrior Met Coal, Inc. (HCC) CEO Walter Scheller on Q4 2019 Results - Earnings Call Transcript",2/19/2020
Stamps.com Inc. (STMP) CEO Ken McBride on Q4 2019 Results - Earnings Call Transcript,2/19/2020
Invitae Corporation (NVTA) CEO Sean George on Q4 2019 Results - Earnings Call Transcript,2/19/2020
Masimo Corp (MASI) CEO Joseph Kiani on Q4 2019 Results - Earnings Call Transcript,2/19/2020
"Qantas shares spike, despite warning of a $100 million hit from the virus",2/19/2020
"The Boston Beer Company, Inc. (SAM) CEO Dave Burwick on Q4 2019 Results - Earnings Call Transcript",2/19/2020
Qantas Cuts Asia Capacity on Coronavirus Outbreak: CEO,2/19/2020
Energy Transfer LP (ET) Management on Q4 2019 Results - Earnings Call Transcript,2/19/2020
"Endologix, Inc. (ELGX) CEO John Onopchenko on Q4 2019 Results - Earnings Call Transcript",2/19/2020
Ribbon Communications Inc. (RBBN) CEO Kevin Riley on Q4 2019 Results - Earnings Call Transcript,2/19/2020
Google plans to move UK users' accounts outside EU jurisdiction,2/19/2020
"Synopsys, Inc. (SNPS) CEO Aart de Geus on Q1 2020 Results - Earnings Call Transcript",2/19/2020
"Facebook owes $9B in taxes related to Ireland deal, IRS says",2/19/2020
"The Cheesecake Factory, Inc. (CAKE) CEO David Overton on Q4 2019 Results - Earnings Call Transcript",2/19/2020
"Brightcove, Inc. (BCOV) CEO Jeff Ray on Q4 2019 Results - Earnings Call Transcript",2/19/2020
Axovant Gene Therapies Announces Pricing of $65 Million Public Offering,2/19/2020
"HealthStream, Inc. (HSTM) CEO Robert A. Frist, Jr. on Q4 2019 Results - Earnings Call Transcript",2/19/2020
Boeing backs Washington state’s plan to drop tax breaks amid trade dispute with Europe,2/19/2020
DISH Network Corporation (DISH) CEO Erik Carlson Q4 2019 Results - Earnings Call Transcript,2/19/2020
"SolarEdge Technologies, Inc. (SEDG) CEO Zvi Lando on Q4 2019 Results - Earnings Call Transcript",2/19/2020
CyberOptics Corporation (CYBE) CEO Subodh Kulkarni on Q4 2019 Results - Earnings Call Transcript,2/19/2020
Smile Direct Club Stands Behind Its Doctors,2/19/2020
Sleep Number Corporation (SNBR) CEO Shelly Ibach on Q4 2019 Results - Earnings Call Transcript,2/19/2020
Five9's (FIVN) CEO Rowan Trollope on Q4 2019 Results - Earnings Call Transcript,2/19/2020
Anterix Inc. (ATEX) CEO Morgan O'Brien on Q3 2020 Results - Earnings Call Transcript,2/19/2020
"Holly Energy Partners, L.P. (HEP) Q4 2019 Results - Earnings Call Transcript",2/19/2020
IMAX's (IMAX) CEO Rich Gelfond on Q4 2019 Results - Earnings Call Transcript,2/19/2020
MGM Resorts Says Data Breach Exposed Some Guests’ Personal Information,2/19/2020
SP Plus Corporation (SP) CEO Marc Baumann on Q4 2019 Results - Earnings Call Transcript,2/19/2020
All-Star Active ETF Manager Cathie Wood: Bull Market Could Last Years,2/19/2020
Tesla Bull Wood Faces Off Against Tesla Bear,2/19/2020
"YayYo, Inc. Common Stock to be Quoted on the OTC Pink Market Beginning February 20, 2020",2/19/2020
"Reata Pharmaceuticals, Inc. (RETA) CEO Warren Huff on Q4 2019 Results - Earnings Call Transcript",2/19/2020
Valmont Industries (VMI) Misses Q4 Earnings and Revenue Estimates,2/19/2020
Archrock Inc. (AROC) Tops Q4 Earnings Estimates,2/19/2020
"nLIGHT, Inc. (LASR) CEO Scott Keeney on Q4 2019 Results - Earnings Call Transcript",2/19/2020
Curaleaf's Grassroots Enters Real Estate Deal Worth Nearly $20 Million,2/19/2020
Fantastic Buying Opportunity For BDSI,2/19/2020
Star Bulk Carriers (SBLK) Q4 Earnings Top Estimates,2/19/2020
Palomar Holdings Inc (PLMR) CEO Mac Armstrong on Q4 2019 Results - Earnings Call Transcript,2/19/2020
MSA Safety (MSA) Lags Q4 Earnings and Revenue Estimates,2/19/2020
Green Dot Corporation (GDOT) CEO Bill Jacobs on Q4 2019 Results - Earnings Call Transcript,2/19/2020
Tesla’s Record Run Clears the Air for ‘SMOG’ ETF,2/19/2020
Cardtronics plc (CATM) CEO Edward West on Q4 2019 Results - Earnings Call Transcript,2/20/2020
"Aerie Pharmaceuticals, Inc. (AERI) CEO Vicente Anido on Q4 2019 Results - Earnings Call Transcript",2/20/2020
"eHealth, Inc. (EHTH) CEO Scott Flanders on Q4 2019 Results - Earnings Call Transcript",2/20/2020
SPY: Why Stocks Are Headed Higher From Here,2/20/2020
"Sprouts Farmers Market, Inc. (SFM) CEO Jack Sinclair on Q4 2019 Results - Earnings Call Transcript",2/20/2020
Tennant Company (TNC) CEO Chris Killingstad on Q4 2019 Results - Earnings Call Transcript,2/20/2020
"Fastly, Inc.'s (FSLY) CEO Joshua Bixby on Q4 2019 Results - Earnings Call Transcript",2/20/2020
"BJ's Restaurants, Inc. (BJRI) CEO Greg Trojan on Q4 2019 Results - Earnings Call Transcript",2/20/2020
Full Assessment Of Prospect Capital's Fiscal Q2 2020 (Includes Updated Positive And Negative Catalysts/Factors),2/20/2020
Devon Energy: A Quality Firm At A Reasonable Price,2/20/2020
Americold Realty Trust (COLD) CEO Fred Boehler on Q4 2019 Results - Earnings Call Transcript,2/20/2020
"At Tock, this restaurant group owner and former trader is building a Spotify for reservations",2/20/2020
"At his company, Tock, this restaurant group owner and former trader is building a Spotify for reservations",2/20/2020
"National CineMedia, Inc. (NCMI) CEO Tom Lesinski on Q4 2019 Results - Earnings Call Transcript",2/20/2020
ATN International's (ATNI) CEO Michael Prior on Q4 2019 Results - Earnings Call Transcript,2/20/2020
"Floor & Decor Holdings, Inc. (FND) CEO Thomas Taylor on Q4 2019 Results - Earnings Call Transcript",2/20/2020
"Globus Medical, Inc. (GMED) CEO David Demski on Q4 2019 Results - Earnings Call Transcript",2/20/2020
Appian Corporation (APPN) CEO Matt Calkins on Q4 2019 Results - Earnings Call Transcript,2/20/2020
Livent Corporation (LTHM) CEO Paul Graves on Q4 2019 Results - Earnings Call Transcript,2/20/2020
Smith & Nephew plc (SNN) CEO Roland Diggelmann on Q4 2019 Results - Earnings Call Transcript,2/20/2020
"Zscaler, Inc. (ZS) CEO Jay Chaudhry on Q2 2020 Results - Earnings Call Transcript",2/20/2020
2 Stocks That Trounced the Market on Thursday (Feb 20),2/20/2020
Workiva (WK) CEO Marty Vanderploeg on Q4 2019 Results - Earnings Call Transcript,2/20/2020
VICI Properties Inc. (VICI) CEO Edward Pitoniak on Q4 2019 Results - Earnings Call Transcript,2/20/2020
Globant's (GLOB) CEO Martin Migoya on Q4 2019 Results - Earnings Call Transcript,2/20/2020
Boyd Gaming Corporation (BYD) CEO Keith Smith on Q4 2019 - Earnings Call Transcript,2/20/2020
"Dropbox, Inc.'s (DBX) CEO Drew Houston on Q4 2019 Results - Earnings Call Transcript",2/20/2020
"Bandwidth, Inc. (BAND) CEO David Morken on Q4 2019 Results - Earnings Call Transcript",2/20/2020
"Synthetic Biologics, Inc. (SYN) CEO Steven Shallcross on Q4 2019 Results - Earnings Call Transcript",2/20/2020
Ducommun's (DCO) CEO Steve Oswald on Q4 2019 Results - Earnings Call Transcript,2/20/2020
"Casa Systems, Inc. (CASA) CEO Jerry Guo on Q4 2019 Results - Earnings Call Transcript",2/20/2020
"Zovio, Inc. (ZVO) CEO Andrew Clark on Q4 2019 - Earnings Call Transcript",2/20/2020
"Hannon Armstrong Sustainable Infrastructure Capital, Inc. (HASI) CEO Jeff Eckel on Q4 2019 Results - Earnings Call Transcript",2/20/2020
Conduent Inc (CNDT) CEO Clifford Skelton on Q4 2019 Results - Earnings Call Transcript,2/20/2020
SBA Communications Corporation (SBAC) CEO Jeffrey Stoops on Q4 2019 Results - Earnings Call Transcript,2/20/2020
Focus Financial Partners' (FOCS) CEO Rudy Adolf on Q4 2019 Results - Earnings Call Transcript,2/20/2020
Galaxy Resources Limited (GALXF) CEO Simon Hay on Q4 2019 Results - Earnings Call Transcript,2/20/2020
Emergent BioSolutions Inc. (EBS) CEO Bob Kramer on Q4 2019 Results - Earnings Call Transcript,2/20/2020
Teck Announces   Dividend,2/20/2020
Cerus Corporation (CERS) CEO Obi Greenman on Q4 2019 Results - Earnings Call Transcript,2/20/2020
Lloyds Banking Group plc (LYG) Q4 2019 Results - Earnings Call Transcript,2/20/2020
American Software's (AMSWA) Management on Q3 2020 - Earnings Call Transcript,2/20/2020
"Telus says 5,000 jobs at risk if forced to open network to wireless resellers-report",2/20/2020
"Universal Electronics, Inc. (UEIC) CEO Paul Arling on Q4 2019 Results - Earnings Call Transcript",2/20/2020
State Auto Financial Corp (STFC) CEO Michael LaRocco on Q4 2019 Results - Earnings Call Transcript,2/20/2020
RPT Realty (RPT) CEO Brian Harper on Q4 2019 Results - Earnings Call Transcript,2/20/2020
Century Aluminum Company (CENX) CEO Mike Bless on Q4 2019 Results - Earnings Call Transcript,2/20/2020
