Motorola president: We see foldable Razr as a new franchise,11/13/2019
Motorola's foldable Razr: Flipping the classic phone icon into the future,11/13/2019
Warren lashes out at Goldman over Apple Card bias claims: Bloomberg,11/13/2019
Southwest pilots union says Boeing may be trying to hasten 737 MAX return,11/13/2019
Perspecta Inc. (PRSP) CEO Mac Curtis on Q2 2020 Results - Earnings Call Transcript,11/13/2019
"Matinas BioPharma Holdings, Inc. (MTNB) CEO Jerry Jabbour on Q3 2019 Results - Earnings Call Transcript",11/13/2019
SunPower's Profitability Heats Up With Its Next Generation Series A Modules,11/13/2019
"SRAX, Inc. (SRAX) CEO Chris Miglino on Q3 2019 Results - Earnings Call Transcript",11/13/2019
Griffon Corporation's (GFF) CEO Ron Kramer on Q4 2019 Results - Earnings Call Transcript,11/13/2019
"AudioEye, Inc. (AEYE) Q3 2019 Results - Earnings Call Transcript",11/13/2019
Enphase Energy: The Rise Of 'Safe AC',11/13/2019
DBO: Downside Risks Are Still At Play,11/13/2019
Federal Court of Australia Approves Sundance’s Re-Domiciliation and Lodgement of Court Orders With ASIC,11/13/2019
Enservco Corporation (ENSV) CEO Ian Dickinson on Q3 2019 Results - Earnings Call Transcript,11/13/2019
Wizz Air Holdings Plc (WZZAF) CEO József Váradi on Q2 2020 Results - Earnings Call Transcript,11/13/2019
Kamada Ltd. (KMDA) CEO Amir London on Q3 2019 Results - Earnings Call Transcript,11/13/2019
"Reed's, Inc. (REED) Q3 2019 Results - Earnings Call Transcript",11/13/2019
"Biocept, Inc. (BIOC) CEO Michael Nall on Q3 2019 Results - Earnings Call Transcript",11/13/2019
CorePoint Lodging Inc. (CPLG) CEO Keith Cline on Q3 2019 Results - Earnings Call Transcript,11/13/2019
Jack Ma: Alibaba's Singles Day sales missed expectations because it was 'hot' and fell on a Monday,11/13/2019
"Eyenovia, Inc. (EYEN) CEO Sean Ianchulev on Q3 2019 Results - Earnings Call Transcript",11/13/2019
Supreme Court debates merits of black media mogul's discrimination suit against Comcast,11/13/2019
"Cisco Systems, Inc. (CSCO) CEO Chuck Robbins on Q1 2020 Results - Earnings Call Transcript",11/13/2019
Disney+ Content Warnings On Sensitive Depictions In Films Causes A Stir Among Subscribers,11/13/2019
"Interpace Diagnostics Group, Inc. (IDXG) CEO Jack Stover on Q3 2019 Results - Earnings Call Transcript",11/13/2019
The Wall Street Journal: Shares of Yahoo Japan’s parent soar on acquisition talks with Line,11/13/2019
"Xcel Brands, Inc. (XELB) CEO Robert D'Loren on Q3 2019 Results - Earnings Call Transcript",11/13/2019
electroCore's (ECOR) CEO Dan Goldberger on Q3 2019 Results - Earnings Call Transcript,11/13/2019
"Cresud Sociedad Anónima Comercial, Inmobiliaria, Financiera y Agropecuaria (CRESY) CEO Alejandro Elsztain on Q1 2020 Results - Earnings Call Transcript",11/13/2019
These 2 Stocks Wilted on Wednesday,11/13/2019
Points International Ltd (PCOM) CEO Robert MacLean on Q3 2019 Results - Earnings Call Transcript,11/13/2019
RAVE Restaurant Group's (RAVE) CEO Brandon Solano on Q1 2020 Results - Earnings Call Transcript,11/13/2019
Tesla to Start Mass Production in China as Musk Sets Up Shop in Berlin,11/13/2019
"Beazer Homes USA, Inc. (BZH) CEO Allan Merrill on Q4 2019 Results - Earnings Call Transcript",11/13/2019
SoftBank's Yahoo Japan confirms merger talks with messaging app Line; stock skyrockets 16%,11/13/2019
Ideal Power Inc. (IPWR) CEO Lon Bell on Q3 2019 Results - Earnings Call Transcript,11/13/2019
Personalis: A Speculative Position Seems Warranted Here,11/14/2019
Uber co-founder Travis Kalanick has dumped more than $700 million in stock since last week,11/14/2019
"Twin River Worldwide Holdings, Inc. (TRWH) CEO George Papanier on Q3 2019 Results - Earnings Call Transcript",11/14/2019
Farfetch Limited (FTCH) CEO Jose Neves on Q3 2019 Results - Earnings Call Transcript,11/14/2019
"Personalis, Inc. (PSNL) CEO John West on Q3 2019 Results - Earnings Call Transcript",11/14/2019
Globant S.A. (GLOB) CEO Martin Migoya on Q3 2019 Results - Earnings Call Transcript,11/14/2019
"Y-mAbs Therapeutics, Inc. (YMAB) CEO Claus Moller on Q3 2019 Results - Earnings Call Transcript",11/14/2019
OncoCyte Corporation (OCX) CEO Ronald Andrews on Q3 2019 Results - Earnings Call Transcript,11/14/2019
"Second Sight Medical Products, Inc's (EYES) CEO Will McGuire on Q3 2019 Results - Earnings Call Transcript",11/14/2019
"SORL Auto Parts, Inc. (SORL) Management on Q3 2019 Results - Earnings Call Transcript",11/14/2019
"Dolby Laboratories, Inc. (DLB) CEO Kevin Yeaman on Q4 2019 Results - Earnings Call Transcript",11/14/2019
"Aurinia Pharmaceuticals, Inc.'s (AUPH) CEO Peter Greenleaf on Q3 2019 Results - Earnings Call Transcript",11/14/2019
Eastside Distilling's (EAST) CEO Lawrence Firestone on Q3 2019 Results - Earnings Call Transcript,11/14/2019
Teekay LNG Partners L.P. (TGP) CEO Mark Kremin on Q3 2019 Earnings & Investor Day Conference (Transcript),11/14/2019
Largo Resources Ltd. (LGORF) CEO Paulo Misk on Q3 2019 Results - Earnings Call Transcript,11/14/2019
Quest Resource Holding Corporation's (QRHC) CEO Ray Hatch on Q3 2019 Results - Earnings Call Transcript,11/14/2019
Google’s invasion into health records more proof that Silicon Valley rules the world,11/14/2019
"Titan Pharmaceuticals, Inc. (TTNP) CEO Sunil Bhonsle on Q3 2019 Results - Earnings Call Transcript",11/14/2019
NextCure Announces Pricing of Public Offering of Common Stock,11/14/2019
"aTyr Pharma, Inc. (LIFE) CEO Sanjay Shukla on Q3 2019 Results - Earnings Call Transcript",11/14/2019
Zosano Pharma Corp (ZSAN) CEO Steven Lo on Q3 2019 Results - Earnings Call Transcript,11/14/2019
Shockwave Announces - Pricing of Public Offering of Common Stock,11/14/2019
"Aytu BioScience, Inc. (AYTU) CEO Joshua Disbrow on Q1 2020 Results - Earnings Call Transcript",11/14/2019
"Chicken Soup for the Soul Entertainment, Inc. (CSSE) CEO William Rouhana on Q3 2019 Results - Earnings Call Transcript",11/14/2019
"City Council eyeing big blow to Grubhub, Doordash and others",11/14/2019
Applied Materials Inc (AMAT) CEO Gary Dickerson on Q4 2019 Results - Earnings Call Transcript,11/14/2019
"Kulicke and Soffa Industries, Inc. (KLIC) CEO Fusen Chen on Q4 2019 Results - Earnings Call Transcript",11/14/2019
"Natural Grocers By Vitamin Cottage, Inc. (NGVC) Management on Q4 2019 Results - Earnings Call Transcript",11/14/2019
Dexcom: Prepare To Be Greedy When Fear Strikes Back,11/14/2019
Tricida's (TCDA) CEO Gerrit Klaerner on Q3 2019 Results - Earnings Call Transcript,11/14/2019
Why Care.Com Stock Can Keep Rebounding,11/14/2019
Amazon appeals $10B Pentagon contract won by Microsoft,11/14/2019
Hudson Technologies Inc. (HDSN) CEO Ken Zugibe on Q3 2019 Results - Earnings Call Transcript,11/14/2019
NVIDIA Corp (NVDA) CEO Jensen Huang on Q3 2020 Results - Earnings Call Transcript,11/14/2019
"IZEA Worldwide, Inc. (IZEA) CEO Ted Murphy on Q3 2019 Results - Earnings Call Transcript",11/14/2019
Altimmune's (ALT) CEO Vipin Garg on Q3 2019 Results - Earnings Call Transcript,11/14/2019
Garrison Capital Inc. (GARS) CEO Joseph Tansey on Q3 2019 Results - Earnings Call Transcript,11/14/2019
"Eton Pharmaceuticals, Inc. (ETON) CEO Sean Brynjelsen on Q3 2019 Results - Earnings Call Transcript",11/14/2019
2 Tech Stocks That Got Crushed on Thursday,11/14/2019
"KemPharm, Inc. (KMPH) CEO Travis Mickle on Q3 2019 Results - Earnings Call Transcript",11/14/2019
"Plus Therapeutics, Inc. (PSTV) CEO Dr.",11/14/2019
"Boeing received 'unnecessary' contract boost for astronaut capsule, watchdog says",11/14/2019
"Super Micro Computer, Inc. (SMCI) CEO Charles Liang on Q1 2020 Results - Earnings Call Transcript",11/14/2019
"CorMedix, Inc. (CRMD) CEO Khoso Baluch on Q3 2019 Results - Earnings Call Transcript",11/14/2019
Canopy Growth Stock Tanks on Huge Q2 Misses,11/14/2019
VTI: Some Signs The Market Could Trend Lower,11/14/2019
Not Moooved By Merger: Dean Bondholders Just Say No to Deal With Dairy Co-op,11/14/2019
"XpresSpa Group, Inc. (XSPA) CEO Doug Satzman on Q3 2019 Results - Earnings Call Transcript",11/14/2019
Aemetis' (AMTX) CEO Eric McAfee on Q3 2019 Results - Earnings Call Transcript,11/14/2019
Alibaba prices Hong Kong listing and looks to raise up to $13.8 billion,11/14/2019
Cash Out Time At Hess Midstream,11/15/2019
"New Google Pixel reacts to gestures, but charge still short",11/15/2019
Shari Redstone vows fresh era at ViacomCBS despite CEO pay,11/15/2019
"Artificial intelligence has become a driving force in everyday life, says LivePerson CEO",11/15/2019
Next up: Fiat Chrysler labor talks that could prove difficult,11/15/2019
Bond ETFs for Those Concerned About a Resurgence in Inflation,11/15/2019
Why These 2 Stocks Flopped on Friday,11/15/2019
"EWH: Buy Hong Kong, Just Not Through iShares",11/15/2019
How To Earn 20% + Annualized From B. Riley Financial Bond In 7 Months,11/15/2019
Amazon: Finally At A Reasonable Price,11/15/2019
Acting Covetrus CEO: We're headed in the right direction after shaky merger,11/15/2019
Wix: A Platform For Innovation,11/15/2019
"Jim Cramer's week ahead: Home Depot, Target and Macy's earnings — plus US-China trade developments",11/15/2019
Detour Gold Corporation (DRGDF) CEO Mick McMullen on Q3 2019 Results - Earnings Call Transcript,11/15/2019
3 Retail Stocks to Consider as Markets Finish the Week at Record Levels,11/15/2019
S&P 500 Growth ETF (SPYG) Hits New 52-Week High,11/15/2019
The Tile Shop opens new store in Lee’s Summit,11/15/2019
Datadog: Priced For Near Perfection,11/15/2019
Buy Intuit (INTU) Stock Heading into Earnings?,11/15/2019
Celsion Corporation (CLSN) CEO Michael Tardugno on Q3 2019 Results - Earnings Call Transcript,11/15/2019
"Disney+ Is a 'Home Run,' Wedbush's Ives Says",11/15/2019
Why Wedbush's Ives Sees Apple Shares Hitting $325,11/15/2019
Record high in the Dow: 8 trades,11/15/2019
‘The Office’ And ‘Parks And Recreation’ Extend Cable Runs On Viacom Networks,11/15/2019
"Final Trade: FDX, AAPL, SHAK & BX",11/15/2019
Traders pick their ultimate stay-at-home stocks,11/15/2019
Guy Adami breaks down the chart of the week,11/15/2019
Hong Kong ETF May Not Be Turning Around Anytime Soon,11/15/2019
What's next for GrubHub after Barclays' double upgrade,11/15/2019
Stitch Fix (SFIX) Stock Sinks As Market Gains: What You Should Know,11/15/2019
FTC makes Celgene's Otezla divestiture official condition for Bristol-Myers acquisition,11/15/2019
Hulu is raising the price of its live TV service for the second time this year,11/15/2019
Health stocks post best day in 10 months as Trump announces transparency rules,11/15/2019
"CHF Solutions, Inc. (CHFS) Reports Inducement Grants Under NASDAQ Listing Rule 5635(c)(4)",11/15/2019
Apellis Pharmaceuticals Announces Inducement Grants Under Nasdaq Listing Rule 5635(c)(4).,11/15/2019
Bristol-Celgene Merger Leaps FTC Clearance; Deal Set To Close Wednesday,11/15/2019
Summit to Participate in the D.A. Davidson Mid-Atlantic Bank Tour,11/15/2019
Amazon rolls out 'Amazon Pharmacy' branding to PillPack,11/15/2019
Why LogMeIn Stock Jumped Friday,11/15/2019
Stability Persists in Municipal Allocation Model,11/15/2019
Are These Marijuana Stocks A Good Buy Now? Look Past The Hype,11/15/2019
"U.S. marijuana retailer MedMen to slash staff, sell off assets",11/15/2019
The Green Organic Dutchman Holdings Ltd. (TGODF) CEO Brian Athaide on Q3 2019 Results - Earnings Call Transcript,11/15/2019
Medtech Stock With 28% Gain This Week Confirms It's Fielding Buyout Bids,11/15/2019
"Warren Buffett's Berkshire Hathaway 13F trims Wells Fargo, adds RH",11/15/2019
Macy's Q3 Earnings Preview: Is the Department Store's Decline Set to Continue?,11/15/2019
"JEDI Mind Tricks: Esper Says Cloud Computing Contract Fair As Politics Cloud Efforts To Evaluate Amazon, Microsoft",11/15/2019
Farfetch Earnings: FTCH Stock Rockets 29% on Q3 Results,11/15/2019
Bristol-Myers Squibb wins antitrust approval to buy Celgene on condition it sell psoriasis drug,11/15/2019
"YY Inc. to Hold 2019 Annual General Meeting on December 20, 2019",11/15/2019
"Nissan recalls nearly 400,00 vehicles over braking system defect",11/16/2019
CORRECTION: BridgeBio and Eidos Present Data from Phase 2 Open Label Extension Suggesting Long-term Tolerability of AG10 and Stabilization of Transthyretin Amyloid Cardiomyopathy Disease Measures,11/16/2019
3 Dividend Stocks - That Pay You More Than Pepsi Does.,11/16/2019
Starbucks’ China Rival Luckin Coffee Mints A Second Billionaire,11/16/2019
Top Insider Buys Highlight for the Week of Nov. 15,11/16/2019
A Diverse Slate of Games Drove Take-Two Interactive's Second-Quarter Results,11/16/2019
Incredibly Attractive Dividend Yield From Magellan Midstream Partners,11/16/2019
Alibaba's Singles' Day was the biggest shopping day of all time,11/16/2019
XLE Weekly: Minor Price Discovery Lower To 59.34s Where Buying Interest Halted The Pullback,11/16/2019
Roku Is the Better Disney+ Stock Than Disney,11/16/2019
Caladrius Biosciences Reports Positive Results for CLBS16 from the ESCaPE-CMD Trial at American Heart Association Scientific Sessions 2019,11/16/2019
Nordstrom Doubles Down On The Rental Economy By Extending Its Partnership With Rent The Runway,11/16/2019
Cisco CEO says it’s time to regulate the tech industry and that capitalism is currently ‘broken’,11/16/2019
This Warren Buffett-Held Company Thinks Its Shares Are Cheap,11/16/2019
Why Square's Stock Is a Bargain Today,11/16/2019
Warren Buffett's Berkshire Hathaway Trims Apple Position in Q3,11/16/2019
Here's Why Consumer Staples ETFs Are Rising This Year,11/16/2019
China ETFs in Focus as Investment Growth Hits 20-Year Low,11/16/2019
These 3 Top Waste Companies Turned in Solid Q3 2019 Results,11/16/2019
Boeing and SpaceX face 'significant' challenges in delayed NASA program,11/16/2019
Why You Should Avoid the Old Navy Spinoff,11/16/2019
"Electric Hummers, Sierras and Escalades May Be Built In Hamtramck",11/16/2019
Why Disney+ Is on Fire TV After All,11/16/2019
Why Chuy's Is Fighting to Control Food Delivery Data,11/16/2019
What You Need to Know About SunPower's Breakup,11/16/2019
Better Buy: Microsoft vs. HP,11/16/2019
3 Stocks - to Hold for the Next 20 Years,11/16/2019
This High-Yield Stock Is Closing In on Dividend Royalty,11/16/2019
"Despite Buyout Bid, Craft Brew Alliance's Q3 Results Still Matter",11/16/2019
"Tech Stock News: Apple Price Targets, NVDIA Earnings, and More",11/16/2019
Garmin: Strong Cash Flows But Approaching Fair Value,11/16/2019
Will Coca-Cola Raise Its Dividend in 2020?,11/16/2019
Does Indian Motorcycle Have a Harley-Davidson Problem?,11/16/2019
UPS is teaming up with CVS to introduce drone deliveries,11/16/2019
CN and Tree Canada collaborate to support City of North Vancouver's tree canopy,11/16/2019
The CDC Identifies the Likely Culprit of Vape-Related Lung Illnesses,11/16/2019
Is Frontier Communications a Buy?,11/16/2019
How Wynn Resorts Could Unlock Billions of Dollars,11/16/2019
What We Know About Tesla's Pickup Truck,11/16/2019
"Anheuser-Busch invests $100 million in hard seltzer, the new drink craze",11/16/2019
NRG Benefiting From High Texas Power Prices,11/16/2019
Can Nordstrom's New NYC Store Fill the Vacuum Left by Barneys' Bankruptcy?,11/16/2019
3 Chinese Tech Stocks That Are Beating the Market in 2019,11/16/2019
Roku’s Success Is Cable TV’s Failure,11/16/2019
"Facebook, Amazon And Cisco Fail To Join The “New Highs” NASDAQ Rally",11/16/2019
Google could be your wealth manager one day if lawmakers sign off,11/16/2019
Apple Will Soon Be the Leader in 5G Phones,11/16/2019
Why Is Union Pacific (UNP) Up 7.7% Since Last Earnings Report?,11/16/2019
Why Is Watsco (WSO) Up 2.7% Since Last Earnings Report?,11/16/2019
Signature Bank (SBNY) Up 2.5% Since Last Earnings Report: Can It Continue?,11/16/2019
Ford takes aim at Tesla with electric Mustang SUV,11/17/2019
NextEra Energy Explained,11/17/2019
"XLK Weekly: Price Discovery Higher To New All-Time Highs, 87.24s",11/17/2019
XLF Weekly: Pullback Continued To 29.45s Where Buying Interest Halted The Corrective Phase From All-Time Highs,11/17/2019
3 Medtech Earnings Winners,11/17/2019
Why Is Google About to Launch Checking Accounts for Online Users?,11/17/2019
"Ford unveils the Mustang Mach-E, an all-electric crossover with muscle car roots",11/17/2019
Ford bets on an electric Mustang to charge its turnaround,11/17/2019
"Ford unveils Mustang Mach-E starting at roughly $44,000",11/17/2019
Ford is betting its future on an electric Mustang SUV,11/17/2019
Ford Wants to Sell You an Electric S.U.V. It’s Called a Mustang.,11/17/2019
How Ford’s Electric Mach E Could Succeed Where Rivals Have Failed,11/17/2019
Avalara: 2020 Commentary Gives Support To Premium Valuation,11/17/2019
Disney+: It Gets Harder From Here,11/17/2019
Are Investors Too Bearish on SINA and Weibo?,11/17/2019
The Wall Street Journal: Yahoo Japan and chat app Line agree to 50-50 merger,11/17/2019
Venture Capital and Innovative Banking,11/17/2019
New York Community Bancorp: A Buyable Dip,11/17/2019
NIO Inc. Appoints New Chief Financial Officer,11/17/2019
Cisco's Growth Streak Is Coming to an End,11/17/2019
"SoftBank's Yahoo Japan, Line Corp announce merger",11/17/2019
Cabot Microelectronics Corporation Reports Record Revenue for Fourth Quarter and Full Fiscal Year 2019,11/17/2019
2 Stocks to Hold  for the Next 20 Years,11/17/2019
"Park National Corporation: Good Growth Prospects, But A Bit Expensive",11/17/2019
Barrick reaches agreement to sell its share of Australian Super-pit for $750M,11/17/2019
Sypris Solutions Recovering Slower Than Expected,11/17/2019
Bob Iger's 7 Biggest Moves as Disney's CEO,11/17/2019
Vornado: Another Under-Valued Dividend Paying REIT,11/17/2019
Made in China: Samsung farms out more phones to fend off rivals,11/17/2019
Is Altria a Great Dividend Stock?,11/17/2019
3  Dividend Aristocrats to Buy and Hold Forever.,11/17/2019
Top 5 Companies Owned by Exxon Mobil (XOM),11/17/2019
FDA Approves Crizanlizumab: Here Is A New Drug For Sickle Cell Disease,11/17/2019
"Career Education: Outstanding Results, Significantly Undervalued",11/17/2019
HP says open to exploring bid for Xerox,11/17/2019
Nike Stops Selling on Amazon; Why That's Good for Investors,11/17/2019
Computer firm HP rejects takeover approach by Xerox,11/17/2019
AMC: Non-Secular Non-Decline,11/17/2019
HP board rejects takeover bid from Xerox,11/17/2019
"Boeing, Airbus kept in suspense over big Dubai jet deals",11/17/2019
Aberdeen Asia-Pacific Income Fund: Upside On Improving Region Risk Sentiment,11/17/2019
HP Rejects Xerox Takeover Bid,11/17/2019
Stocks This Week: Buy IBM And Sell Short Colgate Palmolive,11/17/2019
HP Rejects Takeover Bid From Xerox,11/17/2019
Esperion Announces Pooled Analyses from Phase 3 LDL-C Lowering Clinical Development Program of Bempedoic Acid Presented at the American Heart Association 2019 Scientific Sessions,11/17/2019
White House confirms Trump will visit Apple's manufacturing plant in Austin,11/17/2019
3 Top Infrastructure Stocks to Watch in November,11/17/2019
3 Stocks - Peter Lynch-  Would Love,11/17/2019
The Gold ETF Continues To Fade As Commodities And Dollar Rebound,11/17/2019
HP rejects Xerox's $33.5 billion offer to buy the company,11/17/2019
Alibaba to close books early for $13.8 billion Hong Kong listing thanks to strong demand,11/18/2019
Kornit Digital Ltd. (KRNT) CEO Ronen Samuel on Q3 2019 Results - Earnings Call Transcript,11/18/2019
Cabot Microelectronics Corporation (CCMP) CEO David Li on Q4 2019 Results - Earnings Call Transcript,11/18/2019
Switching Funds In A Taxable Account? Use This Calculator,11/18/2019
Customers claim Ulta’s Beautyfest was full of empty promises,11/18/2019
"Duluth Holdings: Down, But Not Out",11/18/2019
"Woodward, Inc (WWD) CEO Tom Gendron on Q4 2019 Results - Earnings Call Transcript",11/18/2019
"Exclusive: KKR taps CK Infrastructure, buyout groups as it seeks bids for Goodpack - sources",11/18/2019
Comcast faces antitrust lawsuit from Denver sports network,11/18/2019
Vulcan Materials Stock Holds Quarterly Value Level,11/18/2019
Hacked Disney+ accounts are reportedly being sold for as little as $3,11/18/2019
Uber's co-founders sell millions of their stock in the company,11/18/2019
Ascendis Pharma A/S (ASND) CEO Jan Mikkelsen on Q3 2019 Results - Earnings Call Transcript,11/18/2019
Qualcomm Stock Sets Multi-Year High on Earnings,11/18/2019
Humana Stock Spikes Toward All-Time High,11/18/2019
Waymo's Program to Hail Driverless Cars Keeps Expanding,11/18/2019
U.S. watchdog backs Bezos' protest over key Pentagon launch program,11/18/2019
2 Stocks That Got Punched on Monday,11/18/2019
Congressional Democrats demand details on Google's use of patient data by Dec. 6,11/18/2019
Apple iPhone 11 Demand in China Rises From a Year Earlier,11/18/2019
Why Netflix's Operating Margins Have Big Upside,11/18/2019
Sundance Energy Australia Limited (SNDE) CEO Eric McCrady on Q3 2019 Results - Earnings Call Transcript,11/18/2019
CVS: Still A Buy,11/18/2019
AeroCentury Corp. Announces Sale of Aircraft,11/18/2019
Cray CEO Peter Ungaro Wins HPCwire Outstanding Leadership in HPC Award,11/18/2019
Why Intelsat Stock Plummeted 40% Today,11/18/2019
Zendesk CEO: We expect to top $1 billion in revenue in 2020,11/18/2019
Why Ford's Mustang Mach-E Is A Game-Changer,11/18/2019
"Twitter CFO talks the social platform's priorities, growing importance on topics and events",11/18/2019
Kylie Jenner Sells Stake in Cosmetics Line to Coty for $600 Million,11/18/2019
JPMorgan Chase & Co.: A Low Yielder Preferred Stock IPO Also From The Largest Bank,11/18/2019
Apple launches a dedicated mobile app for its developer community,11/18/2019
"18 months after acquisition, MuleSoft is integrating more deeply into Salesforce",11/18/2019
Funko Goes To Hollywood With A Brick-And-Mortar Retail Experience,11/18/2019
Can Lowe's (LOW) Break Through to New Levels with Q3 Report?,11/18/2019
"Jim Cramer talks investing, buying the dip in technology stocks",11/18/2019
Ford electrifies the Mustang: 5 trades,11/18/2019
Driving innovation to appeal to next generation of consumers: Levi's CEO Chip Bergh,11/18/2019
Can Kylie Jenner Be A Game Changer For Coty? The Jury Is Still Out On That,11/18/2019
"NVIDIA Launches Magnum IO Software Suite to Help Eliminate Data Bottlenecks for Data Scientists and AI, HPC Researchers",11/18/2019
"CBS’ David Nevins On “Impressive” Disney+ Launch, James Comey Miniseries & Being An “Equal Opportunity Offender”",11/18/2019
The electric car wars are gaining speed as Ford unveils New Mustang MU,11/18/2019
Facebook Is Not Making A Key Public Relations Point,11/18/2019
NVIDIA and Tech Leaders Team to Build GPU-Accelerated Arm Servers  for New Era of Diverse HPC Architectures,11/18/2019
America's Car-Mart (CRMT) Beats Q2 Earnings and Revenue Estimates,11/18/2019
Boeing to give Southwest board 737 MAX update this week,11/18/2019
How T-Mobile CEO John Legere Changed the Industry,11/18/2019
NVIDIA Announces Scalable GPU-Accelerated Supercomputer in the Microsoft Azure Cloud,11/18/2019
3 Dow Stocks for Dividend Investors to Buy as Stock Market Keeps Climbing,11/18/2019
Beyond Meat vs Zhenmeat: The battle for China's meatless market,11/18/2019
PagSeguro Digital Ltd (PAGS) CEO Ricardo Dutra on Q3 2019 Results - Earnings Call Transcript,11/19/2019
"Urban Outfitters, Inc. (URBN) CEO Richard Hayne on Q3 2020 - Earnings Call Transcript",11/19/2019
Volkswagen’s new all-electric concept wagon could be coming to the U.S. by 2022,11/19/2019
Volkswagen offers new take on its all-electric future with Space Vizzion Concept,11/19/2019
"Fed, FDIC approve merger of BB&T, SunTrust banks",11/19/2019
"Aston Martin launches first SUV, hopeful of a turnaround",11/19/2019
Microsoft Teams and other Office 365 services start coming back online after untimely outage,11/19/2019
"Aston Martin debuts first-ever SUV with $189,900 DBX",11/19/2019
"Alibaba sets price for Hong Kong listing, making it the world's biggest so far this year",11/19/2019
ESCO Technologies Inc. (ESE) CEO Vic Richey on Q4 2019 Results - Earnings Call Transcript,11/19/2019
Australia's Westpac slapped with 23 million money laundering breaches,11/19/2019
"Audi’s next all-electric vehicle, the e-tron Sportback, is a “coupé” SUV",11/19/2019
2 Stocks That Soared Higher on Tuesday,11/19/2019
Google Launches Stadia Gaming Service,11/19/2019
Audi's latest lighting technology,11/19/2019
Audi's e-tron Sportback has high-tech features that are illegal in the US,11/19/2019
Boeing engine cover re-design called for after woman sucked from plane,11/19/2019
The Chefs’ Warehouse Announces Pricing of $130 Million of 1.875% Convertible Senior Notes Due 2024,11/19/2019
Microsoft Teams surpasses 20 million daily active users; rival Slack shares slip,11/19/2019
Middlesex Water Company Announces Pricing of Public Offering of Common Stock,11/19/2019
"Curaleaf Holdings, Inc. (CURLF) CEO Joe Lusardi on Q3 2019 Results - Earnings Call Transcript",11/19/2019
Can Netflix Stock Fend Off Competition And Move Higher?,11/19/2019
Disney Stock: Is Disney+ Hype Priced In?,11/19/2019
"Disney’s Kevin Mayer Talks Disney+ Launch Glitches & Early Subscriber Results, Mouse House Refutes On Hacking Claims",11/19/2019
"GSE Systems, Inc. (GVP) CEO Kyle Loudermilk on Q3 2019 Results - Earnings Call Transcript",11/19/2019
3 Top-Ranked Cheap Tech Stocks Under $10 to Buy Before Thanksgiving,11/19/2019
"Square CFO Amrita Ahuja on firm's 'three horizons of growth,' fractional share investing and powering",11/19/2019
Verizon finally has 5G maps showing where the network has launched,11/19/2019
"Amazon, Apple, Facebook, Google push back against antitrust concerns",11/19/2019
Nvidia CEO: Our business has benefited from a 'perfect storm' in 2018,11/19/2019
