NW Natural Files Oregon General Rate Case,12/30/2019
BeiGene Gets Approval for Lymphoma Drug Tislelizumab in China,12/30/2019
BlackRock® Canada Announces Final Annual Reinvested Capital Gains Distributions for the iShares® ETFs,12/30/2019
YouTube to limit data collection on videos for children: RPT,12/30/2019
Which Housing Stocks Are a Buy Now?,12/30/2019
J. C. Penney Up 32% in 3 Months: Can Efforts Aid Recovery?,12/30/2019
"Bullish on Tesla because of Europe, China: Wedbush's Dan Ives",12/30/2019
A New Year And A New Short-Term Bond Portfolio,12/30/2019
Could emerging markets be a good place to put capital in 2020?,12/30/2019
Markets Take A Pause; Stock Setups Continue.,12/30/2019
Sotheby’s Closes A Record-Breaking Decade Driven By Digital,12/30/2019
FuelCell Energy News: Why FCEL Stock Is Lighting Up 32% Today,12/30/2019
Tesla closes in red after bearish Cowen note,12/30/2019
"Alphabet: CFO's Continued Stock Buyback Strategy Will Boost The Stock Price, A 23% Upside",12/30/2019
SDRL – Seadrill Limited Announces Contract Extension for AOD II and AOD III,12/30/2019
"Ousted Renault-Nissan boss Carlos Ghosn appears to violate house arrest in Tokyo, reportedly lands in Lebanon",12/30/2019
Dynavax: Concentrating On Vaccines Could Stabilize The Investment,12/30/2019
Ousted Renault-Nissan boss Ghosn leaves Japan: report,12/30/2019
Stock Market Today: Nio Stock Doubles; NFL Ratings Climb,12/30/2019
S&P Sector Analysis: Rough Decade for Energy Stocks,12/30/2019
Build a Portfolio of Low-Cost ETFs for the Year Ahead,12/30/2019
Josh Brown: Goldman Sachs now a technology company in finance,12/30/2019
Jefferies: Less urgency to get legislation passed in 2020,12/30/2019
Avalara: A Compounding Growth Story,12/31/2019
Tencent Buys 10% Stake In Universal Music For $3.4 Billion,12/31/2019
The Community Financial Corporation Announces $10.8 Million Private Placement of Common Stock,12/31/2019
2020 stock resolutions: 4 trades,12/31/2019
Sarepta Therapeutics  Announces  Inducement Grants Under Nasdaq Listing Rule 5635(c)(4),12/31/2019
Chipmaker Suppliers Top the S&P in 2019,12/31/2019
Alexion Pharmaceuticals (ALXN) Outpaces Stock Market Gains: What You Should Know,12/31/2019
Qualys (QLYS) Stock Sinks As Market Gains: What You Should Know,12/31/2019
Kirkland Lake Gold (KL) Stock Moves 0.3%: What You Should Know,12/31/2019
What's ahead for the tech sector?,12/31/2019
IRS blocks companies like TurboTax from hiding free tax filing products in searches,12/31/2019
Old Republic International Corporation: A Boring Stock With Soaring Potential,12/31/2019
The Soybean Market Is Clearly In A Positive Mood,12/31/2019
"Year in Aerospace: Looking back at Boeing’s troubles, looking ahead to commercial triumphs",12/31/2019
"Easing Trade Tensions, China Demand Should Help Global X Copper Miners ETF",12/31/2019
Chile's Leading Brewer Still A Buy Despite Political Jitters,12/31/2019
Do Agriculture ETFs Make a Right Investment Choice for 2020?,12/31/2019
"Uber, Postmates lawsuit against California gig-workers law is 'very weak,' congressman says",12/31/2019
Local charities are the winners this holiday season thanks to donations through Monarch Casino Resort Spa,12/31/2019
"First Community Bankshares, Inc. Completes Acquisition of Highlands Bankshares, Inc.",12/31/2019
MSCI: ESG Related Business Can Take The Stock Price To New All-Time Highs,12/31/2019
Diodes Inc.: Semis On The Rise,12/31/2019
Diodes - Semis On The Rise,12/31/2019
iShares Preferred & Income Securities ETF: Higher Rates Are A Risk To Watch In 2020,12/31/2019
"Uber, Postmates Challenge California Freelance Law",12/31/2019
IShares U.S. Oil & Gas Exploration & Production ETF: Time To Buy This ETF,12/31/2019
Uber effort to kill California's AB 5 gig worker law is latest of many tries,12/31/2019
Universal Music Deal: Vivendi Sells 10% Stake to Tencent,12/31/2019
Treasury Bond ETFs Just Marked One of Their Best Performances in Years,12/31/2019
Sutter Rock Capital Corp. Announces Additional Adjustment to Conversion Rate for Convertible Notes,12/31/2019
Amerant Announces Redemption of $26.8 Million of Trust Preferred Securities,12/31/2019
Exclusive: Drugmakers from Pfizer to GSK to hike U.S. prices on over 200 drugs,12/31/2019
Seadrill News: SDRL Stock Surges 7% on Contract Extensions,12/31/2019
Jumei Announces Plan to Implement ADS Ratio Change,12/31/2019
"The Herzfeld Caribbean  Basin Fund, Inc. Pays Quarterly Distribution",12/31/2019
Will Douglas Dynamics Trounce the Market Again in 2020?,12/31/2019
"Why Aurora Cannabis, Canopy Growth, and Other Top Canadian Marijuana Stocks Soared Today",12/31/2019
Cannabis producer Hexo corrects accounting errors in re-filed financial statements,12/31/2019
Core Laboratories News: CLB Stock Crumbles 21% on Guidance Cut,12/31/2019
American Airlines: Unleash The Cash Flows,12/31/2019
A Realistic Valuation Of AMD Shares,12/31/2019
"Facebook Is Worth A Look Now, Despite Everything",12/31/2019
Carriage Services Announces Closing of Fairfax Memorial Park and Funeral Home,12/31/2019
Acreage Holdings: Cash-Strapped And Losing Relevance,12/31/2019
Neovasc News: NVCN Stock Skyrockets 65% on Angina Treatment Application,12/31/2019
Disingenuous for Uber to sue over constitutionality of Calif. law: Rep. Khanna,12/31/2019
10 Best Performing S&P 500 Stocks Of The Decade,12/31/2019
"Dow, Exxon Mobil and IBM top the 'Dogs of the Dow' list as 2019 ends",12/31/2019
10 Worst Performing S&P 500 Stocks Of The Decade,12/31/2019
"AxoGen Working Its Way Out Of The Penalty Box, But Execution Is Key",12/31/2019
Weekly Review: High-Yield CEFs - Positive Results In The Last Full Week Of 2019,1/1/2020
5 Stocks I'm Buying For My Retirement Portfolio In 2020,1/1/2020
"Tesla: Just The Price Charts, None Of The Hype",1/1/2020
"Apple's stock could be worth $100 more in 2020, tech analyst Gene Munster predicts",1/1/2020
Top 3 Dividend Stocks For 2020,1/1/2020
Is This the Best Athletic Stock on the Market?,1/1/2020
Cigna: The Health Services Powerhouse (Part 2),1/1/2020
Big Pharma raises prescription drug prices on New Year’s Day,1/1/2020
Forecasting 2020 For Fate Therapeutics,1/1/2020
"Bristol-Myers, Gilead, and Biogen hike US drug prices as the new year begins",1/1/2020
A.I. Is Learning to Read Mammograms,1/1/2020
Google Health's AI can spot breast cancer missed by human eyes,1/1/2020
Looking for a Growth Stock? 3 Reasons Why Lumentum (LITE) is a Solid Choice,1/1/2020
Here is Why Growth Investors Should Buy Blue Bird (BLBD) Now,1/1/2020
3 Reasons Growth Investors Will Love Casey's (CASY),1/1/2020
"Is Adecoagro (AGRO) a Solid Growth Stock? 3 Reasons to Think "" Yes """,1/1/2020
Simulations Plus (SLP) Earnings Expected to Grow: Should You Buy?,1/1/2020
Earnings Preview: Constellation Brands (STZ) Q3 Earnings Expected to Decline,1/1/2020
UniFirst (UNF) Earnings Expected to Grow: What to Know Ahead of Next Week's Release,1/1/2020
Analysts Estimate Lennar (LEN) to Report a Decline in Earnings: What to Look Out for,1/1/2020
Earnings Preview: Schnitzer Steel (SCHN) Q1 Earnings Expected to Decline,1/1/2020
Earnings Preview: Volt Information Sciences (VOLT) Q4 Earnings Expected to Decline,1/1/2020
Why the Earnings Surprise Streak Could Continue for American Airlines (AAL),1/1/2020
Why Delta (DAL) is Poised to Beat Earnings Estimates Again,1/1/2020
Why the Earnings Surprise Streak Could Continue for UnitedHealth (UNH),1/1/2020
Why Marathon Petroleum (MPC) Could Beat Earnings Estimates Again,1/1/2020
Why Verizon (VZ) is Poised to Beat Earnings Estimates Again,1/1/2020
Why Exxon (XOM) is Poised to Beat Earnings Estimates Again,1/1/2020
Why Comcast (CMCSA) is Poised to Beat Earnings Estimates Again,1/1/2020
5 Stocks Analysts Recommend Heading Into 2020,1/1/2020
Why Starbucks Struggles In Vietnam's $1B Coffee Market,1/1/2020
Are You Looking for a Top Momentum Pick? Why Amphenol (APH) is a Great Choice,1/1/2020
"Are You Looking for a Top Momentum Pick? Why Cue Biopharma, Inc.",1/1/2020
CACI International (CACI) is a Great Momentum Stock: Should You Buy?,1/1/2020
Career Education (CECO) is a Great Momentum Stock: Should You Buy?,1/1/2020
Atlantic Capital Bancshares (ACBI) Moves to Strong Buy: Rationale Behind the Upgrade,1/1/2020
All You Need to Know About Alexion (ALXN) Rating Upgrade to Strong Buy,1/1/2020
Affiliated Managers (AMG) Upgraded to Buy: Here's What You Should Know,1/1/2020
AbbVie (ABBV) Upgraded to Buy: Here's Why,1/1/2020
Amgen (AMGN) Upgraded to Buy: Here's What You Should Know,1/1/2020
Are Investors Undervaluing AbbVie (ABBV) Right Now?,1/1/2020
Are Investors Undervaluing Arcos Dorados (ARCO) Right Now?,1/1/2020
Is Lithia Motors (LAD) Stock Undervalued Right Now?,1/1/2020
Is Paccar (PCAR) Stock Undervalued Right Now?,1/1/2020
Rockwell Automation (ROK) is a Top Dividend Stock Right Now: Should You Buy?,1/1/2020
MRO or OXY: Which Is the Better Value Stock Right Now?,1/1/2020
AMWD vs. WSC: Which Stock Should Value Investors Buy Now?,1/1/2020
GILD vs. TECH: Which Stock Should Value Investors Buy Now?,1/1/2020
KOF or FMX: Which Is the Better Value Stock Right Now?,1/1/2020
ACA or CBPX: Which Is the Better Value Stock Right Now?,1/1/2020
Starbucks Losing Ground To Homegrown Luckin Coffee In China,1/2/2020
Invest In India At A 15% Discount,1/2/2020
Tesla cuts starting price for China-made Model 3 vehicles,1/2/2020
2 Stocks That Fizzled on Thursday,1/2/2020
Hecla Mining Just Got Lucky,1/2/2020
S&P 500 Valuation Starting In 2020,1/2/2020
Weekly Review: Municipal Bond CEFs - Slight Increase For The Benchmark,1/2/2020
"Resources Connection, Inc. (RECN) CEO Kate Duchene on Q2 2020 Results - Earnings Call Transcript",1/2/2020
Samsung sold more 5G phones last year than it predicted,1/2/2020
Huazhu Group Limited Announces the Closing of the Deutsche Hospitality Acquisition and the Signing of a Facilities Agreement,1/2/2020
How Microsoft Won The Pentagon Contract And Why It Matters,1/2/2020
OncoCyte Announces $7.6 Million Registered Offering,1/2/2020
Gabelli Multimedia Trust: This 5.125% Preferred Stock IPO Is The Last One For 2019,1/2/2020
"Kayne Anderson Midstream/Energy Fund Provides Unaudited Balance Sheet Information and Announces its Net Asset Value and Asset Coverage Ratios at December 31, 2019",1/2/2020
"Kayne Anderson MLP/Midstream Investment Company Provides Unaudited Balance Sheet Information and Announces its Net Asset Value and Asset Coverage Ratios at December 31, 2019",1/2/2020
Apple Strikes New Deal With U.K. Chipmaker,1/2/2020
Why Amazon Is Threatening to Fire Climate Activists,1/2/2020
Canaccord Raises Its Tesla Target,1/2/2020
2020 contrarian plays: 7 trades,1/2/2020
Google employees are complaining the company has changed — this chart shows one reason why,1/2/2020
"Two biotech stocks best way to play next leg of rally, says trader",1/2/2020
Pizza outrage: Mayor De Blasio slams Domino's for $30 pizzas on NYE,1/2/2020
A Quick Look At Highland Income Fund,1/2/2020
China kicks off 2020 with a bang,1/2/2020
2020 contrarian plays,1/2/2020
US Small Cap Cash Cows 100 ETF (CALF) Hits a New 52-Week High,1/2/2020
Ex-HBO executive Richard Plepler signs Apple TV+ deal,1/2/2020
Airbus tops Boeing as world's largest planemaker: Report,1/2/2020
The Cleveland-Cliffs Of The Future Is A Buy,1/2/2020
Ryder Partners To Build Up Electric Vehicle Infrastructure,1/2/2020
Will Boeing Survive The 737 MAX 8?,1/2/2020
Apple signs former HBO chief to 5-year production deal,1/2/2020
Leading Biotech Stock Crashes After Promising Drug Fails Late-Stage Test,1/2/2020
Illumina abandons $1.2 billion deal to buy rival Pacific Biosciences,1/2/2020
Financial health of Canadian defined benefit pension plans surges to end 2019,1/2/2020
AMD stock finally breaks its dot-com-era record high,1/2/2020
Most will trade privacy for access to services like Google: Box CEO,1/2/2020
Here's Why Novocure Slipped Lower Today,1/2/2020
Why General Electric Stock Popped 5% Today,1/2/2020
Ribbon Communications Embarks On A Risky Bet,1/2/2020
China ETFs Surge After Central Bank Eases Monetary Policy,1/2/2020
Amerisafe (AMSF) Rides on Underwriting Gains & Cost Control,1/2/2020
Novo Nordisk's Shares Up in a Year on Pipeline Progress,1/2/2020
TransAtlantic Petroleum Provides an Operations Update and Announces the Payment of Dividends on its Series A Preferred Shares in Common Shares,1/2/2020
SP Funds' Sharia-Compliant ETFs Hit the Market,1/2/2020
Why Antares Pharma's Sliding 10% Today,1/2/2020
12 Stocks That Have Been The World's Most Valuable Company,1/2/2020
Is Pfizer Raising Drug Prices Too Much in 2020?,1/2/2020
Cinedigm Signs Definitive Stock Purchase Agreement to Acquire 29% Stake in Leading Chinese Entertainment Company Starrise Media,1/2/2020
Canaccord raises price target for Tesla to $515,1/2/2020
3 Chinese Stocks Set to Rally Into the New Year,1/3/2020
Apple’s Tim Cook Sees 2019 Compensation Drop To $11.56M,1/3/2020
Here's Why Shares of Southern Copper Climbed 12% in December,1/3/2020
Alphabet-backed primary care startup One Medical files to go public,1/3/2020
United Airlines: Buy Iran Dip,1/3/2020
Police body camera maker Axon sues U.S. FTC over antitrust litigation,1/3/2020
Jim Cramer breaks down the top 2019 S&P 500 performers and their 2020 odds,1/3/2020
"The only 3 oil stocks to buy amid rising US-Iran tensions, according to Jim Cramer",1/3/2020
"Apple CEO Tim Cook's total pay dropped last year, but he still took home over $125 million",1/3/2020
Jim Cramer reviews the best 2019 Dow performers and predicts their 2020 moves,1/3/2020
Sea Is A Good Play On Asian Growth,1/3/2020
"Iran Will Wage Insurgency in U.S. Cyberspace, VMware's Kellermann Says",1/3/2020
3 Stocks with Solid Entry Points to Consider for 2020,1/3/2020
"Wedbush's Ives Says Tesla's EV Vision Taking Off, Stock May Hit $600",1/3/2020
"Wedbush's Ives Sees Apple Shares Breaking Out, Possibly Above $350",1/3/2020
Why Boeing Stock Lost 11% in December,1/3/2020
ETFs That May Suffer as US Consumer Confidence Takes a Hit,1/3/2020
Alphabet-backed One Medical files for IPO as money-losing tech companies struggle on public market,1/3/2020
"Exxon signals fourth quarter weakness in chemicals and refining, offset by asset sale",1/3/2020
Curaleaf Becomes a Major Pot Player in Las Vegas,1/3/2020
What to do with Tesla: 3 trades,1/3/2020
Delta employees sue Lands' End alleging new uniforms made them sick,1/3/2020
MGP Ingredients Or Facebook: You Say Which The Better Choice,1/3/2020
Syneos Health to Present at the 38th Annual J.P. Morgan Healthcare Conference,1/3/2020
"Final Trades: SNAP, XLE, CQQQ & SLB",1/3/2020
Bank of American upgrade L Brands,1/3/2020
Medtronic (MDT) Stock Moves -0.59%: What You Should Know,1/3/2020
AGNC Investment (AGNC) Stock Moves -0.28%: What You Should Know,1/3/2020
Best Buy (BBY) Stock Moves -0.15%: What You Should Know,1/3/2020
AutoZone (AZO) Stock Moves -0.15%: What You Should Know,1/3/2020
"Taser-maker Axon Sues FTC, Seeking To Fight Antitrust Probe In Federal Court",1/3/2020
Brookfield Renewable Partners: An Investment In The Energy Future,1/3/2020
Tesla delivers more than 367K vehicles in 2019,1/3/2020
Starbucks (SBUX) Stock Moves -0.58%: What You Should Know,1/3/2020
McDonald's (MCD) Stock Moves -0.35%: What You Should Know,1/3/2020
Home Depot (HD) Stock Moves -0.33%: What You Should Know,1/3/2020
Beyond Meat (BYND) Stock Moves -0.3%: What You Should Know,1/3/2020
Energy Transfer LP (ET) Stock Moves -0.5%: What You Should Know,1/3/2020
FTC challenges police body camera maker Axon's acquisition of rival Vievu,1/3/2020
5G Stocks For The Next Wave Of Connectivity,1/3/2020
"OneMedical, a unicorn health-clinic startup backed by Alphabet, files for IPO",1/3/2020
FTE  Networks Provides Shareholder Update,1/3/2020
Defense ETFs Take Flight on Bets of Heightened Military Action,1/3/2020
Adobe CTO says AI will ‘democratize’ creative tools,1/3/2020
Sina's Seven Quarter Bear Market Could Be Over,1/3/2020
Turkey ETF Plunges on Heightened Geopolitical Risks,1/3/2020
Ross LaJeunesse: It was alarming to see Google's culture change,1/3/2020
Snap reportedly acquires a deepfake startup,1/3/2020
How AutoZone Is Improving Its Supply Chain To Bolster Its Valuation,1/3/2020
Don’t Fall for This Deadly Dividend Trap,1/3/2020
"New York state really, really wanted Amazon — to the tune of billions",1/4/2020
Samsung confirms February 11 event for its next flagship launch,1/4/2020
Galaxy S11 will launch Feb. 11 at Samsung Unpacked in San Francisco,1/4/2020
Why Huazhu Group Stock Climbed 17.1% in December,1/4/2020
"Daimler recalls 744,000 Mercedes-Benz vehicles in US for faulty sunroofs",1/4/2020
Why Baozun Stock Fell 12.8% in December,1/4/2020
"Daimler recalls 744,000 U.S. Mercedes-Benz vehicles for faulty sunroofs",1/4/2020
Why iQiyi Stock Climbed 10.2% in December,1/4/2020
Why Elastic Stock Dropped 19% in December,1/4/2020
Tesla Delivers First China-Built Cars,1/4/2020
Here's Why Shares of Newmont Goldcorp Soared 13% in December,1/4/2020
Here's Why Mirati Therapeutics Jumped 28% in December,1/4/2020
Why Your 2020 Resolution Should Be to Buy More Energy Stocks,1/4/2020
These 3 Stocks Are on After-Christmas Sale,1/4/2020
Mark Your Calendar for Apple's Earnings,1/4/2020
Amazon's Biggest Threat Isn't a Huge Competitor but a Collective,1/4/2020
Better Buy: Cara Therapeutics vs. Fresenius,1/4/2020
The 2020 Dogs Of The Dow: Should You Bite?,1/4/2020
How Safe Are AT&T and Its Dividend?,1/4/2020
Amazon will begin to make a home in Northern Virginia in 2020,1/4/2020
XLU Weekly: Balance Development Around Key Support,1/4/2020
VXX: Sell The Pop,1/4/2020
"XLK Weekly: Failed Break Of Support Early Week, Price Discovery Higher To 93.38s",1/4/2020
Is Eldorado Gold Stock a Buy?,1/4/2020
3  Recession-Proof Stocks to Buy Now,1/4/2020
ConocoPhillips: Cutting The Bone To Maintain That Free Cash Flow High,1/4/2020
3 Top Artificial Intelligence Stocks to Watch in January,1/4/2020
UWT: It Is Time To Buy Crude Oil,1/4/2020
7 Top Robotics Stocks to Buy in January,1/4/2020
3 Top Healthcare Stocks to Buy in January,1/4/2020
Conagra Brands Sells Lender's Bagels To Grupo Bimbo,1/4/2020
The Northeast's Energy Problem Is an Opportunity for These 3 Utilities,1/4/2020
Can Apple Shares Go Even Higher? Wall Street Thinks So,1/4/2020
Michelin Remains Strong With A 7.5% Free Cash Flow Yield And 3.6% Dividend Yield,1/4/2020
A Look at Disney's 2019 Box Office Dominance,1/4/2020
Zumiez (ZUMZ) Up 10.7% Since Last Earnings Report: Can It Continue?,1/4/2020
Why Is Tiffany (TIF) Up 0.2% Since Last Earnings Report?,1/4/2020
Ulta (ULTA) Up 6% Since Last Earnings Report: Can It Continue?,1/4/2020
Why Is Patterson Cos. (PDCO) Down 11.8% Since Last Earnings Report?,1/4/2020
SAIC (SAIC) Up 5.1% Since Last Earnings Report: Can It Continue?,1/4/2020
Signet (SIG) Up 6.4% Since Last Earnings Report: Can It Continue?,1/4/2020
Why Is Guidewire Software (GWRE) Down 7.6% Since Last Earnings Report?,1/4/2020
Why Is Kroger (KR) Up 7.1% Since Last Earnings Report?,1/4/2020
Why Is Michaels (MIK) Up 33.2% Since Last Earnings Report?,1/4/2020
Cooper Cos. (COO) Up 3% Since Last Earnings Report: Can It Continue?,1/4/2020
Dollar General (DG) Up 0.2% Since Last Earnings Report: Can It Continue?,1/4/2020
Why Is Brown-Forman Corporation (BF.B) Up 5.9% Since Last Earnings Report?,1/4/2020
Amazon Is Not the Biggest Threat eBay Faces,1/4/2020
5 Recession-Ready Stocks to Consider Buying Now,1/4/2020
Tesla short sellers have lost $8 billion,1/4/2020
Why Spirit AeroSystems Fell 16% in December,1/5/2020
Why Shares of Altra Industrial Motion Surged 10% in December,1/5/2020
Here's Why Iovance Biotherapeutics Jumped 21.2% in December,1/5/2020
Here's Why Bristol-Myers Squibb Jumped 12.7% in December,1/5/2020
5G ICs: Qualcomm And Skyworks Top Companies In 2020,1/5/2020
"Zuora: Good Progress With Q3, But More To Come",1/5/2020
Nvidia’s new 360Hz G-Sync displays are tailor-made for esports,1/5/2020
Why Sonos Stock Climbed 12.8% in December,1/5/2020
Boeing has uncovered another possible design flaw with the 737 Max,1/5/2020
"Boeing, FAA reviewing wiring issue that could cause short circuit on 737 Max",1/5/2020
"HP at CES 2020: Unleashing Next Generation Computing Innovations to Enable More Freedom to Work, Live, Play",1/5/2020
"Costco Beats Earnings, but Stock Fades on Charts",1/5/2020
"DTD Is A Quality Dividend Fund, But Better Options Exist",1/5/2020
Why Amazon Is a Better Cloud Stock Than Alibaba,1/5/2020
Adobe Stock Sets New High but Is Extremely Overbought,1/5/2020
Instagram Could Become a Bigger Source of Revenue Than Facebook's Main App,1/5/2020
Advance Auto Parts Acquires the Last Thing of Value Sears Owned,1/5/2020
Why The Mosaic Company Stock Climbed 13.6% in December,1/5/2020
Netflix Faces a Potentially Make-or-Break Quarter,1/5/2020
The Top-Performing Energy Companies Of 2019,1/5/2020
Why CrowdStrike Stock Fell 14% in December,1/5/2020
Samsung to unveil new smartphones in February,1/5/2020
Why Cloudera Stock Climbed 17.7% in December,1/5/2020
"Defense ETFs ITA, XAR: Beware Before You Buy",1/5/2020
Why Lear Stock Gained 14% in December,1/5/2020
Why Shares of Tesla Soared 26% in December,1/5/2020
Here's Why Mirum Pharmaceuticals Rocketed 240% in December,1/5/2020
"Pinterest: I Called The Drop, Now It's Time To Buy",1/5/2020
3 Things That Can Go Right for Netflix Stock in 2020,1/5/2020
The Streaming Wars: Is YouTube the Sleeping Giant?,1/5/2020
"Amazon is generating lots of free-cash flow, time to get on board: Barron's",1/5/2020
"Boeing, FAA reviewing wiring issue on grounded 737 MAX",1/5/2020
I Did Not Find Alpha In 2019,1/5/2020
Better Buy: MercadoLibre vs. Facebook.,1/5/2020
"Despite Recent Gains, Mirium Shares Still Rated a Buy",1/5/2020
Alphabet: Net Cash King Gets Target Hike,1/5/2020
3 Top Marijuana Stocks to Watch in January,1/5/2020
"CrowdStrike’s CEO on how to IPO, direct listings and what’s ahead for SaaS startups",1/5/2020
General Motors Posts Lower Sales for the 4th Quarter,1/5/2020
Walmart and Amazon’s Biggest Challenge Is Here,1/5/2020
"Macao Casinos Ended 2019 in a Decline: Will 2020 Be Down, Too?",1/5/2020
Stocks This Week: Buy Maxim And Kinder Morgan,1/5/2020
Southern Co.'s 3 Biggest Nuclear Risks,1/5/2020
Energy Transfer: Approaching A Double-Digit Dividend,1/5/2020
Canada Goose Is Now Too Cheap to Ignore,1/5/2020
My Top Growth Stock for 2020,1/5/2020
Oil Stocks: 3 Bold Predictions for 2020,1/5/2020
2 Top 5G Stocks to Buy in 2020,1/5/2020
3 Top U.S. Stocks to Watch in January,1/5/2020
Dividend Growth Investment For 2020,1/5/2020
Will New Products Help Adyen Make Its Expansion Plans a Reality?,1/6/2020
Samsung CES 2020 keynote in under 6 minutes,1/6/2020
"Pier 1 Shares Plummet As Company Shuts Down 450 Stores, Sales Decline",1/6/2020
Facebook to reportedly ban deepfakes ahead of 2020 US election,1/6/2020
Hyundai at CES 2020 in 7 minutes,1/6/2020
Sony at CES 2020 in 9 minutes,1/6/2020
Intel event at CES 2020 in 9 minutes,1/6/2020
AMD at CES 2020 in 10 minutes,1/6/2020
Cal-Maine: You Have To Break Some Eggs To Make An Omelet,1/6/2020
"‘The Future is Coming,’ but not yet: Sony teases PlayStation 5 at CES, but only reveals its new logo",1/6/2020
Sony unveils autonomous car predicting mobility to be next 'mega-trend',1/6/2020
CrowdStrike Stock Breaks Out Amid Iran Tensions,1/6/2020
Hyundai is Uber’s newest partner for building flying taxis,1/6/2020
Why Shares of American Airlines Fell 10% in 2019,1/6/2020
Why Carvana Stock Skyrocketed 181% Last Year,1/6/2020
An Apple A Day Keeps Negative Returns Away,1/6/2020
Why These 2 Stocks Slumped on Monday,1/6/2020
Wrap Technologies: The Stock Could Double By 2021,1/6/2020
"GM delivered 3.09 million vehicles in China in 2019, down 15% year-on-year",1/6/2020
"NETGEAR, the Leader in Mesh WiFi, Pushes the Transition to WiFi 6 With New Nighthawk Mesh WiFi System",1/6/2020
NETGEAR Introduces 4G LTE Orbi Tri-Band Mesh WiFi Router,1/6/2020
NETGEAR Nighthawk M5 5G WiFi 6 Mobile Router Named as CES 2020 Innovation Awards Honoree,1/6/2020
NETGEAR Nighthawk AX8 Cable Modem Router Named as CES 2020 Innovation Awards Honoree,1/6/2020
NETGEAR Advances Powerful PoE+  Applications With New Technologies Introduced at CES 2020,1/6/2020
"Three years later, Sony is still hitting sales milestones for its VR headset",1/6/2020
Nissan says it will continue to pursue legal action against Ghosn,1/6/2020
YouTube starts limiting ad targeting and data collection on kids content,1/6/2020
Sony just announced a car,1/6/2020
Boeing reassigns thousands of 737 Max workers while supplier Spirit mulls layoffs as grounding continues,1/6/2020
Flawed Bearish Narrative Has Driven Shake Shack's Price To Opportune Buying Level,1/6/2020
Watch Sony's new PS5 announcement from CES 2020,1/6/2020
PlayStation 5 announced for holidays 2020,1/6/2020
Why American Eagle Outfitters Stock Gave Up 24% Last Year,1/6/2020
My Top Tech Pick Of 2020 - AMD Has Beaten The S&P By 15x Since I First Recommended It,1/6/2020
Weight Watchers CEO on the 2020 vision,1/6/2020
Impossible Foods to trial plant-based sausage patty with Burger King,1/6/2020
Audi AI:ME concept demonstrates innovative safety through lights,1/6/2020
"Boeing will reassign 3,000 workers as airlines reach compensation deals over MAX",1/6/2020
Meatless ‘Impossible Sausage’ is coming to breakfast sandwiches at Burger King,1/6/2020
"Intel details new laptop, graphics processors at CES",1/6/2020
Intel packs one enormous foldable screen into new PC prototype,1/6/2020
Intel and Google plot out closer collaboration around Chromebooks and the future of computing,1/6/2020
AMD challenges Intel dominance in laptops with with new Ryzen 7 4000-series processors,1/6/2020
