"Stitch Fix, Inc. (SFIX) CEO Katrina Lake on Q4 2019 Results - Earnings Call Transcript",10/1/2019
Goldman Sachs reshuffles Asia M&A leadership as John Kim retires - memo,10/1/2019
What We Learned From Amazon's Big Hardware Announcements,10/1/2019
Cerner: A Great Stock To Add To Your Portfolio In 2020,10/1/2019
Johnson & Johnson settles Ohio lawsuits to avoid federal trial,10/1/2019
5 Key Conclusions From United Technologies' Latest Presentation,10/1/2019
Foot Locker: Worth The Gamble,10/1/2019
"The Stock Market Dived Today, but These 2 Stocks Blasted Higher",10/1/2019
These High-Yield Stocks Are Adding to Their Appeal,10/1/2019
This High-Yield Stock Could Generate Massive Returns Over the Next 5 Years,10/1/2019
New Oriental Education Sees Recurring Revenues and Multi-Generational Demand,10/1/2019
J&J to pay $20.4 million to settle opioid lawsuits with two Ohio counties,10/1/2019
Pharma Giant J&J Avoids Opioid Trial In Ohio With $10 Million Settlement,10/1/2019
Brokerage Stocks Plunge As Schwab Eliminates Commissions,10/1/2019
Johnson & Johnson settles with Ohio counties ahead of opioid trial,10/1/2019
"Visa, Mastercard reconsider backing Facebook's Libra, report says",10/1/2019
Apple Looking For New High,10/1/2019
Why Cloud Computing Will be a Key Revenue Driver for Alibaba,10/1/2019
Micron: Back To Reality,10/1/2019
"The New Ireland Fund, Inc. Monthly Portfolio Update.",10/1/2019
"Jim Cramer explains how to play stocks of McDonald's, Chipotle going into the fourth quarter",10/1/2019
"TD Ameritrade Joins The Party, Cuts Commissions On Stocks, ETFs And Options Trades",10/1/2019
"Visa, Mastercard reportedly reconsidering support for Facebook's Libra",10/1/2019
Grocery Outlet Holding Corp.  Announces Secondary Offering of Shares of Common Stock,10/1/2019
Grocery Outlet Holding Corp. Announces Waiver of Lock-up Restrictions,10/1/2019
ConEd CEO on utility stocks' reaction to interest rates,10/1/2019
Weak oil prices hit Exxon's third-quarter earnings: filing,10/1/2019
Walmart Considering Its Options for Its Jetblack Concierge Service,10/1/2019
"Visa, Mastercard reconsider backing Facebook's Libra: WSJ",10/1/2019
The Wall Street Journal: Major backers of Facebook’s Libra may be getting cold feet,10/1/2019
McDonald's Buzzkill: 4 trades,10/1/2019
NVIDIA's Gaming Business Could Get a Boost This Fall,10/1/2019
Shockwave Hits Brokerage Firms After Charles Schwab Slashes Commissions,10/1/2019
"Facebook Has Work Cut Out for Them With Libra, Blockchain Capital's Bogart Says",10/1/2019
"Why Mark Zuckerberg Needs to Control Facebook, In His Own Words",10/1/2019
PayPal (PYPL) vs. Square (SQ): Which Fintech Stock is a Better Buy?,10/1/2019
Delek US Holdings to Participate in the Wolfe Research Utilities & Energy Conference,10/1/2019
Netflix pops after streaming giant announces new Ryan Reynolds action film,10/1/2019
NextCure to Present Clinical Data from NC318 Phase 1/2 Clinical Trial at 34th Annual Meeting of SITC,10/1/2019
Box: Watch Out For A Microsoft Takeover Upside,10/1/2019
Ford's New Joint Venture in India Is an Expensive Good Move,10/1/2019
Canadian National Unveils Plan For Winter Operations,10/1/2019
Jounce Therapeutics to Present Two Posters from the JTX-4014 and Vopratelimab Programs at the Society for Immunotherapy of Cancer’s (SITC) 34th Annual Meeting,10/1/2019
Uber's App Overhaul Distracts From Its Slow Revenue Growth,10/1/2019
Here's Why AnaptysBio Stock Fell on Tuesday,10/1/2019
BP (BP) Stock Moves -0.76%: What You Should Know,10/1/2019
Molina (MOH) Stock Moves -0.22%: What You Should Know,10/1/2019
Allergan (AGN) Stock Moves -1.09%: What You Should Know,10/1/2019
Cosan (CZZ) Stock Moves -0.4%: What You Should Know,10/1/2019
Rent-A-Center (RCII) Gains As Market Dips: What You Should Know,10/1/2019
"Amyris, Inc. (AMRS) CEO John Melo on Q2 2019 Results - Earnings Call Transcript",10/2/2019
Bed Bath & Beyond Inc. (BBBY) CEO Mary Winston on Q2 2019 Results - Earnings Call Transcript,10/2/2019
"Amazon.com brings Alexa to Brazil, kicks off pre-orders for devices",10/2/2019
4 Reasons To Buy GW Pharmaceuticals,10/2/2019
3 Stocks That Got Slammed on Wednesday,10/2/2019
Apple CEO Tim Cook Defends DACA To Supreme Court,10/2/2019
Airbus plant in Alabama spared fallout from U.S. tariffs,10/2/2019
3 Beaten-Down Natural Gas Stocks You Can Buy to Weather a Recession,10/2/2019
"Resources Connection, Inc. (RECN) CEO Kate Duchene on Q1 2020 Results - Earnings Call Transcript",10/2/2019
"Resources Connection, Inc. (RECN) CEO Kate Duchene on Q1 2020 - Earnings Call Transcript",10/2/2019
UAW mulls no-confidence vote in General Motors CEO Mary Barra,10/2/2019
Paychex Lifts Its Full-Year Outlook After a Bouyant Start to the Year,10/2/2019
U.S. panel probing 737 MAX seeks to interview Boeing engineer: Bloomberg,10/2/2019
Apple Faces Antitrust Risk Around Default Apps,10/2/2019
Buy Coda Octapus Group: Sonar Imaging Niche Leader Has Value,10/2/2019
Lantronix to Celebrate Grand Opening of New  Facility in India,10/2/2019
Huazhu Hotels: 1 Little-Known China Tourism Stock,10/2/2019
Microsoft's 2 Biggest Announcements on Wednesday,10/2/2019
"Verizon Focused on 5G Mobility Build, CEO Vestberg Says",10/2/2019
"Tesla hits 97,000 deliveries in Q3 up 1.9%",10/2/2019
Samsung pulls the plug on Chinese smartphone production,10/2/2019
XpresSpa Announces Results of Annual Meeting of Stockholders,10/2/2019
Organovo Acknowledges Receipt of Proposal,10/2/2019
Troubles with Tesla's automated parking feature summon safety regulators,10/2/2019
General Motors' New Pickups Powered a Ford-Beating Sales Gain,10/2/2019
Douglas Dynamics: 2019's Alpha Could Persist,10/2/2019
Buy stock in spice and food giant McCormick in this unpredictable market: Jim Cramer,10/2/2019
"Tesla delivery numbers fall short of Musk's 100,000 target",10/2/2019
Florida joins T-Mobile-Sprint merger settlement,10/2/2019
As regulatory scrutiny grows for Facebook's Libra partners reconsider,10/2/2019
The Consumer Trade: 3 picks,10/2/2019
Will Costco (COST) Continue Its Run with Strong Q4 Earnings?,10/2/2019
Paychex CEO to Jim Cramer: Small business hiring picked up in September despite slowdown worries,10/2/2019
"Paychex, Inc. (PAYX) CEO Martin Mucci on Q1 2020 Results - Earnings Call Transcript",10/2/2019
Huge Jump In Short Interest For Restaurant Brands International As Stock Hits Potential Support,10/2/2019
"Tesla Delivery Record Shows U.S. Is Ready for EVs, Loup's Munster Says",10/2/2019
"Bed, Bath & Beyond shares pop on EPS beat but revenues still fall short of expectations",10/2/2019
"US declares 'win' in Boeing-Airbus subsidy dispute, but travelers will pay",10/2/2019
Kroger to layoff several store employees,10/2/2019
"Apple CEO opposes Trump, supports DACA recipients in Supreme Court",10/2/2019
Tesla deliveries miss Wall Street estimates; shares fall 6%,10/2/2019
GoPro cuts second-half profit outlook citing Hero8 production delay,10/2/2019
Brookfield Asset Management Is Firing On All Cylinders,10/2/2019
Riverview Bancorp Announces Quarterly Cash Dividend,10/2/2019
Prestige Consumer Healthcare Inc. to Release Fiscal 2020 Second Quarter Earnings Results,10/2/2019
Amazon Is Diving Headlong Into the Grocery Business,10/2/2019
GoPro shares plunge nearly 20% in extended trading on delay in camera shipments,10/2/2019
Franco-Nevada Corporation May Soon Shine Like Gold: A Base Case To Buy,10/2/2019
Apple employs 443 DACA recipients. Tim Cook is taking a stand,10/2/2019
ServiceNow (NOW) Stock Moves -1.31%: What You Should Know,10/2/2019
Facial recognition is coming to hotels. I stayed at Alibaba's hotel of the future,10/3/2019
Aehr Test Systems (AEHR) CEO Gayn Erickson on Q1 2020 Results - Earnings Call Transcript,10/3/2019
"Facebook removes 'coordinated' fake accounts in UAE, Egypt, Nigeria and Indonesia",10/3/2019
"SMART Global Holdings, Inc. (SGH) CEO Ajay Shah on Q4 2019 - Earnings Call Transcript",10/3/2019
Should You Buy This Battered Booze-and-Marijuana Stock?,10/3/2019
"Ascena Retail Group, Inc. (ASNA) CEO Gary Muto on Q4 2019 Results - Earnings Call Transcript",10/3/2019
Always-on Apple Watch Series 5 helps to dim ‘nerd factor’,10/3/2019
U.S. House panel wants Facebook's Zuckerberg to testify on Libra by January,10/3/2019
Heron Therapeutics: Priming The Fuse,10/3/2019
Why Shares of LATAM Airlines Soared 33% in September,10/3/2019
John Malone Completes Sale Of His Lionsgate Stake,10/3/2019
"Incoming HP CEO Announces 7,000-9,000 Layoffs As Part Of Major Restructuring",10/3/2019
HP plans to reduce its global staff by thousands of employees over the next three years,10/3/2019
Startups ‘are staying private way too long’ says Salesforce founder Marc Benioff,10/3/2019
"Key Words: Mark Zuckerberg on billionaires: ‘At some level, no one deserves to have that much money’",10/3/2019
Amazon (AMZN) Eyes Healthcare Market and Expands Tech Portfolio at Annual Event (Revised),10/3/2019
Business as the Greatest Platform for Change with Marc Benioff (Salesforce),10/3/2019
Zuckerberg says Facebook will sue to stop EU’s global content takedowns,10/3/2019
Grocery Outlet Holding Corp. Announces Pricing of Secondary Offering of Shares of Common Stock,10/3/2019
Facebook CEO Mark Zuckerberg live streams employee Q&A in rare move,10/3/2019
"US, UK and Australia urge Facebook to create backdoor access to encrypted messages",10/3/2019
Microsoft (MSFT) Stock Looks Like a Buy with Its Earnings Release in Sight,10/3/2019
3 No-Brainer Tech Stocks to Add to Your Portfolio,10/3/2019
"HP Inc to cut about 7,000 to 9,000 jobs",10/3/2019
Google wants its AI to disappear in your clothes,10/3/2019
"Facebook's Mark Zuckerberg live-streams employee Q&A, 'stands by' comments in leaked recording",10/3/2019
Tim Cook weighs in against launching an Apple cryptocurrency,10/3/2019
HP Inc. Announces Fiscal 2020 Financial Outlook & Restructuring Plan,10/3/2019
"It's time to buy Ulta Beauty, says Jim Cramer",10/3/2019
"Cabot Microelectronics Corporation to Release Financial Results for Fourth Quarter and Full Fiscal Year 2019 After Market Close on November 6, 2019",10/3/2019
Disney and Amazon going to war over streaming content: report,10/3/2019
AG Barr calls on Facebook to limit message-encryption plans,10/3/2019
NW Natural Holdings Increases Dividend for 64th Consecutive Year,10/3/2019
Tale of two F.A.A.N.G. stocks: 5 trades,10/3/2019
Constellation CEO says stock fell on earnings after Canopy losses 'mixed up' investors,10/3/2019
WarnerMedia ratchets up bloodbath with big firings,10/3/2019
Novelion Therapeutics Announces Filing of Definitive Proxy Statement in Connection with Proposed Liquidation and Other Matters,10/3/2019
Tesla (TSLA) Falls Short of Achieving Q3 Delivery Target,10/3/2019
"Constellation brands beats earnings estimates, but pot taints results",10/3/2019
ETFs in Focus as US Manufacturing PMI Data Disappoints,10/3/2019
Japan ETFs May Be an Overlooked Area of Global Market,10/3/2019
Why ETF Investors Are Cautiously Optimistic,10/3/2019
Costco quarterly sales miss estimates amid rising competition,10/3/2019
"Facebook is being leant on by US, UK, Australia to ditch its end-to-end encryption expansion plan",10/3/2019
Brandywine Realty Trust Prices $100.0 Million of 4.100% Guaranteed Notes Due 2024 and $100.0 Million of 4.550% Guaranteed Notes Due 2029,10/3/2019
Paychex's Management Is Bent on Using Innovation to Secure Its Customer Base,10/3/2019
"Gold Looks Shiny for Fourth Quarter, Say Experts",10/3/2019
Bed Bath & Beyond Earnings Suggest More Troubles Ahead,10/3/2019
Google CEO and Ivanka Trump announce plan to teach workers tech skills,10/3/2019
Saia Opens New Southern California Terminal,10/3/2019
Why 3D Systems Stock Gained More Than 16% in September,10/4/2019
"U.S. agency reviews whether 2,000 Teslas should have been recalled",10/4/2019
2 Trends in Wind Power That Investors Need to Know About,10/4/2019
Micron: Darkness Before Dawn,10/4/2019
3 Recession-Ready Stocks - to Buy Right Now,10/4/2019
"After A Year Of Volatility, Which Sector ETFs Are In the Black?",10/4/2019
The mythical iPad laptop: Apple’s forbidden fruit,10/4/2019
AeroCentury Corp. Announces Aircraft Repossessions,10/4/2019
Better Buy:  Bloom Energy vs. Plug Power,10/4/2019
VMware and Carbon Black Announce Satisfaction of the Remaining Regulatory Condition for Tender Offer,10/4/2019
Here's Why Liquid Biopsy Stocks Fell as Much as 39.2% in September,10/4/2019
Stitch Fix CEO says the online-styling company could feel potential tariffs,10/4/2019
Why Box Rose 13.2% in September,10/4/2019
Exclusive: Regulators weigh 'startle factors' for Boeing 737 MAX pilot training - Transport Canada executive,10/4/2019
Option Pit Founder's Bullish Trade on Schwab,10/4/2019
Jim Cramer: I think this is the time to start buying shares of Clorox,10/4/2019
PG&E says it has $34.45 billion in debt financing for reorganization,10/4/2019
Apple announces free repair program for some iPhone 6s devices that might not turn on,10/4/2019
China ETFs to Help Investors Target Emerging Opportunities,10/4/2019
UAW sees 'good progress' on key issues to try to resolve GM strike,10/4/2019
Bonanza Creek Energy: Solid Production Growth With Leverage Expected To Remain Low,10/4/2019
Chart of the Week: 3 trades,10/4/2019
"Final Trade: AAPL, PFPT, KBE & CME",10/4/2019
Disney bans Netflix ads on its platform ahead of Disney+ launch,10/4/2019
Victory Capital Holdings (VCTR) Gains But Lags Market: What You Should Know,10/4/2019
Cigna (CI) Outpaces Stock Market Gains: What You Should Know,10/4/2019
Columbia Sportswear (COLM) Gains But Lags Market: What You Should Know,10/4/2019
Anthem (ANTM) Outpaces Stock Market Gains: What You Should Know,10/4/2019
Huron Consulting (HURN) Gains But Lags Market: What You Should Know,10/4/2019
"Apple's reportedly ramping up iPhone production, but is it really all about the iPhone?",10/4/2019
MasTec (MTZ) Gains But Lags Market: What You Should Know,10/4/2019
Health Insurance Innovations (HIIQ) Stock Sinks As Market Gains: What You Should Know,10/4/2019
Canadian Solar (CSIQ) Gains But Lags Market: What You Should Know,10/4/2019
Google in talks to acquire TikTok rival Firework,10/4/2019
Are You Really Suprised All-Electric SUVs Are Already Primed For Success?,10/4/2019
Yext: Investment Is A Bargain At Current Valuation,10/4/2019
Apellis Pharmaceuticals Announces Inducement Grants Under Nasdaq Listing Rule  5635(c)(4).,10/4/2019
Buy Amazon (AMZN) Stock on the Dip Before Q3 Earnings Despite Economic Worries?,10/4/2019
"Financial Sector, Bank ETFs Could Find Support from Regulatory Relief",10/4/2019
Biotech ETFs Suffer Seventh Week of Outflows,10/4/2019
What Tesla’s Grab Of DeepScale Is All About,10/4/2019
Suzy CEO on streaming war: I think Netflix has challenges ahead,10/4/2019
BP CEO Bob Dudley to Step Down in March,10/4/2019
Snap CEO: It will take a decade for smart glasses to be widely adopted,10/4/2019
Pepsi Earnings Call Highlights: The Snack Food Market Is Fueling Growth,10/4/2019
Les camionneurs de CNTL affiliés à Unifor ratifient une nouvelle convention collective,10/4/2019
Aeterna Zentaris Announces Appointment of New President and Chief Executive Officer,10/4/2019
Costco (COST) Shares See Tepid Movement After Concluding Fiscal 2019,10/4/2019
"PayPal Pulls Out of Libra, Facebook’s Cryptocurrency Project",10/4/2019
H&R Block to invest in Kansas City startup community through KCRise Fund II,10/4/2019
Wells Fargo: Buy The New CEO With A 15% Yield,10/5/2019
Apple's Revenues: Splintering,10/5/2019
Here's Why Genetic Testing Stocks Tumbled in September,10/5/2019
Why Qudian Stock Fell 13.8% Last Month,10/5/2019
Why Changyou.com Stock Skyrocketed 65.5% in September,10/5/2019
Why Shares of Carvana Fell 18.7% in September,10/5/2019
How Apple Is Reacting to Trump's Tariffs,10/5/2019
Why SYNNEX Stock Popped 34.7% in September,10/5/2019
Why iQiyi Stock Lost 12% Last Month,10/5/2019
Why Stratasys Stock Dropped 10.6% in September,10/5/2019
Why U-Haul Parent Amerco's Stock Gained 11% in September,10/5/2019
Why Camping World Holdings Stock Popped 17.1% in September,10/5/2019
"Main issues in UAW-GM labor talks narrow to wages, pensions: source",10/5/2019
Is Melco Resorts a Buy Today?,10/5/2019
How To Build The Perfect Retirement Income Portfolio,10/5/2019
"Cirrus Logic Stock Seems Risky, but Rewarding",10/5/2019
Disney Stock Nears Major Buying Signal,10/5/2019
Why IAC/InterActiveCorp Stock Lost 14% Last Month,10/5/2019
McDonald's Takes a Page from the Starbucks Playbook,10/5/2019
Is Glu Mobile Stock All Set to Go North?,10/5/2019
Here’s Why Acceleron Pharma Stock Fell 12% in September,10/5/2019
3 Reasons Cedar Fair Shot Down Six Flags,10/5/2019
Bed Bath & Beyond: Still Too Risky of an Investment,10/5/2019
These 2 Neuroscience Stocks Have Tanked as Much as 33% Since September 1. Are They Buys?,10/5/2019
The Game Is Just Getting Started for Take-Two Interactive,10/5/2019
McCormick Investors Will Find a Lot to Savor in Its Earnings Report,10/5/2019
WWE Friday Night SmackDown Draws Massive Rating Of Just Under 4 Million For Fox Premiere,10/5/2019
Geely Automobile: China’s Leading Car Stock,10/5/2019
These Industrial Giants See an Economic Slowdown Ahead,10/5/2019
3 Top Healthcare Stocks to Buy in October,10/5/2019
IBM Dividend: Everything You Need to Know,10/5/2019
How to Invest in Mining Stocks,10/5/2019
Pepsi Earnings: Closing the Gap With Coca-Cola,10/5/2019
The 10 Biggest Restaurant Stocks,10/5/2019
Lundin Mining: A Call Option On The Copper Price,10/5/2019
Where Will Brookfield Asset Management Be in 5 Years?,10/5/2019
WWE Is Breaking The Bank To Re-Sign Its Top Stars,10/5/2019
2 Bargain Stocks You Can Buy Right Now: AMC & T,10/5/2019
Micron Technology’s Bad Days Are Here to Stay,10/5/2019
Between a Wi-Fi rock and a high-tech place: Expedia preaches connectivity and productivity in new Seattle HQ,10/5/2019
Should Mall REITs Fear the Forever 21 Bankruptcy?,10/5/2019
Marijuana Value Traps Do Exist: Here Are 3 to Avoid,10/5/2019
Is Plug Power a Buy?,10/5/2019
3 Reasons to Buy This Beaten-Down Tech Stock,10/5/2019
Intuit: Investor Day Adds To Confidence In Buy Case,10/5/2019
"GM-UAW Strike Nears Third Week, Costing Thousands Their Jobs And The Company Millions",10/5/2019
Where Is Harley-Davidson Going With Its New Accelerated Growth Plan?,10/5/2019
Pepsi's New Winning Formula: Cut The Sugar,10/5/2019
Meredith Corporation (MDP) Up 4.8% Since Last Earnings Report: Can It Continue?,10/5/2019
SAIC (SAIC) Down 6.5% Since Last Earnings Report: Can It Rebound?,10/5/2019
"Budweiser wants to take on China, the world's largest beer market where local brews rule",10/6/2019
Here's Why Sarepta Therapeutics Fell 16.5% in September,10/6/2019
Here's Why Tandem Diabetes Care Fell 18.6% in September,10/6/2019
Medifast: Excellent Track Record With Flawless Balance Sheet,10/6/2019
2 Stocks That Soared Last Week,10/6/2019
Why Oil Tanker Stocks Are the Hottest Spot in Energy Today,10/6/2019
3 Stocks That Have More Than Doubled in 2019,10/6/2019
Unilever says it wants to halve its use of 'virgin' plastic by 2025,10/6/2019
Why Marijuana Stock Cronos Group Plunged 18% in September,10/6/2019
HMS Makes Strategic Investment in MedAdvisor,10/6/2019
Taking A Stake In PayPal,10/6/2019
Here's Why U.S. Concrete Rose 36.4% in September,10/6/2019
GDX Is Headed For New Highs,10/6/2019
Why Coty Stock Gained 10.1% Last Month,10/6/2019
Buy Dollar General To Prepare For A Potential Recession,10/6/2019
Corporate Adoption Of Renewable Energy Bodes Well For This ETF,10/6/2019
"Notable Insider Buys In The Past Week: Immunomedics, Tenet Healthcare, Ulta Beauty",10/6/2019
Better Buy: Aurora Cannabis  vs. Canopy Growth,10/6/2019
Dan Nathan's Caterpillar Options Trade,10/6/2019
How And Why Are Online Brokers Offering Commission-Free Trades?,10/6/2019
Lakeland Bancorp Offering Attractive Dividend Yield With Price Upside,10/6/2019
"HSBC may cut 10,000 more jobs in cost-cutting move: report",10/6/2019
"A new smaller, cheaper iPhone could boost sales in early 2020, top Apple analyst Kuo predicts",10/6/2019
3 Top Oil Stocks to Buy in October,10/6/2019
"AbbVie-Allergan Merger - Don't Worry About Debt, AbbVie Is Still A Buy",10/6/2019
Canopy Growth Is a Buzzkill for Constellation Brands' Q2 Earnings,10/6/2019
2 Best Cannabis Stocks to Buy in October,10/6/2019
"HSBC to cut up to 10,000 jobs: FT",10/6/2019
These stocks could have the most to lose if a progressive Democratic agenda takes hold in 2020,10/6/2019
Why Amphenol Stock Climbed 10.2% Last Month,10/6/2019
JinkoSolar: The World's Top Solar Panel Manufacturer Has A Bright Future,10/6/2019
TiVo's New Monetization Scheme,10/6/2019
Why Varonis Systems Stock Fell 12.5% in September,10/6/2019
Bloom Energy Takes to the Seas With Samsung Heavy Industries,10/6/2019
These 2 High-Yield Stocks Are Teaming Up to Fuel Faster Growth,10/6/2019
Stocks This Week: Buy Adobe And Lam Research,10/6/2019
Comstock Fundamental Bulls Subdued By Bearish Natural Gas Price,10/6/2019
Wingstop: Promising But Not Convincing Enough,10/6/2019
Digimarc: Recent Roundtrip Plus Near Term Catalysts Equals Significant Opportunity,10/6/2019
3 Top U.S. Stocks to Watch in October,10/6/2019
Bayer says another U.S. glyphosate trial is delayed,10/6/2019
2 Stocks for the Coming 5G Smartphone Revolution,10/6/2019
Adding More General Dynamics On The Pullback,10/6/2019
Oxford Square: Don't Let This Past Quarter Fool You,10/6/2019
How Boeing vs. Airbus Became Trump vs. Europe,10/6/2019
"Will Activision Blizzard's ""Call of Duty Mobile"" Be a Hit?",10/6/2019
"Talks with GM have stalled, union says",10/6/2019
"Restaurants, Food Banks And Union Members Step Up To Feed Striking UAW Workers",10/6/2019
Why Instagram's New Snapchat Clone Is a Big Deal for Snap and Not a Big Deal for Facebook,10/6/2019
DISH Network Reaches Multi-Year Carriage Agreement With Fox In Time For NFL Sunday Football,10/6/2019
"Samsung warns its profit fell 56%, but the worst could be over",10/7/2019
Should Investors Care About the Not-So Quintessential iRobot Terra?,10/7/2019
Samsung's third-quarter profit estimate exceeds expectations on smartphone sales,10/7/2019
These 2 Stocks Were Mashed on Monday,10/7/2019
Why Michaels Stores' Stock Rose 73% Last Month,10/7/2019
Starbucks Stock Looks Like a Deal Right Now,10/7/2019
"Oracle to add 2,000 jobs as it expands cloud business: report",10/7/2019
"Oracle to hire 2,000 workers to expand cloud business to more countries",10/7/2019
Amazon launches bigger local online store in Singapore,10/7/2019
Some 40 state AGs plan to take part in Facebook probe,10/7/2019
Why Shares of Several Cloud Communications Experts Crashed Last Month,10/7/2019
Hong Kong drops its bid for the London Stock Exchange Group,10/7/2019
Asure Software to Sell Workspace Management Business to FM:Systems for $120 Million,10/7/2019
Rhythm Pharmaceuticals And Setmelanotide In Rare Obesity,10/7/2019
Hong Kong Exchanges drops $37 billion bid to buy London Stock Exchange,10/7/2019
Southwest Pilots Sue Boeing For Lost Wages From 737 MAX Grounding,10/7/2019
Gaia Spells Opportunity,10/7/2019
GlobalScape: This Is What Execution Looks Like,10/7/2019
Apple Is Ready to Burn Cash on its Streaming Service,10/7/2019
Here's Why Seattle Genetics Climbed 17.6% in September,10/7/2019
Laredo Petroleum: Too Cheap To Ignore,10/7/2019
WeWork's financing lifeline hinges on SoftBank talks,10/7/2019
"Samsung expects steep drop in Q3 profits, but it's better than feared",10/7/2019
Why Intelsat Stock Popped 10.3% in September,10/7/2019
"Samsung Electronics says third-quarter profit seen down 56%, beats expectations",10/7/2019
Why SS&C Technologies Stock Jumped 10.6% in September,10/7/2019
Here’s Why Emergent BioSolutions Stock Climbed 19.4% in September,10/7/2019
Samsung says its third-quarter profit likely fell 56% from a year earlier,10/7/2019
Here's Why Alder Biopharmaceuticals More Than Doubled in September,10/7/2019
RingCentral CEO talks Avaya deal with Jim Cramer,10/7/2019
Jim Cramer doubles down on Cedar Fair after Six Flags bid rejected,10/7/2019
Why Dropbox Stock Popped 12.7% in September,10/7/2019
MediciNova Receives Notice of Allowance for New Patent Covering MN-001 and MN-002 for the Treatment of Idiopathic Pulmonary Fibrosis in Japan,10/7/2019
Google and Olo Help Deliver Future of Restaurant Ordering,10/7/2019
Estee Lauder: A Secular Bet On Emerging Markets,10/7/2019
Investors who bailed on Costco's quarter made a costly mistake: Jim Cramer,10/7/2019
Nvidia (NVDA) Upgrade: Could Be Time To Buy,10/7/2019
Domino's (DPZ) Q3 Earnings Preview: What's in the Cards for the Pizza Giant?,10/7/2019
GM strike takes 'turn for the worse' as Union rejects latest offer,10/7/2019
"Facebook To Pay Advertisers $40 Million, Settling Hard Fought Class Action Lawsuit",10/7/2019
Tesla gets a boost after companies take a bet on electric semi trucks,10/7/2019
OMA reports a 6.2% increase in September 2019 passenger traffic,10/7/2019
GM Talks With UAW Take Turn for Worse,10/7/2019
"It's a turbulent time, but the US consumer is still 'quite strong,' Campbell Soup CEO says",10/7/2019
Southwest pilots sue over lost wages due to the 737 Max grounding,10/7/2019
"Heartland Express, Inc. Receives US EPA 2019 SmartWay Excellence Award",10/7/2019
Technician: One of year's best-performing sectors about to break down,10/7/2019
Nuveen Real Estate Buys $3 Billion US Industrial Portfolio From Blackstone,10/7/2019
Is Apple headed to new highs,10/7/2019
Best Buy: Holding The Brick And Mortar Fort,10/7/2019
Levi Strauss & Co. (LEVI) CEO Charles Bergh on Q3 2019 Results - Earnings Call Transcript,10/8/2019
Village Farms: A Greatly Undervalued Market Leader,10/8/2019
