AT,Atlantic Power Agrees to be Acquired by I Squared Capital,1
HCIC,"Hennessy Capital Investment Corp. V Announces Pricing of Upsized $300,000,000 Initial Public Offering",1
GLOG,"Why Oceaneering Intl., GasLog, Occidental, and Patterson-UTI Energy All Rallied Strongly Today",4
BOALY,Boral Class Action Reminder,1
HCCCU,Healthcare Capital Corp. Announces Pricing of Upsized $240 Million Initial Public Offering,1
CRSA,SHAREHOLDER ALERT: WeissLaw LLP Investigates Crescent Acquisition Corp,1
QLI,Qilian International Holding Group Limited Announces Closing of Initial Public Offering,1
SKT,Tanger Factory Outlets Reinstates Dividend; Yield Is 5.5%,1
DLR,Interxion: A Digital Realty Company Collaborates With PCCW Global To Deliver Submarine Cable Gateway To Europe,1
HEC,"SHAREHOLDER ALERT: Rigrodsky Law, P.A. Announces Investigation of Hudson Executive Investment Corp. Merger",1
SIG,"Signet's move into selling jewelry online yields strong holiday results, CEO says",1
JCTCF,Jewett-Cameron Is An Overlooked Pandemic Winner,1
PXD,"Pioneer Natural Resources Announces Pricing of Public Offering of $750.0 Million of 0.750% Senior Notes Due 2024, $750.0 Million of 1.125% Senior Notes Due 2026 and $1.0 Billion of 2.150% Senior Notes Due 2031",1
JNJ,"New strains of virus discovered in the U.S., J&J vaccine generates immune response",1
BKTPF,Cruz Cobalt Corporate Update,1
HON,Honeywell teams with North Carolina businesses to help accelerate Covid vaccine rollout,1
ISDSF,"iSIGN Media Announces Closing of the First Tranche of its Previously Announced Private Placement of up to $236,700",1
DECN,Pomerantz Law Firm Announces the Filing of a Class Action against Decision Diagnostics Corporation and Certain Officers - DECN,1
ZM,ZM Stock Price: $550 Target By BTIG,1
GM,GM to invest C$1 billion in Canada plant to manufacture electric vans,1
PEN,"Saxena White P.A. Files Securities Fraud Class Action Against Penumbra, Inc.",1
BTU,"PEABODY ENERGY INVESTIGATION INITIATED by Former Louisiana Attorney General: Kahn Swick & Foti, LLC Investigates the Officers and Directors of Peabody Energy Corp. - BTU",1
NOK,NOK Stock Price Increased By 6.25% This Past Week: Why It Happened,1
TLRY,TLRY Stock Price Increased 78.44% This Past Week: Why It Happened,1
C,"Bank earnings: JPMorgan, Citigroup, Wells Fargo kick off earnings season",3
AIV,Apartment Investment and Management Company Announces 2020 Dividend Income Tax Allocation,1
WBA,Walgreens Statement in Support of President-Elect Biden's COVID-19 Update,1
ALTA,Altabancorp (ALTA) Surges: Stock Moves 6.4% Higher,1
FFG,"SHAREHOLDER ALERT: Monteverde & Associates PC Announces an Investigation of FBL Financial Group, Inc. - FFG",1
YY,"DEADLINE ALERT: Bragar Eagel & Squire, P.C. Reminds Investors That a Class Action Lawsuit Has Been Filed Against JOYY, Inc. and Encourages Investors to Contact the Firm",1
BTU,"Peabody Announces Extended Early Tender Results Of Exchange Offer And Consent Solicitation, Further Extension Of Early Tender Date And Waiver And Satisfaction Of Minimum Tender Condition",1
MMM,3M Stock Is Unloved and Underpriced. Here's Why It Could Shoot Up Higher.,1
C,"Citigroup, Inc. (C) CEO Michael Corbat on Q4 2020 Results - Earnings Call Transcript",1
XOM,"The Dow Dropped Exxon Mobil in August. But as Oil Prices Rise, So Does Its Stock.",1
PRCH,"Porch Group boosts 2021 forecasts with new acquisitions, in wake of December SPAC deal",1
NWN,"NW Natural Holdings Schedules Earnings Release and Conference Call for Friday, February 26",1
TM,Toyota hit with a $180 million fine for Clean Air Act violations,1
MELI,MercadoLibre To Expand Electric Fleet After $1.1 Billion Bond Sale,1
AAPL,Jim Cramer: 5G now has momentum needed to invest in,3
HLAHU,"Hamilton Lane Alliance Holdings I, Inc. Announces Closing of Initial Public Offering and Full Exercise of Overallotment Option",1
COF,Credit card firm Capital One fined for violating U.S. anti-money laundering law,1
NULGF,NuLegacy Gold Reports Closing 100 Million Units PP,1
KBWY,Similar Shares Duel,4
CRNT,Why Ceragon Networks Stock Rocketed 54% Friday,1
ITGR,"Integer Schedules Fourth Quarter and Full-Year 2020 Earnings Release and Conference Call for February 18, 2021",1
LIACF,American Lithium Comments on Recent Promotional Activity,1
UPST,"All lending is heading toward the use of AI, online lending marketplace Upstart CEO says",1
TELL,Why Tellurian Blasted 25% Higher on Friday,1
PRCH,Porch Group CEO on developing a marketplace to connect consumers with home service providers,1
FCAU,"After long journey, Fiat Chrysler and PSA to seal merger to become Stellantis",3
HBORF,"Harborside Inc. Announces Departure of Chief Operating Officer, Greg Sutton",1
APHA,Why Marijuana Stock Aphria Climbed as High as 15% Today,1
CLSK,"The Law Offices of Frank R. Cruz Announces Investigation of CleanSpark, Inc. (CLSK) on Behalf of Investors",1
AMC,Why AMC Entertainment Stock Finished Higher Today,1
LAC,Lithium Americas Receives Record of Decision for Thacker Pass,1
COF,FinCEN Hits Capital One For $390 Million; Says Bank Violated Bank Secrecy Act,1
TSM,TSMC's Earnings Paints Bright Future For Chip Makers,1
FVRR,FIVERR INTL LTD (FVRR) Dips More Than Broader Markets: What You Should Know,1
VRTX,Vertex Pharmaceuticals (VRTX) Stock Moves -0.25%: What You Should Know,1
ZM,"Zoom Video Communications, Inc. (ZM) Gains As Market Dips: What You Should Know",1
BMY,Bristol-Myers Squibb (BMY) Gains As Market Dips: What You Should Know,1
TDOC,Teladoc (TDOC) Stock Moves -0.13%: What You Should Know,1
LMT,Lockheed Martin (LMT) Stock Moves -0.05%: What You Should Know,1
EDIT,Editas Medicine (EDIT) Gains As Market Dips: What You Should Know,1
NEE,NextEra Energy (NEE) Stock Moves -0.59%: What You Should Know,1
DOCU,DocuSign (DOCU) Stock Moves -0.39%: What You Should Know,1
MMM,3M (MMM) Stock Moves -0.52%: What You Should Know,1
YY,SHAREHOLDER ALERT: Pomerantz Law Firm Investigates Claims On Behalf of Investors of JOYY Inc. - YY,1
CRNT,CRNT Stock Price Increases 53.97%: Why It Happened,1
PCG,"Potential for Small, Targeted PSPS Event in Nine Counties: Forecasted Strong, Offshore Winds and Dry Conditions Mean PG&E May Need to Proactively Turn Off Power for Safety to Approximately 21,000 Customers Monday Night",1
QS,Quantumscape (QS): Jens Wiese Joins Board Of Directors,1
AVGR,AVGR Stock Price Increased 32.43%: Why It Happened,1
EXPE,Expedia's Vrbo hit with backlash for not following Airbnb's lead and canceling D.C. reservations,1
BNGO,"BNGO Stock Price Increases 1,552.94% Over The Past Month: Why It Happened",1
SFIX,Stitch Fix President On Booming Growth Amid Pandemic,1
FB,"Facebook to ban ads promoting weapon accessories, protective gear in U.S.",1
ATVI,Activision Blizzard shares are trading near an all-time high as video game sales continue to rise,1
SPLK,"Investor Reminder: Kessler Topaz Meltzer & Check, LLC Reminds Investors of Splunk Inc. of Fast Approaching Deadline",1
QS,"ROSEN, LEADING GLOBAL INVESTOR COUNSEL, Reminds QuantumScape Corporation Investors of Important March 8 Deadline in Securities Class Action; Encourages Investors with Losses in Excess of $100K to Contact Firm - QS",1
AAPL,Apple Tests Foldable Screen For iPhone: Bloomberg,1
AAL,Airline Industry's Top Lobbying Group Will Retain Its Republican Chief,5
OTGLF,"ROSEN, GLOBALLY RECOGNIZED INVESTOR COUNSEL, Reminds CD Projekt S.A. Investors of Important February 22 Deadline in Securities Class Action First Filed by the Firm; Encourages Investors with Losses in Excess of $100K to Contact Firm - OTGLY, OTGLF",2
CAG,Notable Insider Buys Of The Past Week: Conagra Brands Plus Plenty Of Biotech Activity,11
ANCTF,"Canada's Couche-Tard drops Carrefour takeover plan, companies say",2
SPLK,"ROSEN, A LEADING AND LONGSTANDING LAW FIRM, Reminds Splunk Inc. Investors of Important Deadline in Securities Class Action - SPLK",1
ANCTF,Alimentation Couche-Tard to Host Conference Call,1
ANCTF,Couche-Tard and Carrefour seek cooperation after takeover scrapped: BFM TV,2
ANCTF,Joint Announcement Between Alimentation Couche-Tard and Carrefour,2
SNANF,"ROSEN, A TOP RANKED LAW FIRM, Reminds Sona Nanotech Inc. Investors of Important February 16 Deadline in First Filed Securities Class Action Commenced by the Firm; Encourages Investors with Losses in Excess of $100K to Contact Firm - SNANF",1
WYNN,Wynn Resorts Gets Its WynnBET App Into Four More States,1
GM,GM To Begin Producing New Line Of Electric Commercial Vans This Year In Canada,1
PYPL,Analyst: PayPal Holdings Has 46% Upside Thanks to Bitcoin Surge,1
ACMR,"ROSEN, A TOP RANKED LAW FIRM, Reminds ACM Research, Inc. Investors of Important February 19 Deadline in Securities Class Action – ACMR",1
SWI,"ROSEN, LEADING AND LONGSTANDING INVESTOR COUNSEL, Reminds SolarWinds Corporation Investors of Important March 5 Deadline in First Filed Securities Class Action Commenced by the Firm; Encourages Investors with Losses in Excess of $100K to Contact Firm – SW",1
AAPL,The Only Tech Stock You Need to Buy in 2021,1
XOM,S.E.C. Probe Of Exxon Renews Focus On Company's Resistance To Write-downs,1
AAL,American Airlines and JetBlue Get DOT Clearance for Northeast Alliance,2
YY,"HAGENS BERMAN, NATIONAL TRIAL ATTORNEYS, Alerts JOYY (YY) Investors to January 19th Deadline in Securities Fraud Lawsuit, Investors with $250K+ Losses Should Contact Its Attorneys Now",1
UBER,Report: Uber Technologies to Spin Off Postmates Robot Delivery Unit,1
AIR,AAR (AIR) Up 10.3% Since Last Earnings Report: Can It Continue?,1
ACN,Accenture (ACN) Down 4.1% Since Last Earnings Report: Can It Rebound?,1
FDX,FedEx (FDX) Down 13.6% Since Last Earnings Report: Can It Rebound?,1
BB,Why Is BlackBerry (BB) Up 19.1% Since Last Earnings Report?,1
GIS,General Mills (GIS) Down 5.8% Since Last Earnings Report: Can It Rebound?,1
JBL,Jabil (JBL) Up 1.2% Since Last Earnings Report: Can It Continue?,1
NAV,Why Is Navistar (NAV) Down 0.5% Since Last Earnings Report?,1
RAD,Rite Aid (RAD) Down 9.1% Since Last Earnings Report: Can It Rebound?,1
SAFM,Sanderson Farms (SAFM) Down 7.3% Since Last Earnings Report: Can It Rebound?,1
QSR,"Rosen, Globally Recognized Investor Counsel, Reminds Restaurant Brands International Inc. Investors of Important February 19 Deadline in Securities Class Action; Encourages Investors with Losses in Excess of $100K to Contact the Firm - QSR",1
AAPL,Apple Reportedly Considering iPhone With Foldable Screen,1
MFC,"Manulife: With A Dividend Yield Of 4.6%, The Common Shares Are Now Very Appealing",1
KNDI,"Rosen, A Top Ranked Law Firm, Reminds Kandi Technologies Group, Inc. Investors of Important Deadline in Securities Class Action; Encourages Investors with Losses in Excess of $100K to Contact Firm - KNDI",1
ENS,EnerSys: Protecting The Free Cash Flows During The Pandemic,1
LMND,"Short Seller Andrew Left Goes Sour On Lemonade, Says Company Lies To Shareholders",1
BIP,3 of the Best Dividend Stocks to Buy in 2021,3
TOGL,"Toga Limited Unveils Yippi X, New Mobile Apps and Partnerships at the Inaugural ASEAN New Tech Conference",1
NSRGY,"Nestle recalls more than 760,000 pounds of Hot Pockets because they might contain bits of plastic and glass",1
DGRO,The Best ETFs For Dividend Investors: 1-Year Review,18
HTBK,Heritage Commerce Corp.: Reliable Rising Dividends,1
GOOD,Gladstone Commercial: Preferreds Offer More Attractive Risk-Adjusted Return Than Common Shares,1
MO,Altria: Reasons To Buy And Reasons To Avoid,1
TSLA,Tesla says starts delivering Shanghai-made Model Y in China,1
BNO,Oil drops 1% as rising coronavirus cases end supply-led rally,10
PTON,Delivery Delays Of 3 Months Or More Hamper Peloton,1
SENS,Senseonics Holdings Announces $50.0 Million Registered Direct Offering of Common Stock,1
UBS,UBS Eyes $400 Million Investment In India's Paytm,1
XITK,"XITK: Innovation Growth Fund, Strong High-Growth Holdings, Market-Beating Shareholder Returns",1
MIELY,Mitsubishi Electric and Tokyo Tech Develop Blockchain Technology to Optimize P2P Energy Trading,1
JPM,JPMorgan Provides $100 Million Financing Facility To Figure For Mortgage Lending,1
TRP,Keystone XL commits to become first pipeline to be fully powered by renewable energy,1
CII,CII: Discounted And Attractive ~6% Yield,1
UNFI,United Natural Foods' Pension Problems: Not As Significant As You Think,1
TSCRF,Score Media: Scoring The Canadian Opportunity,1
HLT,Hilton Worldwide Holdings: Showing Resilience In A Tough Environment,1
PCG,"As Major Offshore Windstorm Approaches, PG&E Prepares for Potential Widespread, Wind-Driven Outages Throughout Its Service Area and Potential for Targeted Public Safety Power Shutoffs in Small Portions of the Driest Locations",1
GEBRF,Greenbriar Provides Montalva Update,1
JCPNQ,J.C. Penney Is Searching For Its Next CEO. Here's What The Board Should Be Shopping For,1
SRNE,SRNE Stock Price: $30 Target From H.C. Wainwright,1
MO,Altria Is The Anti-Tesla,1
EQBK,"Equity Bancshares, Inc. Will Announce Fourth Quarter 2020 Results on January 25, 2021",1
BGNE,Week In Review: BeiGene Signs $2.2 Billion Deal With Novartis For PD-1,2
HHC,Howard Hughes: Bill Ackman Is Buying And I Am Too,1
AMNF,Armanino Foods: A True Cash Cow,1
MGNI,Magnite: A Second Chance At Investing In A High Growth Industry,1
DRVN,DRVN Stock Price Climbs 21.32% In Public Debut,1
ELVT,Elevate Credit: Time To Elevate This Fintech In Your Portfolio,1
ZM,Zoom Stock (ZM) Reversal Triggers Trading Buy Signal,1
XOM,In ExxonMobil's Defense,1
AAPL,Apple's Tim Cook On Taking Down Parler: 'We're always trying to do the right thing',1
BXP,Boston Properties Was Built For A Pre-COVID-19 World,1
GOOG,Google disputes Texas' suit claiming unfair advertising sales practices,2
AAXN,Axon: Ride The Lightning,1
COST,Retail Series: Costco Still Has Long Growth Runway,1
NAT,"Nordic American Tankers: Good Dividends For An Oil Tanker Company, But That's Not Saying Much",1
SAN,"Banco Santander: Dividend Green Light, But Shares At Fair Value",1
TROW,T. Rowe Price: A Steady Hand In A Changing Sector,1
CVS,CVS: Don't Invest Using The Rearview Mirror,1
BP,Has Prince Charles' Nature Pledge Become A Platform For BP To Greenwash Oil Spills?,1
FLXN,Flexion Therapeutics: Fighting Through COVID-19 Headwinds,1
XOM,Exxon Mobil: Starting 2021 On (Almost) The Right Track,1
QS,"Kessler Topaz Meltzer & Check, LLP: Securities Fraud Class Action Filed Against QuantumScape Corporation (NYSE: QS)",1
CLDX,"Celldex: New Monoclonal Therapeutic Line, 1Q21's CDX-0159's Initial Trial Data, And More",1
FCAU,The new name and governance of Stellantis take effect,1
DMLP,Dorchester Minerals: A Warren Buffett Investment,1
IMAX,IMAX CEO discusses streaming competition and how the coronavirus impacted going to movies,1
QIWI,"ROSEN, TRUSTED INVESTOR COUNSEL, Reminds Qiwi plc Investors of Important February 9 Deadline in First Filed Securities Class Action Commenced by the Firm; Encourages Investors with Losses in Excess of $100K to Contact the Firm - QIWI",1
ZS,Zscaler: Will Remain An Industry Leader For Much Of This Decade; Buy Shares Opportunistically,1
TRIT,Triterras Authorizes $50 Million Share Repurchase Program and Provides Update on Recent Events,1
BNTX,Cuomo Asks Pfizer To Let New York Purchase COVID-19 Vaccine Directly,2
MSA,Letting Your Winners Run: A Dividend Growth Investor's Perspective,1
SRRTF,Slate Grocery REIT: Buy Its Dividend Yield Of ~9%,1
ARKF,It Doesn't Really Matter Which ARK ETF You Buy,5
TTCF,Tattooed Chef: Plant-Based Trends Favor This Company,1
PRPH,ProPhase Labs Announces Pricing of Public Offering of Common Stock,1
BNTX,Biden Covid advisor challenges Cuomo's letter to buy vaccine directly from Pfizer,2
NVAX,Novavax: Parsing Through Insider Sales,1
LOGI,Logitech reports 192% jump in quarterly operating income,1
TSLA,Tesla Begins Model Y SUV Deliveries in China: What You Need To Know,1
BNO,Brent crude edges up as optimism over economy trumps demand concerns,10
SSNLF,Samsung Electronics: Trading Price For Volume With The Galaxy S21,1
PEN,"PENUMBRA ALERT: Bragar Eagel & Squire, P.C. Announces That a Class Action Lawsuit Has Been Filed Against Penumbra, Inc. and Encourages Investors to Contact the Firm",1
BTBT,"BIT DIGITAL ALERT: Bragar Eagel & Squire, P.C. is Investigating Bit Digital, Inc. on Behalf of Bit Digital Stockholders and Encourages Investors to Contact the Firm",1
CBAT,"CBAK ENERGY TECHNOLOGY ALERT: Bragar Eagel & Squire, P.C. is Investigating CBAK Energy Technology, Inc. on Behalf of CBAK Stockholders and Encourages Investors to Contact the Firm",1
LOGI,"Logitech's Q3 Sales Grow 85%, Operating Income Triples",1
BNTX,"Cuomo asked Pfizer to sell its COVID-19 vaccine directly to New York, just as the head of the WHO warns of mounting inequities in vaccine distribution",2
FB,Facebook asks to appeal court ruling that it conducts business in Australia,1
FBIO,"Rosen, Leading Trial Attorneys, Reminds Fortress Biotech, Inc. Investors of Important January 26 Deadline in Securities Class Action - FBIO",1
LQD,LQD's Risk Profile Has Not Changed,1
SBUX,Washington State Partners With Starbucks For Vaccine Distribution,1
PCG,"As Offshore Windstorm Sweeps Through State, PG&E Manages Related Outages Throughout Service Area and Prepares to Execute a Targeted Public Safety Power Shutoff Later Tonight in Small Portions of Driest Locations",1
GTMAY,Vanessa Serrano Cuevas Acquires Shares by Donation,1
ALDX,"Aldeyra: Reproxalap's Phase 3 Clinical Results, Expected ~75% Sales CAGR, And More",1
SPLK,"ROSEN, GLOBAL INVESTOR COUNSEL, Reminds Splunk Inc. Investors of Important Deadline in Securities Class Action - SPLK",1
PEN,"Rosen, A Leading and Top Ranked Law Firm, Continues to Investigate Securities Claims Against Penumbra, Inc. - PEN",1
GTT,"ROSEN, A TOP RANKED LAW FIRM, Reminds GTT Communications, Inc. Investors of Important Deadline in Securities Class Action First Filed by Firm; Encourages Investors with Losses in Excess of $100K to Contact Firm - GTT",1
BKRRF,Blackrock Announces Award of Restricted Share Units,1
CRM,Salesforce leads $15M investment round in Indian HR tech platform Darwinbox,1
FRERF,Fremont Amends Terms for Griffon Gold Project,1
SMICY,"Rosen, Global Investor Counsel, Reminds Semiconductor Manufacturing International Corporation Investors of Important Deadline in Securities Class Action First Filed by the Firm - SMICY",1
BNGO,Day Five of Bionano's Next-Generation Cytogenomics Symposium: Saphyr Identifies Structural Variants that May Predispose to Severe COVID-19 Illness,1
ACMR,"ROSEN, RESPECTED INVESTOR COUNSEL, Reminds ACM Research, Inc. Investors of Important February 19 Deadline in Securities Class Action; Encourages Investors with Losses in Excess of $100K to Contact the Firm - ACMR",1
SWBI,"Is Smith & Wesson Brands, Inc. (SWBI) Stock Undervalued Right Now? (Revised)",1
PVG,Pretium Resources: A Welcome And Overdue Beat On Guidance,1
HAL,Halliburton shares continue to trade above $20 support although analysts expect weak Q4 results,1
IFNNY,"Infineon Debuts Employee ID, Mastercard Payment Card",1
BRY,"BRY Final Deadline Notice: Rosen, A Leading Law Firm, Reminds Berry Corporation Investors of Important January 21 Deadline in Securities Class Action - BRY",1
FB,"U.S. asks Australia to scrap proposed laws to make Facebook, Google pay for news",3
KNDI,"ROSEN, GLOBAL INVESTOR COUNSEL, Reminds Kandi Technologies Group, Inc. Investors of Important Deadline in Securities Class Action – KNDI",1
SLTTF,Slate Office REIT Announces Distribution for the Month of January 2021,1
MNOV,MediciNova Receives Notice of Allowance for New Patent Covering the Combination of MN-166 (ibudilast) and Riluzole for the Treatment of Amyotrophic Lateral Sclerosis (ALS) in Japan,1
FRHLF,Freehold Royalties Ltd. Announces New President and Chief Executive Officer,1
BDRBF,Bombardier's joint venture to provide maintenance service for 280 high-speed train cars in China,1
CE,Celanese Announces Engineered Materials Price Increases,1
SNOA,"ROSEN, GLOBAL INVESTOR COUNSEL, Continues To Investigate Securities Claims Against Sonoma Pharmaceuticals, Inc. - SNOA",1
OTGLF,"Rosen, A Leading Investor Rights Law Firm, Reminds CD Projekt S.A. Investors of Important Deadline in Securities Class Action First Filed by the Firm; Encourages Investors with Losses in Excess of $100K to Contact Firm - OTGLY, OTGLF",2
OMZNF,Osisko Metals Grants Stock Options,1
BIDU,3 Electric Vehicle Stocks to Look Out for in 2021,3
HSBC,"HSBC Chairman Tucker on ESG, Bank's Green Goals",1
BABA,Alibaba founder Jack Ma reappears for the first time since crackdown on his tech empire,1
AMC,Why AMC Shares Spiked 40% Today,1
GOOG,"Google says it is investigating an AI ethicist who for sharing sensitive documents, amid bristling tensions between employees and leadership (GOOGL)",2
BABA,Alibaba's Jack Ma makes first public appearance since October in online meeting: state media,1
SSYS,Why Stratasys Stock Popped 12.5% Today,1
FB,India ministry reportedly asked WhatsApp to drop privacy policy changes that sparked backlash,1
NFLX,"Netflix, Inc. (NFLX) on Q4 2020 Results - Earnings Call Transcript",1
EBAY,eBay May Be Prepping Korean Subsidiary For Sale,1
SYRS,Syros Announces Pricing of $75.6 Million Public Offering of Common Stock,1
FULC,Fulcrum Therapeutics Announces Pricing of Public Offering of Common Stock,1
WMK,Michael T. Lockard To Become Weis Markets' Senior Vice President And Chief Financial Officer,1
CRON,1 Big Problem With Canadian Marijuana Stocks,1
SENS,Why Senseonics Shares Spiked 87% Today,1
TCRR,TCR² Therapeutics Announces Pricing of Public Offering of $140.0 Million of Common Stock,1
JBHT,"J.B. Hunt Transport Services, Inc. (JBHT) CEO John Roberts on Q4 2020 Results - Earnings Call Transcript",1
STX,Japan's Nidec files HDD patent infringement suit against Seagate,1
TCNNF,My Best Medical Marijuana Stock for 2021,1
BLRX,BioLineRx Increases Previously Announced Bought Deal Offering to $30 Million,1
PCG,"PG&E Crews Out in Force Making Repairs After Offshore Windstorm Sweeps Through State, Causing Wind Hazards and Related Outages",1
LEGOU,"Legato Merger Corp. Announces Pricing of Upsized $205,000,000 Initial Public Offering",1
XOP,"Oil and Gas ETF (XOP) Hits Price Target, Watch For Pullback",1
VWAGY,"Volkswagen says China car sales, production hit by chip supply shortage",1
NFLX,MarketWatch First Take: Netflix removes one long-standing cloud for investors,1
GEVO,Why Gevo Shares Surged Another 72% Today,1
BNO,Oil extends gains on hopes of U.S. stimulus and crude stocks drawdown,10
GELYY,Tencent teams up with Chinese automaker Geely on driverless and smart car tech,2
NFLX,"Netflix's Core Businesses May Not Be Sustainable, Says Tru Optik CEO",1
JBHT,J.B. Hunt warns intermodal margin target may be reduced,1
GDRX,"GDRX FEB 9 DEADLINE: Pawar Law Group Announces a Securities Class Action Lawsuit Against GoodRx Holdings, Inc.– GDRX",1
KRBP,"Kiromic Announces the Completion of its GMP Manufacturing Facility in Houston, Texas, to Support the Manufacturing of the First In-Human Allogenic CAR-T Trial",1
AUDVF,Audi aims to sell one million cars in China in 2023,1
DSS,"Document Security Systems, Inc. Prices $24.0 Million Upsized Public Offering of Common Stock",1
GSAT,Globalstar: Shares Finally Break Out Of Consolidation,1
NEVDF,Nevada Copper: Emerging Copper Producer With High Leverage To Copper Prices,1
F,Mexico 'flirting' with Ford after U.S. carmaker bails on Brazil,1
DIS,Netflix Execs React To Disney's Streaming Momentum: “Super-Impressive” But No ‘Bridgertons' In Forecast,2
BEP,Why Solar Energy Stocks Jumped on Tuesday,4
OSB,West Fraser and Norbord Announce Shareholder Approval of West Fraser's Acquisition of Norbord and Joint Earnings Call on 2020 West Fraser and Norbord Standalone Results,1
PSB,"PS Business Parks, Inc. Announces Tax Treatment of 2020 Dividends",1
PSA,Public Storage Announces Tax Treatment of 2020 Dividends,1
UNIT,CORRECTION - Uniti Group Inc. Announces Pricing and Upsizing of Senior Notes Offering,1
KBWY,Rare 16% Discount To Book Remains,4
SENS,Why Senseonics Stock Skyrocketed 80% Today,1
REG,Regency Centers: Grocery-Anchored Retail Is The Way To Go,1
DIS,Disney cuts bonuses for top executives in pandemic fallout,1
CAGDF,Centerra Gold Completes Sale of 50% Interest in the Greenstone Gold Mines Partnership,1
NKE,"Cramer opines on Disney, Nike, Union Pacific and more recovery stocks",3
LOGI,"Logitech CEO discusses plans to address climate change, provide carbon transparency",1
PCAR,PACCAR and Aurora to build autonomous trucks,1
AXP,SHAREHOLDER ALERT: Pomerantz Law Firm Investigates Claims On Behalf of Investors of American Express Company - AXP,1
EVT,"EVT: A Diversified Equity Portfolio With Opportunity, Providing Strong Income",1
BLK,BlackRock to add bitcoin as eligible investment to two funds,1
CTVA,"Starboard seeks to take control of Corteva board, oust CEO: WSJ",1
TGT,Retail Series: Target Will Continue Benefiting From Mall Closures For Years,1
NFLX,"Netflix adds 8.5M users in Q4, blowing away estimates",1
SRNE,"Sorrento Therapeutics, Inc. (SRNE) CEO Henry Ji Presents at B. Riley Virtual Oncology Conference (Transcript)",1
BSX,SHAREHOLDER ALERT; Pomerantz Law Firm Reminds Shareholders with Losses on their Investment in Boston Scientific Corporation of Class Action Lawsuit and Upcoming Deadline - BSX,1
FBIO,"SHAREHOLDER ALERT: Pomerantz Law Firm Reminds Shareholders with Losses on their Investment in Fortress Biotech, Inc. of Class Action Lawsuit and Upcoming Deadline - FBIO",1
NFLX,Netflix To Rollout 'Shuffle Play' Feature Around The World In Coming Months,1
BTBT,"BTBT CLASS ACTION NOTICE: Glancy Prongay & Murray LLP Files Securities Fraud Lawsuit Against Bit Digital, Inc.",1
KMI,"Kinder Morgan, Inc. (KMI) CEO Steve Kean on Q4 2020 Results - Earnings Call Transcript",1
CYRX,Cryoport Announces Pricing of Public Offering of Common Stock,1
LIZI,"LIZI EQUITY ALERT: ROSEN, GLOBAL INVESTOR COUNSEL, Files Securities Class Action Lawsuit Against Lizhi Inc.; Encourages Investors with Losses in Excess of $50K to Contact Firm – LIZI",1
BBEU,Tradeweb Exchange-Traded Funds Update - December 2020,10
