RCL,"ROSEN, TRUSTED AND LEADING INVESTOR COUNSEL, Reminds Royal Caribbean Cruises Ltd. Investors of Important December 7 Deadline in Securities Class Action; Encourages Investors with Losses in Excess of $100K to Contact Firm - RCL",1
JPM,"ROSEN, GLOBAL INVESTOR COUNSEL, Reminds JPMorgan Chase & Co. Investors of Important December 23 Deadline in First Filed Securities Class Action Commenced by the Firm; Encourages Investors with Losses in Excess of $100K to Contact the Firm - JPM",1
EOLS,"ROSEN, GLOBAL INVESTOR COUNSEL, Reminds Evolus, Inc. Investors of Important December 15 Deadline in Securities Class Action; Encourages Investors with Losses in Excess of $100K to Contact the Firm - EOLS",1
HPE,Hewlett Packard Enterprise Company's (HPE) CEO Antonio Neri on Q4 2020 Results - Earnings Call Transcript,1
BB,"BlackBerry to Host Investor Fireside Chat to Discuss New Intelligent Vehicle Data Platform, BlackBerry IVY",1
BABA,Alibaba Nears Deal To Sell Entire Stake In Online Grocer BigBasket To Tata: Report,1
HYMTF,Hyundai Motor to launch dedicated EV platform in major push into electric cars,1
LORL,Loral-Telesat Merger Creates Attractive Call Option On LEO Economics,1
SBH,"Sally Beauty Holdings, Inc. Announces Participation at the Morgan Stanley Virtual Global Consumer and Retail Conference",1
SFTBY,SoftBank winding down options trading after investor backlash: Bloomberg News,1
NTGR,Buy Netgear After Stock's Brief Downtrend Ends,1
METX,Meten EdtechX announces management investment in its Likeshuo online business and expansion of option pool,1
TLRD,Fashion retailer Tailored Brands emerges from bankruptcy protection,1
CRM,"salesforce.com, inc. (CRM) CEO Marc Benioff on Q3 2021 Results - Earnings Call Transcript",1
ALT,Altimmune: A COVID-19 Winner After All,1
AAPL,Apple Sued For $200M In EU Over Allegations It Deliberately Slowed Down iPhones To Mask Battery Issues,1
BOX,"Box, Inc. (BOX) CEO Aaron Levie on Q3 2021 Results - Earnings Call Transcript",1
NTAP,"NetApp, Inc. (NTAP) CEO George Kurian on Q2 2021 Results - Earnings Call Transcript",1
COGT,Cogent Biosciences Announces Pricing of Upsized Public Offering of Shares of Common Stock,1
BGNE,BeiGene Announces Pricing of Public Offering by Selling Shareholders,1
ORCC,Owl Rock Capital Corporation Prices Public Offering of $1.0 Billion 3.400% Notes Due 2026,1
BSFFF,Basic-Fit: A Risky Bet On An Unexpected Beneficiary From COVID-19,1
DIS,"Disney Highlights Original Content Push For Disney+, Hulu As It Consolidates TV Studios",1
LI,Li Auto Inc. November 2020 Delivery Update,1
GPRO,"GoPro, Inc. (GPRO) Management Presents at Wells Fargo 2020 Virtual TMT Summit Conference (Transcript)",1
DBX,"Dropbox, Inc (DBX) Management Presents at NASDAQ 43rd Virtual Investor Conference (Transcript)",1
SWBI,Smith & Wesson: Winning During Pandemic And After Spinoff,1
PANW,"Palo Alto Networks, Inc. (PANW) CEO Nikesh Arora Presents at Wells Fargo Technology, Media, & Telecommunications Summit 2020 Conference (Transcript)",2
SOL,ReneSola Ltd (SOL) CEO Yumin Liu on Q3 2020 Results - Earnings Call Transcript,1
TLRD,Tailored Brands Successfully Completes Financial Restructuring,1
COP,U.S. oil producer ConocoPhillips to shed up to 500 workers,1
ZM,CORRECTION – Zoom Reports Results for Third Quarter Fiscal Year 2021,1
BA,Why Boeing Shares Gained Altitude in November,1
PINS,"ROSEN, TRUSTED INVESTOR COUNSEL, Announces Filing of Securities Class Action Lawsuit Against Pinterest, Inc.; Encourages Investors with Losses in Excess of $100K to Contact the Firm - PINS",1
LRN,"ROSEN, TRUSTED INVESTOR COUNSEL, Reminds K12 Inc. Investors of Important Deadline in Securities Class Action; Encourages Investors with Losses in Excess of $100K to Contact Firm - LRN",1
PLTR,Why Shares of Palantir Technologies Soared Higher in November,1
YY,"ROSEN, A TRUSTED LAW FIRM, Reminds JOYY Inc. Investors of Important Deadline in Securities Class Action First Filed by the Firm; Encourages Investors with Losses in Excess of $100K to Contact the Firm - YY",1
FAF,"ROSEN, TRUSTED INVESTOR COUNSEL, Reminds First American Financial Corp. Investors of Important Deadline in Securities Class Action First Filed by the Firm - FAF",1
CRM,Salesforce CEO: Buying Slack Is 'Marriage Made in Heaven',2
APPN,Why Appian Stock Soared in November,1
JBLU,JetBlue Announces Pricing of Common Stock Offering,1
TCMD,"SHAREHOLDER ACTION ALERT: The Schall Law Firm Announces it is Investigating Claims Against Tactile Systems Technology, Inc. and Encourages Investors with Losses to Contact the Firm",1
RETA,"Reata Pharmaceuticals, Inc. Announces Pricing of Class A Common Stock Offering",1
ALNA,Allena Pharmaceuticals Increases Previously Announced Bought Deal to $13.0 Million,1
ARNA,"Arena Pharmaceuticals, Inc. (ARNA) CEO Amit Munshi Presents at 3rd Annual Evercore ISI HealthCONx Conference (Transcript)",2
IBM,International Business Machines Corporation (IBM) Management Presents at Credit Suisse 24th Annual Technology Virtual Conference (Transcript),1
REXR,Rexford Industrial Announces Pricing of Common Stock Offering,1
FSLY,"Fastly, Inc. (FSLY) Presents at 2020 Wells Fargo TMT Summit Conference (Transcript)",1
NFLX,Netflix Plans to Double Spending on Original Content in Asia,1
JD,JD Health IPO Raises $3.5 Billion in Hong Kong,1
RY,Royal Bank of Canada (RY) CEO Dave McKay on Q4 2020 Results - Earnings Call Transcript,1
SBUX,Starbucks To Provide Free Coffee To COVID-19 First Responders This Holiday Season,1
PROG,"Progenity, Inc. Prices $75.0 Million Convertible Senior Notes Offering",1
PROG,Progenity Announces Pricing of Public Offering of Common Stock,1
GOOG,"U.S. Labor Board accuses Google of spying on employees, discouraging worker organization, and retaliation",2
EGRNF,"SC Lowy CEO on China Evergrande, Bid for Dewan Housing",1
SFIX,Stitch Fix: Back To Normal,1
JPM,JPMorgan Chase To Buy Boston FinTech 55ip,1
DRSK,Aptus Defined Risk ETF - Not Your Run-Of-The-Mill Bond ETF Offering,1
VNT,Vontier Corporation: 12% FCF Yielder With Multiple Expansion Upside,2
SNOW,Snowflake Inc. (SNOW) CEO Frank Slootman on Q3 2021 Results - Earnings Call Transcript,1
SMTC,Semtech Corporation (SMTC) CEO Mohan Maheswaran on Q3 2021 Results - Earnings Call Transcript,1
CDXS,Codexis Announces Pricing of Public Offering of Common Stock,1
OFC,Corporate Office Properties: Safe 4.2% Yield From Government-Related Tenants,1
GOOG,"Google Violated US Labor Laws By Spying On Workers, Regulator Alleges",2
FIVE,"Five Below, Inc. (FIVE) CEO Joel Anderson on Q3 2020 Results - Earnings Call Transcript",1
KNTNF,K92 Mining to Receive the Prestigious Thayer Lindsley Award for Best Global Discovery,1
KMF,"Kayne Anderson NextGen Energy & Infrastructure Provides Unaudited Balance Sheet Information and Announces its Net Asset Value and Asset Coverage Ratios at November 30, 2020",1
KYN,"Kayne Anderson Energy Infrastructure Fund Provides Unaudited Balance Sheet Information and Announces its Net Asset Value and Asset Coverage Ratios at November 30, 2020",1
COP,Oil Stocks: Buy for 2021?,5
CRWD,"CrowdStrike Holdings, Inc. (CRWD) CEO George Kurtz on Q3 2021 Results - Earnings Call Transcript",1
SPLK,Splunk Inc. (SPLK) CEO Douglas Merritt on Q3 2021 Results - Earnings Call Transcript,1
BGFV,Big 5 Sporting Goods Corp.: Record Margins Support Earnings Momentum,1
CLGX,"CORRECTING and REPLACING GRAPHIC Gaining Momentum: Annual U.S. Home Prices Appreciated 7.3% in October, CoreLogic Reports",1
SNPS,"Synopsys, Inc. (SNPS) Q4 2020 Results - Earnings Call Transcript",1
ESTC,Elastic N.V. (ESTC) CEO Shay Banon on Q2 2021 Results - Earnings Call Transcript,1
OKTA,"Okta, Inc. (OKTA) CEO Todd McKinnon on Q3 2021 Results - Earnings Call Transcript",1
DYFSF,dynaCERT Inc. to Webcast Live at VirtualInvestorConferences.com December 3rd 2020,1
KNTE,Kinnate Biopharma Announces Pricing of Initial Public Offering,1
GES,"Guess?, Inc. (GES) CEO Carlos Alberini on Q3 2021 Results - Earnings Call Transcript",1
BABA,"US Congress Clears Bill That Threatens To Delist Chinese Titans Like Alibaba, Pinduoduo, Nio Over Audit Compliance",3
XP,XP Inc. Announces Pricing of Public Follow-On Offering,1
WORK,"SHAREHOLDER ALERT: WeissLaw LLP Investigates Slack Technologies, Inc.",1
AER,AerCap: Potential Capital Structure Arbitrage Opportunity,1
SPWH,Sportsman's Warehouse Holdings' (SPWH) CEO Jon Barker on Q3 2020 Results - Earnings Call Transcript,1
BNO,Oil drops as OPEC+ resume talks on output cut extension after impasse,10
COST,Costco logs more than $42B in quarterly sales,1
TJX,"The TJX Companies, Inc. Announces Early Tender Results and Upsize of Its Cash Tender Offers for Certain Debt Securities",1
CDMO,Avid Bioservices' (CDMO) CEO Nick Green on Q2 2021 Results - Earnings Call Transcript,2
FLO,"Flowers Foods Issues Voluntary Recall Of Two Canyon Bakehouse Products Distributed In Arkansas, Colorado, Kansas, Louisiana, Mississippi, Missouri, Montana, Nebraska, New Mexico, Oklahoma, South Dakota, Texas, Utah, And Wyoming Due To Possible Presence Of Gluten",1
ADP,Automatic Data Processing: Increased Dividend Income For 46 Years,1
ZIOP,Glass Lewis Recommends Ziopharm Shareholders Vote on the WHITE Consent Card for All of WaterMill's Director Candidates and Proposals,1
ARCE,Arco Platform Limited Closes the Acquisition of Escola da Inteligência,1
OM,Outset Medical Announces Pricing of Secondary Public Offering,1
OTEX,Open Text: Still Attractive,1
TWST,Twist Bioscience Announces Pricing of a $300 Million Upsized Public Offering of Common Stock,1
AMT,FFO Growth Machines: Tech REITs,10
WDAY,"Workday, Inc. (WDAY) Management Presents at Wells Fargo TMT Conference (Transcript)",1
GOOG,"Google broke labor law by retaliating against workers, federal agency alleges",2
TXRH,A Primer On Texas Roadhouse: A Worthy Buy With 33% Upside,1
COO,"The Cooper Companies, Inc. (COO) CEO Al White on Q4 2020 Results - Earnings Call Transcript",1
ENB,Enbridge: Still Only Priced For Zero Dividend Growth,1
SEER,Seer Announces Pricing of Initial Public Offering,1
DADA,Dada Now Partners with Cake Chain Brands across China to Enhance Delivery Process,1
ZUO,"Zuora, Inc. (ZUO) CEO Tien Tzuo on Q3 2021 Results - Earnings Call Transcript",1
SBTX,"Silverback Therapeutics prices IPO at $21/share, will raise $241M in 4th Wash. state IPO of 2020",1
SAIC,Science Applications International Corp (SAIC) CEO Nazzic Keene on Q3 2021 Results - Earnings Call Transcript,1
SWBI,"Smith & Wesson Brands, Inc. (SWBI) CEO Mark Smith on Q2 2021 Results - Earnings Call Transcript",1
FEAC,Skillz: Larger Opportunity Than I Thought,1
GIS,General Mills: Stable Performer,1
TSLA,"Tesla Remains Only Automaker To Grow In Germany Through November, With 37% Rise In Registrations",1
SAFT,Safety Insurance Group: A Tried And True Income Stock,1
XOM,Exxon's Moves To Focus On Core Businesses Make It A Holiday Gift For Your Portfolio,1
OLLI,"Ollie's Bargain Outlet Holdings, Inc. (OLLI) CEO John Swygert on Q3 2020 Results - Earnings Call Transcript",1
ULTA,"Ulta Beauty, Inc.'s (ULTA) CEO Mary Dillon on Q3 2020 Results - Earnings Call Transcript",1
SBTX,Silverback Therapeutics Announces Pricing of Initial Public Offering,1
MRNA,Moderna Says It Will Ship 100M-125M COVID-19 Vaccine Doses Worldwide In Q1,1
LIQT,LiqTech International Inc.: Pounding The Table As O&G Takes Shape Plus Black Carbon And NOx Opportunities Are Ahead Of Plan,1
WDR,"SHAREHOLDER ALERT: WeissLaw LLP Investigates Waddell & Reed Financial, Inc.",1
COF,Capital One Replaces Its CFO,1
FTCH,Why Farfetch Stock Jumped 94% Last Month,1
GMHI,"LAZR Stock Price Increases 27.67% In Debut, Makes 25-Year-Old Austin Russell Youngest Billionaire",3
MRVL,Marvell Technology Group Ltd. (MRVL) CEO Matt Murphy on Q3 2021 Results - Earnings Call Transcript,1
ATGN,"Altigen Communications, Inc. (ATGN) CEO Jerry Fleming on Q4 2020 Results - Earnings Call Transcript",1
PTON,Don't Be Fooled Into Selling the Big Winners of 2021,5
STX,Seagate Announces Pricing of $1 Billion of Senior Unsecured Notes,1
NNOX,Why Nano-X Imaging Jumped 122% in November,1
SWBI,Smith & Wesson Brands Crushes Q2 Estimates; New Dividend Declared,1
AMC,Movies theaters suffer devastating blow as Warner Bros announces streaming plans with HBOMax,5
MDLZ,"Mondelez International, Inc. (MDLZ) CEO Dirk Van de Put Presents at Morgan Stanley Virtual Global Consumer & Retail Conference (Transcript)",2
AMCX,"AMC Networks Aligns Cable Network WE TV With Streaming Service UMC, Ups Brett Dismuke To GM Of Both",1
YEXT,"Yext, Inc. (YEXT) CEO Howard Lerman on Q3 2021 Results - Earnings Call Transcript",1
AMZN,"Amazon.com Poised to Fly 25% Higher, Says Analyst",1
PFE,Pfizer Cuts 2020 Vaccine Rollout Target,1
YY,RM LAW Announces Class Action Lawsuit Against JOYY Inc.,1
BA,RyanAir to order 75 737Max planes from Boeing,2
DYFSF,dynaCERT Announces Voting Results of Annual Meeting,1
IQ,iQIYI Scores Big Wins at 2020 Golden Rooster Awards,1
VZ,Verizon Declares Fresh Dividend; Yield Is 4.1%,2
BCRX,"BioCryst Announces FDA Approval of ORLADEYO™ (berotralstat), First Oral, Once-daily Therapy to Prevent Attacks in Hereditary Angioedema Patients",1
JNPR,Juniper Networks Announces Pricing of Senior Notes Offering,1
RQHTF,Reliq Health Technologies Inc. Closes Oversubscribed Private Placement,1
BNO,Oil prices rise as producers agree on supply compromise,10
ZSAN,"Rosen, A Global and Leading Law Firm, Reminds Zosano Pharma Corporation Investors of Important Deadline in Securities Class Action; Encourages Investors with Losses in Excess of $100K to Contact Firm - ZSAN",1
CMPS,Find Your Next 10X Winner in the Burgeoning Shroom Boom,4
RLLVF,Relevium Issues Corporate Update on MCTO and Operations,1
TLYS,"Tilly's, Inc. (TLYS) CEO Ed Thomas on Q3 2020 Results - Earnings Call Transcript",1
SPLK,Investor Alert: Kaplan Fox Investigates Potential Securities Fraud At Splunk Inc.,1
UBER,Uber asks U.S. CDC to consider ride-hail drivers essential for COVID-19 vaccine distribution,1
T,WarnerMedia's One-Year Plan Is to Release All 2021 Films on the HBO Max Streaming Service,1
AMZN,Jeff Bezos is pressed by hundreds of politicians around the world to pay more taxes and raise wages,1
BNTX,Bahrain joins U.K. in authorizing emergency use of Pfizer–BioNTech vaccine,2
WBA,Walgreens Follows Amazon And Walmart Into The Retailer-As-Ad-Agency Trend,1
EMBI,Emerald Bioscience Creates Unique Path to Prevent Blindness Using Patented Synthetic Cannabinoids,1
GP,GreenPower Announces Grant of Stock Options,1
SPLK,"ROSEN, A TOP RANKED LAW FIRM, Announces Filing of Securities Class Action Lawsuit Against Splunk Inc.; Encourages Investors with Losses in Excess of $100K to Contact Firm – SPLK",1
NGA,SHAREHOLDER ALERT: Monteverde & Associates PC Announces an Investigation of Northern Genesis Acquisition Corp. - NGA,1
INFO,SHAREHOLDER ALERT: Monteverde & Associates PC Announces an Investigation of IHS Markit Ltd. - INFO,1
SNSS,"SHAREHOLDER ALERT: Monteverde & Associates PC Announces an Investigation of Sunesis Pharmaceuticals, Inc. - SNSS",1
WORK,"SHAREHOLDER ALERT: Monteverde & Associates PC Announces an Investigation of Slack Technologies, Inc. - WORK",1
MESO,"DEADLINE ALERT: Bragar Eagel & Squire, P.C. Reminds Investors That a Class Action Lawsuit Has Been Filed Against Mesoblast Limited and Encourages Investors to Contact the Firm",1
RCL,"DEADLINE ALERT: Bragar Eagel & Squire, P.C. Reminds Investors That a Class Action Lawsuit Has Been Filed Against Royal Caribbean Group and Encourages Investors to Contact the Firm",1
AMC,Movie theaters continue to fight for survival as Warner Bros. announces streaming deal with HBO Max,5
STPK,SHAREHOLDER ALERT: WeissLaw LLP Investigates Star Peak Energy Transition Corp.,1
IBKR,Interactive Brokers Acquiring Retail Brokerage From Goldman Sachs,1
CTK,"CooTek to Announce Third Quarter 2020 Unaudited Financial Results on December 15, 2020",1
PAC,Grupo Aeroportuario del Pacifico Reports Passenger Traffic Decrease of 34.4% for the Month of November,1
SPLK,"Glancy Prongay & Murray LLP, a Leading Securities Fraud Law Firm, Announces the Filing of a Securities Class Action on Behalf of Splunk Inc. (SPLK) Investors",1
ATVI,"Activision's ""Call of Duty"" Franchise Breaks the $3 Billion Barrier in 12 Months",1
ZS,"Zscaler CEO on Operation Warp Speed, fighting vaccine IP cyberthreats",1
NAK,"SHAREHOLDER ACTION ALERT: The Schall Law Firm Announces the Filing of a Class Action Lawsuit Against Northern Dynasty Minerals Ltd. and Encourages Investors with Losses in Excess of $500,000 to Contact the Firm",1
PG,"Forget Bonds: Try P&G, And Sell Calls",1
LOW,"Lowe's Stock Could Blast 40% Higher, According to Analyst",1
AZEK,"Azek CEO discusses earnings, plus repair and remodel momentum amid the coronavirus pandemic",1
CRWD,Crowdstrike CEO talks fighting cyberthreats on coronavirus vaccine operations,1
CERS,Cerus Corporation Announces Presentation of Study Results with INTERCEPT-treated COVID-19 Convalescent Plasma at the American Society of Hematology Annual Meeting,1
PEN,"Penumbra, Inc. to Participate in CEO Discussion with Bank of America",1
OKTA,"Okta stock up 100% year to date, CEO discusses earning beat on top and bottom lines",1
LOGI,"Logitech Sees Strong Year During Pandemic, Says CEO",1
DIS,"Disney Cruise Line Drops Anchor, Cancels Departures Through The End Of February",1
BKR,These Stocks Hold the Key to the Market's Returns in 2021,7
DOCU,"Covid 'Turbocharged' DocuSign Demand That Won't Let Up, Says CEO",1
RTX,"Kessler Topaz Meltzer & Check, LLP Reminds Raytheon Technologies Corporation f/k/a Raytheon Company Investors of Important Deadline in Securities Fraud Class Action Lawsuit",1
ACI,Improving Margins Set Stage For Earnings Growth At Albertsons,1
T,Warner Bros. Movies to Hit Theaters and HBO Max at Same Time,1
ATVI,The Wall Street Journal: Netflix sued by Activision Blizzard for allegedly poaching its former CFO,2
HEXO,Why HEXO Dived on Friday While Other Marijuana Stocks Soared,1
EEM,Next big money opportunity emerging?,1
ATVI,Activision sues Netflix over poaching of former finance chief,2
APPS,Digital Turbine: Sandwiched Between The 5G Revolution And Mobile Commerce,1
DCF,DCF: An Attractively Valued High-Yield Target Term Fund With 7.1% Yield And -6.7% Discount,1
RCL,"RCL ALERT: The Klein Law Firm Announces a Lead Plaintiff Deadline of December 7, 2020 in the Class Action Filed on Behalf of Royal Caribbean Cruises Ltd. Limited Shareholders",1
DNK,Phoenix Tree: Unlikely To Rise From The Ashes,1
SNOW,Why Snowflake Stock Soared to a New All-Time High Today,1
STRO,Why Sutro Biopharma Blasted 33% Higher on Friday,1
GM,"Final Trades: TUR, EWZ, GM & TSE",4
FMCC,"Freddie Mac Prices $380 Million Multifamily K-Deal, K-L06",1
BEVFF,Diversified Royalty Corp. Announces December 2020 Cash Dividend,1
BUD,Anheuser-Busch's Return To Growth Is Not Yet Priced In,1
AAL,Vaccine distribution is a real challenge: American Airlines CEO,1
NIO,"NIO Delivered 5,291 Vehicles In November 2020, Up 109.3% YoY",1
HOG,Harley Davidson hopes to capture the eBicycle market with its first line of electric bikes,1
DOCU,Here's Why Investors Should Ignore Short-Term Price Swings and Buy DocuSign,1
DIS,This Stock Could Be One of the Biggest Winners in a Post-Pandemic World,1
MESO,SHAREHOLDER ALERT: Pomerantz Law Firm Reminds Shareholders with Losses on their Investment in Mesoblast Limited of Class Action Law Suit and Upcoming Deadline - MESO,1
DLAKY,"Lufthansa will have shed 29,000 staff by year end: Bild am Sonntag",1
GLYC,"GlycoMimetics' Uproleselan in Combination With Venetoclax/HMA Shown to Break Chemoresistance, Reduce Tumor Burden and Increase Survival in AML Model",1
CLLS,Cellectis Reports Preliminary Results from its Phase 1 BALLI-01 Study of UCART22 in R/R Adult B-ALL at American Society of Hematology (ASH) Annual Meeting,1
REGN,Regeneron's BCMAxCD3 Bispecific Antibody (REGN5458) Shows Deep and Durable Responses in Patients with Heavily-pretreated Multiple Myeloma in Phase 1,1
LRN,"ROSEN, TOP RANKED GLOBAL INVESTOR COUNSEL, Reminds K12 Inc. Investors of Important Deadline in Securities Class Action; Encourages Investors with Losses in Excess of $100K to Contact Firm – LRN",1
PLD,Industrial Real Estate Roundup: Investors capitalize on COVID effects,3
WST,"Have $1,000? Here Are 3 Top Healthcare Stocks to Buy in December",3
MGM,MGM Resorts Taps Into Pennsylvania Gambling With an Online Casino Launch,1
CLSN,"Rosen, Trusted National Trial Counsel, Reminds Celsion Corporation Investors of Important Deadline in Securities Class Action; Encourages Investors with Losses in Excess of $100K to Contact the Firm - CLSN",1
ZM,Why Zoom Stock Is Down,1
AKAM,3 Hot Stocks to Buy in December,3
AUTL,Autolus Therapeutics presents compelling AUTO1 data from ALLCAR Phase 1 study in Adult Acute Lymphoblastic Leukemia (ALL) during the 62nd ASH Annual Meeting,1
IMGN,ImmunoGen Presents Updated Findings from Phase 1/2 Study of IMGN632 in Blastic Plasmacytoid Dendritic Cell Neoplasm at ASH Annual Meeting,1
BLUE,Long-Term Data for bluebird bio's betibeglogene autotemcel (beti-cel) Gene Therapy Show Patients Across Ages and β-thalassemia Genotypes Achieve Transfusion Independence and Remain Free from Transfusions Up to Six Years Presented at 62nd ASH Meeting,1
LEGN,"Legend Biotech Announces Phase 1b/2 Study Data of Cilta-cel, an Investigational BCMA CAR-T, Showing Early, Deep, and Durable Responses in Heavily Pretreated Patients with Multiple Myeloma",1
AMGN,Amgen To Present First Clinical Data For BCMA-Targeted Half-Life Extended BiTE® Therapy AMG 701 At ASH 2020,1
HYMTF,"Kia recalls 295,000 U.S. vehicles for fire risks",1
ICPT,"ROSEN, TRUSTED INVESTOR COUNSEL, Reminds Intercept Pharmaceuticals, Inc. Investors of Important Deadline in Securities Class Action; Encourages Investors with Losses in Excess of $100K to Contact the Firm – ICPT",1
MSTR,"MicroStrategy Buys $50 Million Worth Of Bitcoin, Topping Up Holdings To $766M",1
FCX,Why Shares in Freeport-McMoRan Soared 35% in November,1
ARZTY,Elliott Management Makes New $890M Push To Buy McDonald's Supplier Aryzta: Bloomberg,2
PGX,Invesco Preferred Portfolio ETF: Safety Dance,1
FN,Fabrinet: Upward Progression Continues,1
PD,PD Stock Price: $45 Target By JPMorgan,1
DOCU,Docusign CEO discusses earnings beat and the coronavirus pandemic driving more digital signatures,1
DOCU,DocuSign Results Dispel Fears Around Billings,1
TSLA,Tesla boasts a ‘majority minority' workforce but leadership is predominantly white and male,1
PSTX,Poseida Therapeutics Provides Update on Phase 1 Trial of P-BCMA-101 at the 2020 American Society of Hematology Annual Meeting,1
BMWYY,"ROSEN, A TOP RANKED LAW FIRM, Reminds Bayerische Motoren Werke AG Investors of Important Deadline in Securities Class Action First Filed by the Firm – BMWYY, BAMXF",1
FL,"Notable Insider Buys of the Past Week: Foot Locker, Icahn Enterprises, Kraft Heinz And More",6
IGMS,IGM Biosciences Presents First Clinical Data from IGM-2323 in Non-Hodgkin's Lymphoma at 2020 ASH Annual Meeting,1
GM,Cadillac Loses 150 Dealers After GM Asks Them To Upgrade Stores For Electric Vehicles,1
AER,Why Shares in AerCap Surged 48% in November,1
RCI,Rogers Communications: Resilient To The Pandemic But Wait For A Correction,1
RARE,GeneTx and Ultragenyx Announce Presentation of Phase 1/2 Data on Investigational GTX-102 in Patients with Angelman Syndrome,1
GRUB,DoorDash Boosts Expected Valuation Range Ahead of IPO,1
TSLA,"Tesla's racially diverse workforce is led mostly by white men, internal report shows",1
TSLA,Elon Musk reveals Tesla's plan to be at the forefront of a self-driving car revolution – and why he wants to be buried on Mars (TSLA),1
RHHBY,Roche announces new data reinforcing the long-term benefit of Venclexta/Venclyxto-based combination for people with relapsed or refractory chronic lymphocytic leukaemia,1
ABBV,AbbVie Presents Extended Follow-Up Data for Fixed Duration Treatment VENCLEXTA®/VENCLYXTO® (venetoclax) in Chronic Lymphocytic Leukemia (CLL),1
RHHBY,Genentech Announces New Data Reinforcing the Long-Term Benefit of Venclexta-Based Combination for People With Relapsed or Refractory Chronic Lymphocytic Leukemia,1
GOOS,Canada Goose Regaining Momentum,1
SYRS,Syros Presents New Data From Phase 2 Clinical Trial of SY-1425 and Announces Plans to Initiate Registration-Enabling Trial in MDS and Randomized Phase 2 Trial in AML,1
SYRS,"Syros Acquires Clinical-Stage Drug Candidate for Acute Promyelocytic Leukemia, Expanding Its Pipeline of Targeted Therapies for Hematologic Malignancies",1
BLUE,"Bristol Myers Squibb and bluebird bio Present Data Highlighting Anti-BCMA CAR T Cell Therapy, Ide-cel, in Relapsed and Refractory Multiple Myeloma at ASH 2020",1
C,Citigroup Chief: CBDCs Are 'Inevitable' In The Future Of Currency,1
XOM,Exxon Mobil Doubles Down On The Dividend,1
JD,China hands out $3 million of digital yuan as JD.com becomes first online platform to accept it,1
MAR,2021 Will Be Recovery Year: Marriott International's Smith,1
HENKY,Henkel: Good Relative Value At 17.2x Forward P/E In This European Giant,1
STPK,STPK Stock Price Increases 69.09%: Why It Happened,1
AZN,AstraZeneca Follows Pfizer In Seeking India Emergency Use Approval For COVID-19 Vaccine,2
ATRA,Bayer and Atara Biotherapeutics Enter Strategic Collaboration for Mesothelin-Targeted CAR T-cell Therapies for Solid Tumors,1
ABNB,Airbnb Boosts Price Range For Imminent IPO,1
MA,Mastercard to investigate allegations against Pornhub,1
HALO,"Halozyme: 7 Years Of Royalty Bliss Coming; Afterwards, Questions To Answer",1
L,Loews Corporation: A 30% Discount On A Valuable Conglomerate,1
IGT,International Game Technology PLC Announces Agreement To Sell Italian B2C Gaming Business For €950 Million In Cash,1
NNDM,Nano Dimension Prices $180 Million Registered Direct Offering,1
SPY,SPY's Bullish Signals And Record Highs,1
PFE,PFE Stock Price Increased 6.3% This Past Week: Why It Happened,1
INOV,Inovalon Holdings: A Good Value In Healthcare Technology,1
ABNB,The Wall Street Journal: Airbnb to hike its pre-IPO price range,1
