GME,What's next for GameStop's stock? These 3 pros weigh in,1
PNW,Pinnacle West Capital: Don't Miss A 4.7% Yield Opportunity,1
PSNL,"Personalis, Inc. (PSNL) CEO John West on Q4 2020 Results - Earnings Call Transcript",1
AAPL,Apple Will Have To Buyback $250 Billion In Stock To Become Cash Neutral,1
VTMLF,Venture Minerals in at-the-market subscription agreement with Acuity Capital for up to A$10 million of standby equity capital,1
JNJ,U.S. to Deliver 3.9 Million Johnson & Johnson Vaccine Doses,1
BNO,Oil prices climb after progress on huge U.S. stimulus bill,10
SNDL,SNDL Stock Price Increased 137.5% Over The Past Month: Why It Happened,1
MCD,McDonald's Weighs Partial Sale Of Dynamic Yield,1
ABNB,5 Top Stocks For March,5
TWLO,Twilio nears deal to invest up to $750 million in Syniverse: WSJ,1
EVGUF,Evergold Announces Filing of Early Warning Report,1
GLAD,Gladstone Capital Corporation: Between A Rock And A Hard Place,1
BRK-A,Warren Buffet reverses historical stance on buyback and other highlights from 2020 letter,2
COPHF,"Creso Pharma poised to enter US market with established partner after signing non-binding letter of intent with CERES,",1
UBER,Uber accused of using 'loaded questions' in drivers survey,1
OSTK,"Overstock: An Online Retailer With Massive Growth, Hidden Assets",1
DT,Dynatrace: Still Attractive,1
BYND,Should you buy Beyond Meat stock after deals with McDonald's and Yum?,1
AZN,Astrazeneca has sold its stake in Moderna for more than $1 billion: The Times,2
HSSHF,"Digihost Announces Purchase of Shares by CEO, Michel Amar, for $3.344 Million",1
LILA,Liberty Latin America Reports Fiscal 2020 Results,1
ZM,"Zoom Video Communications, Inc. (ZM) CEO Eric Yuan on Q4 2021 Results - Earnings Call Transcript",1
BLUE,"ROSEN, A LEADING INVESTOR RIGHTS LAW FIRM, Encourages bluebird bio, Inc. Investors with Losses in Excess of $100K to Secure Counsel Before Important Deadline - BLUE",1
TPTX,"Turning Point Therapeutics, Inc. (TPTX) CEO Athena Countouriotis on Q4 2020 Results - Earnings Call Transcript",1
FRANQ,Bank of Ireland Group PLC (BKRIF) CEO Francesca McDonagh on Full Year 2020 Results - Earnings Call Transcript,1
XENE,Xenon Pharmaceuticals Inc. (XENE) CEO Simon Pimstone on Q4 2020 Results - Earnings Call Transcript,1
XPEV,XPeng Announces Vehicle Delivery Results for February 2021,1
SMDZF,CAT Strategic Metals Closes First Tranche of Private Placement,1
AI,"C3.ai, Inc. (AI) CEO Tom Siebel on Q3 2021 Results - Earnings Call Transcript",1
RCL,"Royal Caribbean to Launch ""Fully Vaccinated"" Israel Cruises in May",1
GRPN,"Groupon, Inc. (GRPN) Presents at Morgan Stanley Technology, Media and Telecom Broker Conference Call - (Transcript)",1
ACAD,"ACADIA Pharmaceuticals, Inc. (ACAD) Presents at Cowen Healthcare Broker Conference Call - (Transcript)",1
NVAX,Novavax CEO Says Its Coronavirus Vaccine Could Win FDA Approval in May,1
NIO,Electric-Vehicle Maker Nio Falls After Hours on Mixed Q4,1
AAPL,All Apple U.S. Stores Now Open for the First Time Since Coronavirus Outbreak,1
AQST,"Pomerantz Law Firm Announces the Filing of a Class Action against Aquestive Therapeutics, Inc. and Certain Officers - AQST",1
WKHS,Workhorse Group Meeting With USPS to Discuss Electric Vehicle Contract Loss,1
BYND,Beyond Meat CFO Stepping Down,1
CRLBF,Cresco Labs Files Shelf Registration for Up to $1 Billion in Financing,1
ADVM,"Adverum Biotechnologies, Inc's (ADVM) CEO Laurent Fischer on Q4 2020 Results - Earnings Call Transcript",1
HZNM,Horizon Minerals impressed by new high-grade gold results at Peyes Farm,1
MELI,MercadoLibre's (MELI) Management on Q4 2020 Results - Earnings Call Transcript,1
TSLA,Musk Says Tesla FSD Subscriptions To Launch By June But Buying Would Still Be Better,1
JELD,"JELD-WEN Holding, Inc. Announces Pricing and Upsizing of Secondary Offering and Repurchase of Common Stock",1
CYRX,"Cryoport, Inc. (CYRX) CEO Jerrell Shelton on Q4 2020 Results - Earnings Call Transcript",1
NLST,"Netlist, Inc. (NLST) CEO Chuck Hong on Q4 2020 Results - Earnings Call Transcript",1
BNO,Oil optimism unwinding market's mad dash for storage,10
SWCH,Switch's (SWCH) Management on Q4 2020 Results - Earnings Call Transcript,1
FGEN,FibroGen's (FGEN) CEO Enrique Conterno on Q4 2020 Results - Earnings Call Transcript,1
TVTX,"Travere Therapeutics, Inc. (TVTX) CEO Eric Dube on Q4 2020 Results - Earnings Call Transcript",1
MLPA,"MLPA: MLP ETF, Strong Energy Play, 10.8% Yield",1
AMRC,"Ameresco, Inc. (AMRC) CEO George Sakellaris on Q4 2020 Results - Earnings Call Transcript",1
VRRM,Verra Mobility Corp (VRRM) CEO David Roberts on Q4 2020 Results - Earnings Call Transcript,1
ATRA,"Atara Biotherapeutics, Inc. (ATRA) CEO Pascal Touchon on Q4 2020 Results - Earnings Call Transcript",1
WIFI,"Shareholder Alert: Ademi LLP Investigates whether Boingo Wireless, Inc. has obtained a Fair Price in its transaction with Digital Colony",1
NVAX,"Novavax, Inc. (NVAX) CEO Stan Erck on Q4 2020 Results - Earnings Call Transcript",1
AGRX,"Agile Therapeutics, Inc. (AGRX) CEO Alfred Altomari on Q4 2020 Results - Earnings Call Transcript",1
AZYO,"Aziyo Biologics, Inc. (AZYO) CEO Ronald Lloyd on Q4 2020 Results - Earnings Call Transcript",1
INSG,Inseego Corporation (INSG) CEO Dan Mondor on Q4 2020 Results - Earnings Call Transcript,1
AMZN,AWS Launches Second Region in Japan,1
OOMA,"Ooma, Inc.'s (OOMA) CEO Eric Stang on Q4 2021 Results - Earnings Call Transcript",1
SILK,"Silk Road Medical, Inc's (SILK) CEO Erica Rogers on Q4 2020 Results - Earnings Call Transcript",1
TAC,TransAlta Corporation Provides Conversion Right and Dividend Rate Notice for Series A and B Preferred Shares,1
CLOV,Clover Health Investments' (CLOV) CEO Vivek Garipalli on Q4 2020 Results - Earnings Call Transcript,1
WSTRF,Western Uranium & Vanadium Corp. Closes Final Tranche of Non-Brokered Private Placement,1
NKE,A longtime Nike exec resigned after her son used her credit card to fund his sneaker resale business,1
SGMS,Scientific Games Corporation (SGMS) CEO Barry Cottle on Q4 2020 Results - Earnings Call Transcript,1
RGNX,"REGENXBIO, Inc. (RGNX) CEO Ken Mills on Q4 2020 Results - Earnings Call Transcript",1
IRTC,"INVESTOR NOTICE: ROSEN, NATIONAL TRIAL COUNSEL, Encourages iRhythm Technologies, Inc. Investors to Secure Counsel Before Important Deadline - IRTC",1
TYG,"Tortoise Provides Unaudited Balance Sheet Information and Asset Coverage Ratio Updates as of February 28, 2021 for TYG, NTG, TTP, NDP, TPZ and TEAF",1
DDD,3D Systems (DDD) Q4 Earnings and Revenues Miss Estimates,1
DMGGF,DMG Announces Cdn$70 Million Private Placement Offering with U.S. Institutional Investors,1
THBRF,Thunderbird Entertainment Announces Changes to Board of Directors,1
AA,Alcoa Corporation (AA) CEO Roy Harvey on BMO 30th Global Metals & Mining Virtual Conference (Transcript),1
SYK,Stryker Corp (SYK) Presents at Cowen Healthcare Broker Conference Call - (Transcript),1
PANW,"Palo Alto Networks, Inc. (PANW) Presents at Morgan Stanley Technology, Media and Telecom Broker Conference Call - (Transcript)",1
STX,"Seagate Technology PLC (STX) Presents at Morgan Stanley Technology, Media and Telecom Broker Conference Call - (Transcript)",1
ELAN,"Elanco Animal Health, Inc. (ELAN) Presents at Cowen Healthcare Broker Conference Call - (Transcript)",1
TWODF,Taylor Wimpey PLC (TWODF) CEO Peter Redfern on Q4 2020 Results - Earnings Call Transcript,2
FUBO,fuboTV's (FUBO) CEO David Gandler on Q4 2020 Results - Earnings Call Transcript,1
DRIV,DRIV: The Electric Vehicle Bubble Is Bursting,1
VEEV,Veeva Systems Inc. (VEEV) CEO Peter Gassner on Q4 2021 Results - Earnings Call Transcript,1
BYND,"Beyond Meat, Inc. Prices Upsized $1 Billion Convertible Senior Notes Offering",1
KMPH,"KemPharm Announces FDA Approval of AZSTARYS™ (serdexmethylphenidate and dexmethylphenidate capsules, for oral use, CII), A New Once-Daily Treatment for ADHD",1
QTRX,Quanterix Corporation (QTRX) CEO Kevin Hrusovsky on Q4 2020 Results - Earnings Call Transcript,1
LDSVF,Lindt & Spruengli (LDSVF) CEO Dieter Weisskopf on Full Year 2020 Results - Earnings Call Transcript,1
HPE,Hewlett Packard Enterprise Company (HPE) CEO Antonio Neri on Q1 2021 Results - Earnings Call Transcript,1
GS,Goldman Plans to Add About 100 Staff in Singapore,1
MIELY,Mitsubishi Electric 1st Among Japanese Firms and 3rd Globally in International Patent Applications Filed in 2020,1
ACND-UN,Ascendant Digital Acquisition Corp. (ACNDU) on Beacon Street and Ascendant Digital Acquisition Corp. Conference Call (Transcript),1
JCS,"Shareholder Alert: Ademi LLP Investigates whether Shareholders will receive a Fair Price in Communications Systems, Inc.'s transaction with Pineapple Energy",1
MRVI,"Maravai LifeSciences Holdings, Inc. (MRVI) CEO Carl Hull on Q4 2020 Results - Earnings Call Transcript",1
URBN,"Urban Outfitters, Inc. (URBN) CEO Richard Hayne on Q4 2021 Results - Earnings Call Transcript",1
MELI,MercadoLibre Earnings Show Power Of ‘Digital Front Door' For Developing Regions,1
SGQRF,SouthGobi Announces Profit Warning,1
FSTR,L.B. Foster Co (FSTR) CEO Robert Bauer on Q4 2020 Results - Earnings Call Transcript,1
NIO,Why some Chinese are buying local electric car brands like Nio — instead of Tesla,1
BOX,Box's (BOX) CEO Aaron Levie on Q4 2021 Results - Earnings Call Transcript,1
CRTG,"The Coretec Group, Inc. Announces $6.0 Million Private Placement Offering",1
AGNPF,Algernon Pharmaceuticals Announces Private Placement,1
CABO,Cable One Announces Pricing of Upsized Private Offering of Convertible Senior Notes,1
COWN,"Illumina, Inc. (ILMN) CEO Francis deSouza Presents at Cowen 41st Annual Health Care Conference (Transcript)",2
SE,Sea Ltd (SE) CEO Forrest Li on Q4 2020 Results - Earnings Call Transcript,1
NGTF,NightFood Holding's (NGTF) CEO Sean Folkson Hosts Investor Conference Call (Transcript),1
RIO,Rio Tinto's chairman to step down in latest shakeup following Indigenous cave destruction,1
PYPL,PayPal To Buy Cryptocurrency Custodian Curv: Report,1
HSKA,Heska Announces Pricing of Upsized Public Offering of Common Stock,1
AQSZF,Aequus Announces Notice of Warrant Acceleration,1
TMDX,TransMedics Group's (TMDX) CEO Waleed Hassanein on Q4 2020 Results - Earnings Call Transcript,1
ATNX,"HAGENS BERMAN, NATIONAL TRIAL ATTORNEYS, Encourages Athenex (ATNX) Investors with Losses to Contact Its Attorneys, ATNX Reports FDA Complete Response Letter",1
CDLX,Cardlytics Announces Pricing of Public Offering of Common Stock,1
GSCCF,ioneer in a trading halt ahead of capital raising announcement,1
CMI,"Cummins, Inc. (CMI) Presents at 13th Annual Evercore ISI Industrial Conference - Transcript",1
VEC,"Vectrus, Inc. (VEC) CEO Charles Prow on Q4 2020 Results - Earnings Call Transcript",1
VMW,"VMware, Inc. (VMW) Presents at Morgan Stanley 2021 Technology, Media and Telecom Virtual Conference (Transcript)",1
AMT,American Tower Corporation (REIT) (AMT) Presents at Raymond James 42nd Annual Institutional Investors Conference (Transcript),1
NFLX,"Netflix, Inc. (NFLX) Presents at Morgan Stanley Technology, Media & Telecom - Conference Call Transcript",1
NVEE,"NV5 Global, Inc. (NVEE) CEO Dickerson Wright on Q4 2020 Results - Earnings Call Transcript",1
ZM,"Cathie Wood's Ark Invest Buys over 250,000 Shares of Zoom Video",1
JNJ,Johnson & Johnson (JNJ) Presents at Raymond James 42nd Annual Institutional Investors Conference Call Transcript,1
REGI,"REGI CLASS ACTION NOTICE: Glancy Prongay & Murray LLP Files Securities Fraud Lawsuit Against Renewable Energy Group, Inc.",1
ELEEF,Element Fleet Management Corp (ELEEF) CEO Jay Forbes on Q4 2020 Results - Earnings Call Transcript,1
SNOW,Snowflake Inc.'s (SNOW) CEO Frank Slootman on Q4 2021 Results - Earnings Call Transcript,1
UNIT,"Uniti Group, Inc. (UNIT) Presents at Raymond James Institutional Investors Broker Conference Call - (Transcript)",1
ELLXF,Elixinol Global in trading halt with potential transaction news pending,1
DSGX,The Descartes Systems Group Inc (DSGX) CEO Ed Ryan on Q4 2021 Results - Earnings Call Transcript,1
SPLK,Splunk Inc. (SPLK) CEO Douglas Merritt on Q4 2021 Results - Earnings Call Transcript,1
AMZN,"Amazon opening cashierless Fresh grocery in London, its first physical retail store outside U.S.",1
SVBI,"Shareholder Alert: Ademi LLP Investigates whether Severn Bancorp, Inc. has obtained a Fair Price in its transaction with Shore Bancshares",1
TPVG,TriplePoint Venture Growth's (TPVG) CEO Jim Labe Q4 2020 Results - Earnings Call Transcript,1
APO,Apollo Global Closes Acquisition Deal With Crafts Chain Michaels,2
AAPL,"Fortnite Row Aftermath: Arizona House Passes Bill That Will Require Apple, Google To Let App Developers Chose Outside Payments Systems",3
OKTA,"Okta, Inc. (OKTA) CEO Todd McKinnon on Q4 2021 Results - Earnings Call Transcript",1
AMPE,Ampio Pharmaceuticals' (AMPE) CEO Mike Macaluso on Q4 2020 Results - Earnings Call Transcript,1
PEUGF,Peugeot's (PEUGF) Management on Q4 2020 Results - Earnings Call Transcript,2
SAIL,SailPoint Expands With New Office in Japan,1
COHU,"Cohu Announces Pricing of Upsized Public Offering of 4,950,000 Shares of Common Stock",1
FB,Australian treasurer says talks with Facebook on new media law were ‘protracted and difficult',1
PCOM,Points International Ltd. (PCOM) CEO Rob MacLean on Q4 2020 Results - Earnings Call Transcript,1
FUBO,"SHAREHOLDER ALERT: CLAIMSFILER REMINDS APA, EH, FUBO, MPLN INVESTORS of Lead Plaintiff Deadline in Class Action Lawsuits",1
EBIX,"SHAREHOLDER ALERT: CLAIMSFILER REMINDS CLOV, EBIX INVESTORS of Lead Plaintiff Deadline in Class Action Lawsuits",1
CMCSA,"Comcast Corporation (CMCSA) CEO Brian Roberts Presents at Morgan Stanley 2021 Technology, Media & Telecom Conference (Transcript)",2
AEO,"American Eagle Outfitters, Inc. (AEO) CEO Jay Schottenstein on Q4 2020 Results - Earnings Call Transcript",1
PCN,PCN: Another Strong Performer With A Persistent Premium,1
MRVL,Marvell Technology Group Ltd. (MRVL) CEO Matt Murphy on Q4 2020 Results - Earnings Call Transcript,1
OTRK,"OTRK CLASS ACTION NOTICE: Glancy Prongay & Murray LLP Files Securities Fraud Lawsuit Against Ontrak, Inc.",1
CFMS,"Conformis, Inc. (CFMS) CEO Mark Augusti on Q4 2020 Results - Earnings Call Transcript",1
ABR,Arbor Realty Has Outstanding Finish To 2020,1
GRVY,This Gaming Growth Stock Is Down Over 30% From Record Highs: Buy or Sell?,1
GSAT,Why Globalstar Stock Spiked 9% In After-Hours Today,1
VRM,Vroom's (VRM) CEO Paul Hennessy on Q4 2020 Results - Earnings Call Transcript,1
TSN,"BREAKING NEWS: ROSEN, GLOBAL INVESTOR COUNSEL, Encourages Tyson Foods, Inc. Investors to Secure Counsel Before Important Deadline - TSN",1
GTT,"GTT FINAL DEADLINE: ROSEN, RESPECTED INVESTOR COUNSEL, Encourages GTT Communications, Inc. Investors With Large Losses to Secure Counsel Before Important March 15 Deadline - GTT",1
FUBO,"ROSEN, A LEADING NATIONAL FIRM, Encourages fuboTV Inc. Investors with Losses in Excess of $100K to Secure Counsel Before Important Deadline - FUBO",1
PLTR,Cathie Wood's ARK Invest Buys Over 2.6 Million Palantir Shares,1
XL,INVESTOR ALERT: Law Offices of Howard G. Smith Announces Investigation of XL Fleet Corp. (XL) on Behalf of Investors,1
BUZZ,Barstool's Portnoy backs new BUZZ ETF,1
VRM,Vroom: Consumer Demand For Used Cars Eclipses Pre-COVID Levels,1
ICAD,iCAD to Participate in the Cowen 41st Annual Health Care Conference,1
RIO,U.S. judge rejects SEC bid to expand Rio Tinto fraud lawsuit on Mozambique coal business,1
DX,"Dynex Capital, Inc. Announces Pricing of Public Offering of Common Stock",1
DISH,"DISH, DraftKings Partner On DVR Fantasy Sports Integration",2
BNO,"Oil prices firm on prospect of OPEC+ maintaining supply cuts, drop in U.S. inventories",10
ATNX,"ATHENEX ALERT: Bragar Eagel & Squire, P.C. Announces That a Class Action Lawsuit Has Been Filed Against Athenex, Inc. and Encourages Investors to Contact the Firm",1
REGI,"RENEWABLE ENERGY GROUP ALERT: Bragar Eagel & Squire, P.C. Announces That a Class Action Lawsuit Has Been Filed Against Renewable Energy Group, Inc. and Encourages Investors to Contact the Firm",1
OTRK,"ONTRAK ALERT: Bragar Eagel & Squire, P.C. Is Investigating Ontrak, Inc. on Behalf of Ontrak Stockholders and Encourages Investors to Contact the Firm",1
REGI,"RENEWABLE ENERGY SHAREHOLDER ALERT by Former Louisiana Attorney General: Kahn Swick & Foti, LLC Reminds Investors with Losses in Excess of $100,000 of Lead Plaintiff Deadline in Class Action Lawsuit Against Renewable Energy Group, Inc. - REGI",1
RMNI,"Rimini Street, Inc. (RMNI) CEO Seth Ravin on Q4 2020 Results - Earnings Call Transcript",1
HDSN,"Hudson Technologies, Inc.'s (HDSN) CEO Brian Coleman on Q4 2020 Results - Earnings Call Transcript",1
RPNRF,Rapid Nutrition Expands Global Online Distribution with New Amazon Store,1
GOOG,Google will stop selling ads based on web browsing history,2
INVE,"Identiv, Inc. (INVE) CEO Steven Humphreys on Q4 2020 Results - Earnings Call Transcript",1
RRC,Pomerantz Law Firm Announces the Filing of a Class Action against Range Resources Corporation and Certain Officers - RRC,1
COO,"The Cooper Companies, Inc. (COO) CEO Albert White on Q1 2021 Results - Earnings Call Transcript",1
WORK,Slack higher after-hours following earnings beat,1
AMGN,Amgen Inc. (AMGN) Management Presents at Cowen 41st Annual Healthcare Conference (Transcript),1
ANIK,"Anika Therapeutics, Inc. (ANIK) CEO Cheryl Blanchard on Q4 2020 Results - Earnings Call Transcript",1
FLWS,1-800-Flowers Looks Fresh And Ready For Picking,1
MDLA,"Medallia, Inc. (MDLA) CEO Leslie Stretch on Q4 2021 Results - Earnings Call Transcript",1
QUMU,Qumu Corporation (QUMU) CEO T.J. Kennedy on Q4 2020 Results - Earnings Call Transcript,1
CERT,"Certara, Inc. (CERT) CEO William Feehery on Q4 2020 Results - Earnings Call Transcript",1
AMRC,Ameresco Announces Pricing of Public Offering of Class A Common Stock,1
COST,"Costco lower after-hours despite posting revenue beat, online sales surge",1
SWBI,"Smith & Wesson Brands, Inc. (SWBI) CEO Mark Smith on Q3 2021 Results - Earnings Call Transcript",1
IDT,IDT Corp (IDT) CEO Samuel Jonas on Q2 2021 Results - Earnings Call Transcript,1
DADA,Dada Group Joined Shanghai's New Year Shopping Season Campaign and Announced Livestreaming Partnership with Unilever,1
CHUY,"Chuy's Holdings, Inc. (CHUY) CEO Steve Hislop on Q4 2020 Results - Earnings Call Transcript",1
CLPT,"Clearpoint Neuro, Inc. (CLPT) CEO Joseph Burnett on Q4 2020 Results - Earnings Call Transcript",1
REGI,"RENEWABLE ENERGY INVESTORS: ALERT BY FORMER LOUISIANA ATTORNEY GENERAL: Kahn Swick & Foti, LLC Reminds Investors with Losses in Excess of $100,000 of Lead Plaintiff Deadline in Class Action Lawsuit Against Renewable Energy Group, Inc. - REGI",1
AVGO,Broadcom Inc. (AVGO) CEO Hock Tan on Q1 2021 Results - Earnings Call Transcript,1
COST,Costco Wholesale's (COST) Management on Q2 2021 Results - Earnings Call Transcript,1
SCM,"Stellus Capital Investment Corporation Reports Results for its Fourth Fiscal Quarter and Year Ended December 31, 2020",1
Z,"Cathie Wood's ARK Invest Buys Over 450,000 Shares of Zillow",2
AJX,Great Ajax Corp. (AJX) CEO Lawrence Mendelsohn on Q4 2020 Results - Earnings Call Transcript,1
ACM,AECOM: Investor Day Highlights The Medium-Term Bull Case,1
GPS,Gap's (GPS) CEO Sonia Syngal on Q4 2020 Results - Earnings Call Transcript,1
XLNX,"Monteverde & Associates PC Files Class Action Lawsuit On Behalf Of Shareholders Of Xilinx, Inc. In The Northern District Of California",1
ARKF,Cathie Wood's ARK Invest Buys and Sells 3/4,5
HEAR,Turtle Beach Corporation (HEAR) CEO Juergen Stark on Q4 2020 Results - Earnings Call Transcript,1
WTI,WTI Stock Price Increased 10.82%: Why It Happened,1
FRGI,Fiesta Restaurant's (FRGI) CEO Rich Stockinger on Q4 2020 Results - Earnings Call Transcript,1
SOLY,"Soliton, Inc. (SOLY) CEO Brad Hauser on Q4 2020 Results - Earnings Call Transcript",1
INMB,"INmune Bio, Inc. (INMB) CEO RJ Tesi on Q4 2020 Results - Earnings Call Transcript",1
EVFM,"Evofem Biosciences, Inc. (EVFM) CEO Saundra Pelletier on Q4 2020 Results - Earnings Call Transcript",1
DMTK,DermTech's (DMTK) CEO John Dobak on Q4 2020 Results - Earnings Call Transcript,1
GSCCF,ioneer over the moon with strong response to upsized A$80 million placement,1
DRRX,DURECT Corporation (DRRX) CEO Jim Brown on Q4 2020 Results - Earnings Call Transcript,1
MRETF,Martinrea International Inc. (MRETF) CEO Pat D'Eramo on Q4 2020 Results - Earnings Call Transcript,1
SYN,"Synthetic Biologics, Inc's (SYN) CEO Steve Shallcross on Q4 2020 Results - Earnings Call Transcript",1
KDMN,"Kadmon Holdings, Inc. (KDMN) Reports Q4 Loss, Tops Revenue Estimates",1
GPMT,Granite Point Mortgage Trust (GPMT) Surpasses Q4 Earnings and Revenue Estimates,1
JAMF,Jamf Holding Corp.'s (JAMF) CEO Dean Hager on Q4 2020 Results - Earnings Call Transcript,1
TOSBF,Toshiba sees Mizuho join BlackRock in building 5% stake,2
VERI,"Veritone, Inc. (VERI) CEO Chad Steelberg on Q4 2020 Results - Earnings Call Transcript",1
BURL,BURL Stock Price Increased 11.19%: Why It Happened,1
SQ,How Square's Purchase of Jay Z's Tidal Could Popularize Blockchain,1
IRTC,"IRTC EQUITY ALERT: Kessler Topaz Meltzer & Check, LLP Announces that a Securities Fraud Class Action Lawsuit was filed on Behalf of Investors of iRhythm Technologies, Inc.",1
AGS,"PlayAGS, Inc. (AGS) CEO David Lopez on Q4 2020 Results - Earnings Call Transcript",1
CWLDY,Western Australia upgrades Crown Resorts inquiry to Royal Commission,1
DLAKY,Deutsche Lufthansa AG (DLAKF) CEO Carsten Spohr on Q4 2020 Results - Earnings Call Transcript,1
WRAP,Wrap Technologies' (WRAP) CEO Tom Smith on Q4 2020 Results - Earnings Call Transcript,1
PROS,"SHAREHOLDER ALERT: Monteverde & Associates PC Announces an Investigation of ProSight Global, Inc. - PROS",1
APA,Pomerantz Law Firm Announces the Filing of a Class Action against Apache Corporation and Certain Officers - APA,1
CLOV,"SHAREHOLDER ALERT BY FORMER LOUISIANA ATTORNEY GENERAL: KSF REMINDS CLOV, IRTC, PEN INVESTORS of Lead Plaintiff Deadline in Class Action Lawsuits",3
REGI,"SHAREHOLDER ALERT BY FORMER LOUISIANA ATTORNEY GENERAL: KSF REMINDS REGI, VLDR INVESTORS of Lead Plaintiff Deadline in Class Action Lawsuits",2
MIK,"SHAREHOLDER ALERT: Monteverde & Associates PC Announces an Investigation of The Michaels Companies, Inc. - MIK",1
MDLZ,Hu Products Conducts Nationwide Voluntary Recall of Single Lot of 4 oz. Chocolate Covered Hunks - Sour Goldenberries Product Due to Undeclared Almonds,1
CBTC,Revenue Report: XTRA's T17 ASICs Are Mining In A Canadian Hosting,1
MKGI,"SHAREHOLDER ALERT: Monteverde & Associates PC Announces an Investigation of Monaker Group, Inc. - MKGI",1
HKIB,Xiaomi's Strategic Investment into AMTD Capital under AMTD International (HKIB),1
VLDR,"VLDR Class Action Alert: Kessler Topaz Meltzer & Check, LLP Announces A Securities Fraud Class Action Filed Against Velodyne Lidar, Inc.",1
CLPS,CLPS' (CLPS) CEO Raymond Lin on Q1 2021 Results - Earnings Call Transcript,1
BUZZ,Will the internet win? Dave Portnoy puts his weight behind Buzz ETF,1
FPRX,"SHAREHOLDER ALERT: Monteverde & Associates PC Announces an Investigation of Five Prime Therapeutics, Inc. - FPRX",1
ALID,Allied Corp. Launches Strategic North American Public Relations and Marketing Campaign,1
VIAC,Reinventions are good news for Volkswagen and ViacomCBS investors: Barron's,2
MPLN,"MPLN ALERT: Kessler Topaz Meltzer & Check, LLP Reminds Investors of Securities Fraud Class Action Lawsuit Filed Against MultiPlan Corporation",1
OKTA,Okta CEO defends $6.5 billion deal for rival Auth0 after shares fall,1
NTST,NETSTREIT Corp. (NTST) CEO Mark Manheimer on Q4 2020 Results - Earnings Call Transcript,1
TSLA,Tesla and Other Hypergrowth Stocks Could Tear Down What They Built Up,1
YPF,YPF Sociedad Anónima (YPF) CEO Sergio Affronti on Q4 2020 Results - Earnings Call Transcript,1
LDOS,"LEIDOS HOLDINGS ALERT: Bragar Eagel & Squire, P.C. Announces That a Class Action Lawsuit Has Been Filed Against Leidos Holdings, Inc. and Encourages Investors to Contact the Firm",1
BKR,"BAKER HUGHES ALERT: Bragar Eagel & Squire, P.C. is Investigating Baker Hughes Company on Behalf of Baker Hughes Stockholders and Encourages Investors to Contact the Firm",1
AT,SHAREHOLDER ALERT: Monteverde & Associates PC Announces an Investigation of Atlantic Power Corp. - AT,1
TSLA,"Cathie Wood's ARK Invest Buys Over 108,000 Shares of Tesla",1
TREX,Trex Company CEO on elevated demand for composite decking and railing products,1
OKTA,Okta CEO defends move to acquire rival cybersecurity firm Auth0: 'The two solutions together are so,1
GWAC,Bitcoin Miner Cipher Mining Going Public in SPAC Merger,1
MAA,MAA to Present at the 2021 Citi Virtual Global Property CEO Conference,1
ARKF,Cathie Wood's ARK Invest Buys and Sells 3/5,5
CCHWF,Columbia Care: No Longer A Small Operator,1
NTNX,Nutanix CEO: We are in the heart of moving to a subscription model,1
EBIX,"HAGENS BERMAN, NATIONAL TRIAL ATTORNEYS, Notifies Ebix (EBIX) Investors of Application Deadline in Securities Fraud Lawsuit and Encourages Investors with Losses to Contact Firm",1
RMD,Don't Sleep On ResMed,1
PEN,"Deadline Approaching: Kessler Topaz Meltzer & Check, LLP Reminds Investors of Deadline in Securities Fraud Class Action Lawsuit Filed Against Penumbra, Inc.",1
DTN,DTN: Average In Quality And Performance,1
MRNA,Why Moderna Was a Roller Coaster Today,1
LGIH,LGI Homes CEO expects housing demand to remain strong even as mortgage rates tick up,1
DOCU,This Is Why Docusign Will Succeed Even Beyond The Pandemic,1
BNCHF,Benchmark Drills 1.66 Gold Equivalent Over 186.00 Metres Extending Depth And Continuity Of The Mineralizing System At Cliff Creek South,1
LYFT,Lyft President Zimmer Says Demand Is Returning,1
GILD,U.S. FDA Approves Yescarta® for Relapsed or Refractory Follicular Lymphoma After Two or More Lines of Systemic Therapy,1
ETH,2 Cheap Stocks Under $25 to Buy that Shrugged Off the Market Rout,2
FOUR,"Shift4 Payments CEO on Earnings, SpaceX SN10 Fireball",1
MSFT,"More than 20,000 U.S. organizations compromised through Microsoft flaw: source",1
GRPAF,Aeromexico Reports February 2021 Traffic Results,1
