REGI,"REGI LAWSUIT FILING DEADLINE: Bernstein Liebhard LLP Reminds Investors of the Deadline to File a Lead Plaintiff Motion in a Securities Class Action Lawsuit Against Renewable Energy Group, Inc.",1
CDEV,CDEV Stock: 14.58% Increase Explanation,1
BNO,Oil holds near one-month highs as demand forecasts raised,10
DELL,"MarketWatch First Take: VMware to finally come into its own in Dell spinoff, but strategic cloud remains",2
ENVB,Enveric Biosciences Positioned To Test Cannabinoid-Based Cancer Treatments,1
FYIRF,FYI Resources to begin trading today on US-based OTCQX market,1
COIN,"Cathie Wood's ARK Invest Buys Nearly 750,000 Shares of Coinbase",1
SPCE,Richard Branson sells over $150 million in Virgin Galactic stock,1
APHA,Aphria Inc. (APHA) CEO Irwin Simon on Shareholders Meeting - Call Transcript,1
ADBE,2 Great Tech Stocks to Buy Now Amid Hot Start to Q1 Earnings,2
AUDVF,"Audi has revealed its cheapest electric model, with a starting price of $45k",1
TOSBF,"Japan State Fund Mulls Toshiba Buyout Bid, Report Says",1
TOSBF,Japan state-backed funds consider offer for Toshiba: report,1
KYMR,KYMR Stock: 16.76% Increase Explanation,1
AHCO,"ADAPTHEALTH ALERT: Bragar Eagel & Squire, P.C. Is Investigating AdaptHealth Corporation on Behalf AdaptHealth Stockholders and Encourages Investors to Contact the Firm",1
CAN,"CANAAN ALERT: Bragar Eagel & Squire, P.C. is Investigating Canaan, Inc. on Behalf of Canaan Stockholders and Encourages Investors to Contact the Firm",1
TME,Tencent Music Entertainment Group Announces Leadership Changes,1
PRCH,"PORCH GROUP ALERT: Bragar Eagel & Squire, P.C. Is Investigating Porch Group, Inc. on Behalf of Porch Group Stockholders and Encourages Investors to Contact the Firm",1
COIN,Coinbase's Massive Listing,1
FRMO,FRMO Corp. Announces Third Quarter Results and Conference Call,1
JOB,GEE Group Announces Pricing of $50 Million Underwritten Public Offering,1
SLNO,Soleno Therapeutics Participates in Prader-Willi Syndrome (PWS) DCCR Town Hall,1
BAC,The challenge for U.S. banks is they're feeling the effects of fiscal and monetary policy: KBW,6
UAVS,"AgEagle Aerial Systems, Inc. Class Action Reminder: Kessler Topaz Meltzer & Check, LLP Reminds Shareholders of Deadline in Securities Fraud Class Action Lawsuit",1
JBHT,"J.B. Hunt Transport Services, Inc. (JBHT) CEO John Roberts on Q1 2021 Results - Earnings Call Transcript",1
BST,Don't Buy QYLD: Buy These CEFs Instead,3
VIAC,"ViacomCBS To Merge CBS News, TV Station Divisions",1
GOOG,"Google 'partially' misled Android users in Australia about location data, court rules",2
C,Australia's NAB fields questions over potential purchase of Citi's local consumer unit,1
OXBDF,Oxford Biomedica plc (OXBDF) CEO John Dawson on Q4 2020 Results - Earnings Call Transcript,1
COIN,"ARK buys $110 million Coinbase shares, adding to positions",1
COIN,"Cathie Wood's ARK Invest Buys Over 340,000 Shares of Coinbase",1
COWN,Cowen Set For Further Benefits From Investment Banking Boom,1
LAKE,"Lakeland Industries, Inc. (LAKE) CEO Charles Roberson on Q4 2021 Results - Earnings Call Transcript",1
DISCA,Discovery Communications (DISCA) Stock Sinks As Market Gains: What You Should Know,3
HYMTF,"Hyundai reveals a new pickup truck, but please don't call it that",1
C,"Citi to Exit Retail Banking in 13 Markets Across Asia, Europe",1
BMEA,Biomea Announces Pricing of Initial Public Offering,1
TSP,TuSimple plans to hire 400 with proceeds from $1.1B public offering,1
GOOG,Australia finds Google misled customers over data collection: regulator,2
LMMFF,Lithium Australia data review enhances prospectivity of Greenbushes South Lithium Project JV,1
BYRN,Adding To My Byrna Technologies Position,1
JBHT,J.B. Hunt lays out new margin targets for all segments,1
JNPR,Juniper Networks Wins “Best of Show” Top Awards at Interop Tokyo 2021,1
AKYA,Akoya Biosciences Announces Pricing of Initial Public Offering,1
EBIX,"EBIX SHAREHOLDER ALERT BY FORMER LOUISIANA ATTORNEY GENERAL: Kahn Swick & Foti, LLC Reminds Investors with Losses in Excess of $100,000 of Lead Plaintiff Deadline in Class Action Lawsuit Against Ebix, Inc. - EBIX",1
FUBO,"FUBOTV SHAREHOLDER ALERT BY FORMER LOUISIANA ATTORNEY GENERAL: Kahn Swick & Foti, LLC Reminds Investors with Losses in Excess of $100,000 of Lead Plaintiff Deadline in Class Action Lawsuit Against fuboTV Inc. - FUBO",1
GLSPU,Global SPAC Partners Co. Announces Closing of Underwriters' Over-Allotment Option to Purchase Additional Units in Connection with its Initial Public Offering,1
EH,"EHANG HOLDINGS SHAREHOLDER ALERT BY FORMER LOUISIANA ATTORNEY GENERAL: Kahn Swick & Foti, LLC Reminds Investors with Losses in Excess Of $100,000 of Lead Plaintiff Deadline in Class Action Lawsuit Against EHang Holdings Limited - EH",1
SPNE,SeaSpine Prices Public Offering of Common Stock,1
VZ,Verizon Expands 5G For Business Internet To 21 More Cities,2
NEXCF,Nextech AR Solutions Corp. (NEXCF) CEO Evan Gappelberg on Q4 2020 Results - Earnings Call Transcript,1
SNDL,SNDL Stock: Should I Buy It Now?,1
TKRFF,High grade tin mineralization at Tinka's Ayawilca project,1
SPOT,Spotify: The Company Is Spot On,1
KLXE,"KLX Energy Services Holdings, Inc. (KLXE) CEO Chris Baker on Q4 2020 Results - Earnings Call Transcript",1
BNO,Oil steady near four-week highs on demand revival,10
AA,Alcoa Corporation (AA) CEO Roy Harvey on Q1 2021 Results - Earnings Call Transcript,1
DDD,"Investor Reminder: Kessler Topaz Meltzer & Check, LLP Reminds Investors of Securities Fraud Class Action Lawsuit Filed Against 3D Systems Corp. - DDD",1
DSEY,Diversey Announces Exercise of Underwriters' Option to Purchase Additional Shares,1
LFMD,"LIFEMD ALERT: Bragar Eagel & Squire, P.C. Is Investigating LifeMD, Inc. on Behalf of LifeMD Stockholders and Encourages Investors to Contact the Firm",1
NTRS,Northern Trust to Deploy Electronic Foreign Exchange Pricing Engine in Singapore,1
CAN,"CANAAN ALERT: Bragar Eagel & Squire, P.C. Announces That a Class Action Lawsuit Has Been Filed Against Canaan, Inc. and Encourages Investors to Contact the Firm",1
EBON,"Investor Reminder: Kessler Topaz Meltzer & Check, LLP Reminds Investors of Securities Fraud Class Action Lawsuit Filed Against Ebang International Holdings Inc. - EBON",1
NEXCF,Nextech AR Solutions Corp. Reports Strong Fourth Quarter 2020 Results,1
ROOT,"ROOT EQUITY ALERT: Kessler Topaz Meltzer & Check, LLP Announces that a Securities Fraud Class Action Lawsuit was filed on Behalf of Investors of Root, Inc.",1
GOEV,"Deadline Reminder: Kessler Topaz Meltzer & Check, LLP Reminds Investors of Securities Fraud Class Action Lawsuit Filed Against Canoo Inc. (GOEV)",1
XPEV,XPeng and Zhongsheng Group Form Strategic Partnership to Accelerate Smart EV Adoption,1
GFN,United Rentals to Acquire General Finance Corporation,2
ZOM,Why Zomedica Stock Plunged Today,1
CKH,SEACOR HOLDINGS INC. ANNOUNCES COMPLETION OF TAKE PRIVATE TRANSACTION WITH AMERICAN INDUSTRIAL PARTNERS,1
CCL,"Cruise line CEOs met with White House Covid team, pressed for U.S. sailings to resume, sources say",3
MFNC,SHAREHOLDER ALERT: Monteverde & Associates PC Announces an Investigation of Mackinac Financial Corp. - MFNC,1
WRI,SHAREHOLDER ALERT: Monteverde & Associates PC Announces an Investigation of Weingarten Realty Investors - WRI,1
BLU,"ROSEN, A LEADING AND TRUSTED LAW FIRM, Encourages BELLUS Health Inc. Investors with Losses Exceeding $100K to Secure Counsel Before Important May 17 Deadline in Securities Class Action - BLU",1
ULTXF,Ultra Resources Inc. Updates Closing of Private Placement,1
CADE,SHAREHOLDER ALERT: Monteverde & Associates PC Announces an Investigation of Cadence Bancorporation - CADE,1
NUAN,"SHAREHOLDER ALERT: Monteverde & Associates PC Announces an Investigation of Nuance Communications, Inc. - NUAN",1
CAN,"CAN BREAKING NEWS: ROSEN, LEADING AND LONGSTANDING INVESTOR COUNSEL, Encourages Canaan Inc. Investors with Losses Exceeding $100K to Secure Counsel Before Important Deadline - CAN",1
CS,"Credit Suisse sued over risk exposure to Greensill Capital, Archegos",1
PTON,"Regulators urge safety recall of $4,295 Peloton treadmill after child dies",1
TWTR,"Panic In The Tweets, As Twitter Goes Down For A Time On Friday Evening",1
MRNA,Moderna CEO answers questions on COVID vaccine efficacy,1
LMNX,SHAREHOLDER ALERT: Monteverde & Associates PC Announces an Investigation of Luminex Corp. - LMNX,1
GOEV,"ROSEN, A TOP RANKED LAW FIRM, Encourages Canoo Inc. f/k/a Hennessy Capital Acquisition Corp. IV Investors with Losses over $100K to Secure Counsel Before Important Deadline in Securities Class Action - GOEV",1
QS,QuantumScape CEO defends its data after Scorpion Capital short report,1
MOJGF,Mojave Gold Announces Cancellation of Non-Brokered Private Placement,1
MOTNF,Clean Power Capital Announces Application to List its Common Shares on the NASDAQ Capital Market and Uplisting to NEO Exchange,1
SHRMF,"CHAMPIGNON BRANDS ALERT: Bragar Eagel & Squire, P.C. Announces That a Class Action Lawsuit Has Been Filed Against Champignon Brands, Inc. and Encourages Investors to Contact the Firm",1
INTZ,"INTRUSTION ALERT: Bragar Eagel & Squire, P.C. is Investigating Intrusion, Inc. on Behalf of Intrusion Stockholders and Encourages Investors to Contact the Firm",1
CHNO,ClassWorx Interview with Agro Capital Management Corp CEO Scott Benson Now Available on Youtube,1
COIN,"ARK buys another $64 million in Coinbase shares, sells $99.5 million of Tesla shares",2
CS,Robbins Geller Rudman & Dowd LLP Files Class Action Suit Against Credit Suisse Group AG,1
CLOV,Here's Why Clover Health Stock Soared Today,1
KWEMF,KWESST Updates SEDAR Filings,1
MLLGF,Mullen Group Ltd. Announces Accretive Acquisition,1
BABA,China's Digital Yuan Is Not A Threat For Alibaba And Tencent,2
LFMD,"LFMD CLASS ACTION NOTICE: Glancy Prongay & Murray LLP Files Securities Fraud Lawsuit Against LifeMD, Inc.",1
NGPHF,Northern Graphite Announces Grant of Stock Options,1
MILE,Metromile CEO on providing auto insurance for low-mileage drivers,1
AAAU,"Gold and silver prices spike, but can rally last? Jim Wyckoff on the long-awaited bull market",14
IBRX,ImmunityBio: Remaining Bullish As Global Vaccine Apparatus Continues To Misfire,1
PPTA,Perpetua Resources Reports Results of 2021 Annual General Meeting,1
AAPL,Apple and Microsoft: Buy Biggest Tech Stocks Ahead of Earnings?,2
SCM,Stellus Capital Investment Corporation Schedules First Quarter 2021 Financial Results Conference Call,1
BABA,China Takes On Jack Ma's Tech Empire,1
FKWL,INVESTOR ALERT: Law Offices of Howard G. Smith Announces the Filing of a Securities Class Action on Behalf of Franklin Wireless Corp. (FKWL) Investors,1
CPER,"Robert Friedland, Goldman Sachs light up copper",2
AMLP,This Fund's Monster Return Is Fueling 7.9% Dividends,1
COIN,"Cathie Wood's ARK Invest Buys Another 185,000 Shares of Coinbase",1
WM,3 Stocks From the Waste Management Industry to Watch Out For,1
AGCO,4 Top Stocks to Watch in a Prospering Farm Equipment Industry,4
O,Realty Income Corp. (O) Gains But Lags Market: What You Should Know,1
MOGO,Mogo Inc (MOGO) Stock Sinks As Market Gains: What You Should Know,1
NCLH,Norwegian Cruise Line (NCLH) Gains But Lags Market: What You Should Know,1
FSTR,L.B. Foster (FSTR) Gains But Lags Market: What You Should Know,1
FSLY,Fastly (FSLY) Stock Sinks As Market Gains: What You Should Know,1
TLRY,"Tilray, Inc. (TLRY) Outpaces Stock Market Gains: What You Should Know",1
PKX,Posco (PKX) Gains But Lags Market: What You Should Know,1
MDT,Medtronic plc (MDT) Conversation and Q&A with Medtronic's Cardiac Rhythm Management Business (Transcript),1
MELI,MercadoLibre (MELI) Stock Sinks As Market Gains: What You Should Know,1
AMT,American Tower (AMT) Outpaces Stock Market Gains: What You Should Know,1
VLVLY,Volvo Trucks hit by first UAW strike since 2008,3
MVBF,"MVB Financial: Where FinTech, Banking, And Growth Collide",1
NSANY,Nissan to focus on fuel-sipping technology and electrification in China,1
PTON,"Stop using Peloton treadmills if you have children or pets, US officials warn",1
CERN,"Parnassus Fund Exits Cerner, Waste Connections",2
AQST,"AQST INVESTOR NOTICE: ROSEN, NATIONALLY REGARDED INVESTOR COUNSEL, Encourages Aquestive Therapeutics, Inc. Investors with Losses in Excess of $100K to Secure Counsel Before Important Deadline in Securities Class Action - AQST",1
GME,'Roaring Kitty' acquires more shares in GameStop - Bloomberg,1
GGM,Got $300K? These Funds Could Let You Retire Now,3
CLABF,Core One Labs Negotiates Milestone Acquisition With Akome Biotech Ltd.,1
XLE,Energy Trounced All Other Sectors In The First Quarter,1
RNLSY,Renault seeks to generate 1 billion euros from 'circular economy' by 2030,2
BA,Air Force One subcontractor GDC countersues Boeing,1
RLAY,Why Relay Therapeutics (RLAY) Is Buying ZebiAI,1
BMBL,BMBL Stock Price: $77 Target By BTIG,1
QCOM,QCOM Stock Price: $150 Target By Evercore,1
PTON,"Consumer agency warns against Peloton Tread+ use, as company pushes back",1
CUT,Lumber Prices Rocket Higher As Demand Overwhelms Supply,2
TPCO,"Swiss billionaire Wyss decides to drop out of bid for Tribune - Bloomberg, NYT",1
LDOS,"Rosen, A Leading and Longstanding Firm, Encourages Leidos Holdings, Inc. Investors with Losses to Secure Counsel Before Important Deadline in Securities Class Action - LDOS",1
FSLY,Fastly: A Bit More Constructive After A Too Fast 2020,1
IQDAX,"Rosen, Trusted Investor Counsel, Encourages Infinity Q Diversified Alpha Fund Investors with Losses to Secure Counsel Before Important April 27 Deadline in Securities Class Action - IQDAX, IQDNX",2
PTON,"Peloton Tread Plus: CPSC warns it can kill kids, pets; says stop using it 'immediately'",1
BABA,"Jack Ma May Be Divesting His Stake In Ant Group, Giving Up Control: Reuters",1
PTON,U.S. agency tells consumers to stop using Peloton's Tread+ treadmill,1
UAVS,"ROSEN, SKILLED INVESTOR COUNSEL, Encourages AgEagle Aerial Systems, Inc. Investors to Secure Counsel Before Important April 27 Deadline in Securities Class Action - UAVS",1
DPHC,"RIDE Breaking Notice: Rosen, A Leading Law Firm, Encourages Lordstown Motors Corp. f/k/a DiamondPeak Holdings Corp. Investors with Losses to Secure Counsel Before Important Deadline in Securities Class Action - RIDE, DPHC",2
VLDR,"VLDR INVESTOR NOTICE: ROSEN, TRUSTED NATIONAL TRIAL COUNSEL, Encourages Velodyne Lidar, Inc. Investors with Losses to Secure Counsel Before Important Deadline in Securities Class Action - VLDR, VLDRW",1
CAN,"CAN CLASS ACTION ALERT: Kessler Topaz Meltzer & Check, LLP Announces a Securities Fraud Class Action Lawsuit Filed Against Canaan Inc.",1
VRM,"VRM EQUITY ALERT: Kessler Topaz Meltzer & Check, LLP Announces that a Securities Fraud Class Action Lawsuit was filed on Behalf of Investors of Vroom, Inc.",1
COIN,"Ark Funds Add More Coinbase, Offload Some Tesla",1
CURLF,How Do You Invest In Marijuana Stocks In 2021? 3 Top Cannabis Stocks For Your Watchlist,3
SHRMF,"Rosen, Global Investor Counsel, Encourages Champignon Brands Inc. Investors with Losses to Secure Counsel Before Important Deadline - SHRMF",1
APA,"APA FINAL DEADLINE: ROSEN, RESPECTED INVESTOR COUNSEL, Encourages APA Corporation f/k/a Apache Corporation Investors to Secure Counsel Before Important April 26 Deadline in Securities Class Action - APA",1
AAPL,Week 16 MDA Breakout Stocks - April 2021: Short-Term Picks To Give You An Edge,13
PLUG,"PLUG INVESTOR REMINDER: Kessler Topaz Meltzer & Check, LLP Announces Deadline in Securities Fraud Class Action Lawsuit Filed Against Plug Power, Inc.",1
EH,"EHANG DEADLINE MONDAY: HAGENS BERMAN Alerts EHang Holdings Limited (EH) Investors to April 19th Application Deadline in Securities Class Action, Company Releases Disappointing Earnings and Investors Should Contact the Firm",1
PTON,Peloton Tread+ owners told to stop using the treadmill in 'urgent warning',1
JPM,JPMorgan forced out trader who cooperated with fed probe: lawsuit,1
MSFT,Why Microsoft's new AI acquisition is a big deal,1
FUBO,"FUBO MONDAY DEADLINE: ROSEN, A LEADING LAW FIRM, Encourages fuboTV Inc. Investors to Secure Counsel Before Important April 19 Deadline in Securities Class Action - FUBO",1
TWTR,"Twitter outage continues for some users, problem appears to be global",1
GRNQ,Hot Penny Stocks To Buy Next Week? 3 Tech Stocks For Your Watch List,2
CYDY,"Kessler Topaz Meltzer & Check, LLP Reminds Investors of Deadline in Securities Fraud Class Action Against CytoDyn Inc.",1
INTC,Earnings Outlook: Intel earnings to give first look on how shortages are affecting U.S. chip makers in 2021,1
WEN,"Yahoo Finance Presents: Wendy's CEO talks chicken sandwich wars, breakfast launch, and inflation",1
PTON,Peloton Fights Federal Safety Recall Request Over Treadmill Linked To Child's Death,1
ETJ,ETJ: Hedge Your Exposure To An Overvalued Market With This CEF,1
SHAK,Is Shake Shack Stock a Buy?,1
CSCO,Should I buy Cisco shares after Wolfe Research raised its price target to $63?,1
APP,AppLovin: No Lovin' Yet,1
ASPU,Aspen University: Massive Bargain,1
ELTLF,Elementos reels in A$6.1 million in strongly supported placement to continue developing tin project,1
WTRG,Essential Utilities: Waiting For A Correction,1
TCOM,Trip.Com Has Recovered 100% From the Pandemic: CEO,1
TSLA,Two men killed as Tesla without anyone in the driver's seat crashes into tree and catches fire,1
COPHF,Creso Pharma buoyed by Halucenex entering LOI with leading nanotechnology company,1
GDOT,"Green Dot Stock Could Shoot 56% Higher, Says Analyst",1
MNST,Monster Beverage: Sensational Money-Making Monster But With High Valuation,1
BX,"ESR, GIC to buy Australian logistics property portfolio from Blackstone for $2.9 billion",1
CGMLF,Chalice Mining secures key properties covering all known Gonneville Intrusion mineralisation,1
VLVLY,Chinese ride-hailing giant DiDi Chuxing partners with Volvo - Roadshow,3
BOWX,WeWork's new stock-listing plan has echoes of its past,1
RNECY,Renesas Joins the Responsible Business Alliance to Enhance Supply Chain Sustainability,1
YNDX,Russia's Yandex Expands eGrocery To Paris And London,1
HYW,Hywin Holdings Announces Two Wins at WealthBriefingAsia Greater China Awards 2021,1
BNO,"Oil falls amid surging coronavirus infections in India, other countries",10
IDXX,IDEXX Laboratories: This Moat-Worthy Name Is Poised To Grow,1
OMER,Omeros: The Prize Is Nigh,1
GALXF,Australia's Orocobre buys Galaxy to make world's fifth-largest lithium company,2
CVAC,CureVac in Talks With U.S. Over Next-gen Covid Shot: CEO,1
NTR,Nutrien Announces Appointment of Mayo Schmidt as President and CEO,1
TM,Toyota Debuts All-Electric SUV Concept,1
BBBY,Bed Bath & Beyond CEO says company is poised for a strong 2021,1
KKR,KKR Invests in Adopt A Cow,1
DROOF,Deliveroo And UK Grocer Sainsbury's Expand Delivery Trial,2
NOK,Nokia to deploy indoor 5G small cells solutions with LG Uplus in South Korea,1
FFMGF,First Mining Gold: Patience Is Needed,1
TFC,There's Value In Truist Financial Corp.,1
FIII,Electric Last Mile: 2 Key Advantages Make It A Top Fleet EV Pick,2
ZTR,ZTR: This 10%+ Yielder Is Getting Pricey,1
BOWX,The Wall Street Journal: WeWork's new push to go public hasn't eased regulators' concerns,1
COIN,Coinbase Chief Executive Armstrong sold $291.8 million in shares on opening day,1
JNJ,The Wall Street Journal: J&J vaccine was paused due to fear blood clots could be mistreated,1
CWLDY,Australia's Crown Resorts offered $2.3 billion to buyout James Packer,1
BEP,Brookfield Renewable Partners: Buy The Dip,1
TSLA,Two die in Tesla car crash in Texas with ‘no one' in driver's seat – police,1
ABBV,2 Fast-Growing Dividend Aristocrats For A Rich Retirement,2
TSLA,"Tesla With ‘No One' Driving Crashes, Killing Two",1
EBON,"Penny Stocks, Bitcoin, Dogecoin Pop With Reddit Traders Looking To Buy",3
YELL,"Yellow Corporation Bringing New Jobs to Irving, Texas & America",1
ALIM,Week In Review: Sinopharm Transfers $4.6 Billion In Assets Including Two COVID-19 Vaccines,4
AMOM,An A.I.-Powered ETF? Look No Further than ‘AMOM',1
TSLA,Tesla Settles Lawsuit With Ex-Employee Over Autopilot Source Code,1
MANU,Leading European Football Clubs Announce Participation in New Super League Competition,1
TSLA,"2 Killed in Driverless Tesla Car Crash, Officials Say",1
TSLA,The Wall Street Journal: No one may have been in driver's seat in Tesla crash that killed 2 near Houston,1
PATH,"IPO Preview: UiPath Inc, KnowBe4, Zymergen, Latham Holdings Highlight Busy Week Of Offerings",7
AGC,Grab Holdings: Worth More Than Just 39.6 Billion Dollars,1
APP,INVESTIGATION ALERT: The Schall Law Firm Announces it is Investigating Claims Against AppLovin Corporation and Encourages Investors with Losses to Contact the Firm,1
GSK,Activist Investor Seeking to Shake Things Up at Glaxo,1
QS,QuantumScape: Why This SPAC Is Under Attack,1
SFBS,"ServisFirst Bancshares, Inc. (SFBS) CEO Tom Broughton on Q1 2021 Results - Earnings Call Transcript",1
GDRX,Why GoodRx Acquired Video Producer HealthiNation,1
UAVS,"ROSEN, A LEADING LAW FIRM, Encourages AgEagle Aerial Systems, Inc. Investors to Secure Counsel Before Important April 27 Deadline in Securities Class Action - UAVS",1
IBM,International Business Machines Corporation's (IBM) CEO Arvind Krishna on Q1 2021 Results - Earnings Call Transcript,1
FB,Facebook To Add Audio Features Similar To Clubhouse,1
ACAD,Pomerantz Law Firm Announces the Filing of a Class Action against Acadia Pharmaceuticals Inc. and Certain Officers - ACAD,1
LI,"Blue Lotus' Zhuang on China's Auto Industry, Chip Shortage",3
LYSCF,"Lynas achieves record selling prices, opts for 75% production in Malaysia",2
RIO,"Rio Tinto says grades drop copper output, wet weather lowers iron ore production",1
EBON,SHAREHOLDER ALERT: Pomerantz Law Firm Investigates Claims On Behalf of Investors of Ebang International Holdings Inc - EBON,1
SHRMF,"ROSEN, A LEADING LAW FIRM, Encourages Champignon Brands Inc. Investors with Losses to Secure Counsel Before Important Deadline - SHRMF",1
MSFT,Microsoft's Acquisition Of Nuance Reaffirms Its Interest In Dominating The $11+ Trillion Healthcare Market,2
WRI,"WEINGARTEN REALTY INVESTOR ALERT by the Former Attorney General of Louisiana: Kahn Swick & Foti, LLC Investigates Adequacy of Price and Process in Proposed Sale of Weingarten Realty Investors - WRI",1
JNJ,Doctor on J&J vaccine: ‘You have a much higher risk of getting a blood clot if you smoke',1
URI,"GENERAL FINANCE CORP INVESTOR ALERT by the Former Attorney General of Louisiana: Kahn Swick & Foti, LLC Investigates Adequacy of Price and Process in Proposed Sale of General Finance Corporation - GFN",1
TMO,"PPD INVESTOR ALERT by the Former Attorney General of Louisiana: Kahn Swick & Foti, LLC Investigates Adequacy of Price and Process in Proposed Sale of PPD, Inc. - PPD",1
KNL,"KNOLL INVESTOR ALERT by the Former Attorney General of Louisiana: Kahn Swick & Foti, LLC Investigates Adequacy of Price and Process in Proposed Sale of Knoll Inc. - KNL",1
SPCE,"Cathie Wood's ARK Invest Sells Over 590,000 Shares of Virgin Galactic",1
STL,"STERLING BANCORP INVESTOR ALERT by the Former Attorney General of Louisiana: Kahn Swick & Foti, LLC Investigates Adequacy of Price and Process in Proposed Sale of Sterling Bancorp - STL",1
SII,Sprott Inc. Files Early Warning Report in Respect of SRHI Inc.,1
AMRB,"AMERICAN RIVER BANKSHARES INVESTOR ALERT by the Former Attorney General of Louisiana: Kahn Swick & Foti, LLC Investigates Adequacy of Price and Process in Proposed Sale of American River Bankshares - AMRB",1
WDLF,"Social Life Network (OTC: WDLF) Files $40,000,000 Complaint in The United States District Court for the Southern District of California",1
UAL,United Airlines Earnings: What Happened,1
CYDY,"CYDY INVESTOR ALERT: ROSEN, TOP RANKED INVESTOR COUNSEL, Encourages CytoDyn Inc. Investors with Losses to Secure Counsel Before Important Deadline in Securities Class Action - CYDY",1
FB,"Facebook is joining the (very) crowded audio space with soundbites, live rooms and podcasts",1
TM,Toyota's electric SUV concept is a glimpse at the company's future,1
TSLA,Deadly Tesla crash: No driver was behind the wheel according to police,1
ZM,Zoom To Back Apps With $100 Million,1
AAPL,What To Watch For At Apple's Big Spring Event,1
BNO,"Oil prices rise on weaker dollar, likely drawdown in U.S. stocks",10
MPNGF,Meituan Raises $10 Billion to Fight Alibaba in Grocery Arena,1
LFMD,"LIFEMD ALERT: Bragar Eagel & Squire, P.C. Announces That a Class Action Lawsuit Has Been Filed Against LifeMD, Inc. and Encourages Investors to Contact the Firm",1
RMO,"ROMEO POWER ALERT: Bragar Eagel & Squire, P.C. Announces That a Class Action Lawsuit Has Been Filed Against Romeo Power, Inc. and Encourages Investors to Contact the Firm",1
TRKA,"Troika Media Group, Inc. Announces Pricing of $24.0 Million Initial Public Offering and Nasdaq Listing",1
STMH,Stem Holdings Announces Filing of Final Prospectus,1
GPRK,"GeoPark Limited Announces the Successful Early Tender Results of Its Cash Tender Offer for up to US$255,000,000 of Its 6.500% Senior Notes Due 2024 and Solicitation of Consents for Proposed Amendments to the Related Indenture",1
UAL,"United stock falls after $1.4B loss as CEO promises a ""clear path to profitability""",1
CAN,CAN SHAREHOLDER FILING DEADLINE: Bernstein Liebhard LLP Reminds Investors of the Deadline to File a Lead Plaintiff Motion in a Securities Class Action Against Canaan Inc.,1
TSLA,Police to search Tesla after vehicle crash that killed two people,1
UBER,Uber Posts Record March And Unprecedented Signing Bonus For Drivers,1
CS,"CREDIT SUISSE ALERT: Bragar Eagel & Squire, P.C. Announces That a Class Action Lawsuit Has Been Filed Against Credit Suisse Group AG and Encourages Investors to Contact the Firm",1
FKWL,"FRANKLIN WIRELESS ALERT: Bragar Eagel & Squire, P.C. Announces That a Class Action Lawsuit Has Been Filed Against Franklin Wireless Corp. and Encourages Investors to Contact the Firm",1
INTZ,"INTRUSION ALERT: Bragar Eagel & Squire, P.C. Announces That a Class Action Lawsuit Has Been Filed Against Intrusion, Inc. and Encourages Investors to Contact the Firm",1
